Entry	Entry Name	Gene Names	Protein names	Pathway	Interacts with
Q46821	UACT_ECOLI	uacT ygfU b2888 JW5470	Uric acid transporter UacT		
Q46822	IDI_ECOLI	idi ygfV b2889 JW2857	Isopentenyl-diphosphate Delta-isomerase (IPP isomerase) (EC 5.3.3.2) (IPP:DMAPP isomerase) (Isopentenyl pyrophosphate isomerase)	PATHWAY: Isoprenoid biosynthesis; dimethylallyl diphosphate biosynthesis; dimethylallyl diphosphate from isopentenyl diphosphate: step 1/1. {ECO:0000305|PubMed:10419945}.	
Q46839	GLCA_ECOLI	glcA yghK b2975 JW2942	Glycolate permease GlcA		
Q46845	YGHU_ECOLI	yghU b2989 JW5492	Disulfide-bond oxidoreductase YghU (EC 1.8.4.-) (GSH-dependent disulfide-bond oxidoreductase YghU) (GST N2-2) (Organic hydroperoxidase) (EC 1.11.1.-)		
Q46851	GPR_ECOLI	gpr mgrA yghZ b3001 JW2970	L-glyceraldehyde 3-phosphate reductase (L-GAP reductase) (EC 1.1.1.-) (AKR14A1) (Aldo-keto reductase YqhE) (EC 1.1.1.2) (Methylglyoxal reductase Gpr) (EC 1.1.1.-)		
Q46856	YQHD_ECOLI	yqhD b3011 JW2978	NADPH-dependent aldehyde reductase YqhD (EC 1.1.1.2) (Alcohol dehydrogenase YqhD) (Alcohol/aldehyde oxidoreductase YqhD) (Broad-range ADH)		
Q46857	DKGA_ECOLI	dkgA yqhE b3012 JW5499	Methylglyoxal reductase DkgA (EC 1.1.1.-) (2,5-diketo-D-gluconic acid reductase A) (2,5-DKG reductase A) (2,5-DKGR A) (25DKGR-A) (EC 1.1.1.346) (AKR5C) (Aldo-keto reductase YqhE) (EC 1.1.1.2) (Beta-keto ester reductase)		
Q46864	MQSA_ECOLI	mqsA ygiT b3021 JW2989	Antitoxin MqsA		P69222; P07000; P0ACQ0; P0A7L8; P0AGB6; P0AAU7
Q46865	MQSR_ECOLI	mqsR ygiU b3022 JW2990	mRNA interferase toxin MqsR (EC 3.1.-.-) (Endoribonuclease MqsR) (Motility quorum-sensing regulator MqsR) (Toxin MqsR)		
Q46868	UBIK_ECOLI	ubiK yqiC b3042 JW5505	Ubiquinone biosynthesis accessory factor UbiK	PATHWAY: Cofactor biosynthesis; ubiquinone biosynthesis. {ECO:0000255|HAMAP-Rule:MF_02216, ECO:0000305|PubMed:28559279}.	
Q46871	YQJH_ECOLI	yqjH b3070 JW3041	NADPH-dependent ferric-chelate reductase (EC 1.16.1.9) (Ferric siderophore reductase)		
Q46877	NORV_ECOLI	norV flrD ygaI ygaJ ygaK b2710 JW2680	Anaerobic nitric oxide reductase flavorubredoxin (FlRd) (FlavoRb)	PATHWAY: Nitrogen metabolism; nitric oxide reduction.	Q46877
Q46893	ISPD_ECOLI	ispD ygbP b2747 JW2717	2-C-methyl-D-erythritol 4-phosphate cytidylyltransferase (EC 2.7.7.60) (4-diphosphocytidyl-2C-methyl-D-erythritol synthase) (CDP-ME synthase) (MEP cytidylyltransferase) (MCT)	PATHWAY: Isoprenoid biosynthesis; isopentenyl diphosphate biosynthesis via DXP pathway; isopentenyl diphosphate from 1-deoxy-D-xylulose 5-phosphate: step 2/6.	
Q46896	CAS1_ECOLI	ygbT cas1 b2755 JW2725	CRISPR-associated endonuclease Cas1 (EC 3.1.-.-)		P76339; P45956; Q46896
Q46897	CAS6_ECOLI	casE cas6e ygcH b2756 JW2726	CRISPR system Cascade subunit CasE (EC 3.1.-.-) (CasE endoRNase) (crRNA endonuclease)		
Q46898	CAS5_ECOLI	casD cas5 ygcI b2757 JW5844	CRISPR system Cascade subunit CasD		
Q46899	CASC_ECOLI	casC cas4 cse4 ygcJ b2758 JW2728	CRISPR system Cascade subunit CasC		
Q46901	CSE1_ECOLI	casA cse1 ygcL b2760 JW2730	CRISPR system Cascade subunit CasA (CRISPR type I-E/Ecoli-associated protein CasA/Cse1) (CRISPR-associated protein CasA/Cse1)		
Q46920	QUEF_ECOLI	queF yqcD b2794 JW2765	NADPH-dependent 7-cyano-7-deazaguanine reductase (EC 1.7.1.13) (7-cyano-7-carbaguanine reductase) (NADPH-dependent nitrile oxidoreductase) (PreQ(0) reductase)	PATHWAY: tRNA modification; tRNA-queuosine biosynthesis.	
Q46925	CSDA_ECOLI	csdA ygdJ b2810 JW2781	Cysteine desulfurase CsdA (EC 2.8.1.7) (Cysteine sulfinate desulfinase) (CSD) (EC 3.13.1.-) (Selenocysteine lyase) (EC 4.4.1.16)		P0AGF2; P15877; Q46927
Q46927	TCDA_ECOLI	tcdA csdL ygdL b2812 JW2783	tRNA threonylcarbamoyladenosine dehydratase (EC 6.1.-.-) (t(6)A37 dehydratase)		Q46925; P0AGF2
Q46938	KDUI_ECOLI	kduI yqeE b2843 JW2811	4-deoxy-L-threo-5-hexosulose-uronate ketol-isomerase (EC 5.3.1.17) (5-keto-4-deoxyuronate isomerase) (DKI isomerase)	PATHWAY: Glycan metabolism; pectin degradation; 2-dehydro-3-deoxy-D-gluconate from pectin: step 4/5.	
Q46948	YAJL_ECOLI	yajL thiJ b0424 JW5057	Protein/nucleic acid deglycase 3 (EC 3.1.2.-) (EC 3.5.1.-) (EC 3.5.1.124) (Chaperone protein YajL) (Maillard deglycase)		
Q47146	FADE_ECOLI	fadE yafH b0221 JW5020	Acyl-coenzyme A dehydrogenase (ACDH) (Acyl-CoA dehydrogenase) (EC 1.3.8.7) (EC 1.3.8.8)	PATHWAY: Lipid metabolism; fatty acid beta-oxidation. {ECO:0000269|PubMed:12057976}.	
Q47149	YAFQ_ECOLI	yafQ b0225 JW0215	mRNA interferase toxin YafQ (EC 3.1.-.-) (Endoribonuclease YafQ) (Toxin YafQ)		
Q47150	DINJ_ECOLI	dinJ b0226 JW0216	Antitoxin DinJ		
Q47152	RAYT_ECOLI	rayT TnpAREP yafM b0228 JW0218	REP-associated tyrosine transposase		
Q47155	DPO4_ECOLI	dinB dinP b0231 JW0221	DNA polymerase IV (Pol IV) (EC 2.7.7.7) (Translesion synthesis polymerase IV) (TSL polymerase IV)		P0A988; P0AFF6
Q47208	ALLF_ECOLI	allF fdrA ylbD b0518 JW0506	Oxamate carbamoyltransferase subunit AllF (OXTCase subunit AllF) (EC 2.1.3.5) (Oxamic transcarbamylase subunit AllF)	PATHWAY: Nitrogen metabolism; (S)-allantoin degradation. {ECO:0000269|PubMed:38888336}.	
Q47319	TAPT_ECOLI	tapT tuaA yfiP b2583 JW5409	tRNA-uridine aminocarboxypropyltransferase (EC 2.5.1.25) (SAM-dependent 3-amino-3-carboxypropyl transferase) (tRNA U47 acp transferase A) (tRNA aminocarboxypropyltransferase)		
Q47377	ARNE_ECOLI	arnE pmrL yfbW b4544 JW2252	Probable 4-amino-4-deoxy-L-arabinose-phosphoundecaprenol flippase subunit ArnE (L-Ara4N-phosphoundecaprenol flippase subunit ArnE) (Undecaprenyl phosphate-aminoarabinose flippase subunit ArnE)	PATHWAY: Bacterial outer membrane biogenesis; lipopolysaccharide biosynthesis.	
Q57261	TRUD_ECOLI	truD ygbO b2745 JW2715	tRNA pseudouridine synthase D (EC 5.4.99.27) (tRNA pseudouridine(13) synthase) (tRNA pseudouridylate synthase D) (tRNA-uridine isomerase D)		
Q59385	COPA_ECOLI	copA atcU f834 ybaR b0484 JW0473	Copper-exporting P-type ATPase (EC 7.2.2.8) (Copper-exporting P-type ATPase A) (Cu(+)-exporting ATPase) (Soluble copper chaperone CopA(Z))		
Q6BF16	DGOA_ECOLI	dgoA yidU b4477 JW5628	2-dehydro-3-deoxy-6-phosphogalactonate aldolase (EC 4.1.2.21) (2-oxo-3-deoxygalactonate 6-phosphate aldolase) (6-phospho-2-dehydro-3-deoxygalactonate aldolase) (6-phospho-2-keto-3-deoxygalactonate aldolase) (KDPGal aldolase)	PATHWAY: Carbohydrate acid metabolism; D-galactonate degradation; D-glyceraldehyde 3-phosphate and pyruvate from D-galactonate: step 3/3.	
Q6BF17	DGOD_ECOLI	dgoD yidU b4478 JW5629	D-galactonate dehydratase (GalD) (EC 4.2.1.6)	PATHWAY: Carbohydrate acid metabolism; D-galactonate degradation; D-glyceraldehyde 3-phosphate and pyruvate from D-galactonate: step 1/3. {ECO:0000269|PubMed:324806}.	
Q93K97	ADPP_ECOLI	nudF aspP yqiE yzzG b3034 JW3002	ADP-ribose pyrophosphatase (EC 3.6.1.13) (ADP-ribose diphosphatase) (ADP-ribose phosphohydrolase) (ASPPase) (Adenosine diphosphoribose pyrophosphatase) (ADPR-PPase)		P37678
A5A627	TISB_ECOLI	tisB ysdB b4618 JW3649	Small toxic protein TisB (LexA-regulated protein TisB)		
P00547	KHSE_ECOLI	thrB b0003 JW0002	Homoserine kinase (HK) (HSK) (EC 2.7.1.39)	PATHWAY: Amino-acid biosynthesis; L-threonine biosynthesis; L-threonine from L-aspartate: step 4/5.	
P00816	CYNS_ECOLI	cynS cnt b0340 JW0331	Cyanate hydratase (Cyanase) (EC 4.2.1.104) (Cyanate hydrolase) (Cyanate lyase)		
P00887	AROH_ECOLI	aroH b1704 JW1694	Phospho-2-dehydro-3-deoxyheptonate aldolase, Trp-sensitive (EC 2.5.1.54) (3-deoxy-D-arabino-heptulosonate 7-phosphate synthase) (DAHP synthase) (Phospho-2-keto-3-deoxyheptonate aldolase)	PATHWAY: Metabolic intermediate biosynthesis; chorismate biosynthesis; chorismate from D-erythrose 4-phosphate and phosphoenolpyruvate: step 1/7.	P0A6F5
P00895	TRPE_ECOLI	trpE b1264 JW1256	Anthranilate synthase component 1 (AS) (ASI) (EC 4.1.3.27)	PATHWAY: Amino-acid biosynthesis; L-tryptophan biosynthesis; L-tryptophan from chorismate: step 1/5.	
P00909	TRPC_ECOLI	trpC trpF b1262 JW1254	Tryptophan biosynthesis protein TrpCF [Includes: Indole-3-glycerol phosphate synthase (IGPS) (EC 4.1.1.48); N-(5'-phospho-ribosyl)anthranilate isomerase (PRAI) (EC 5.3.1.24)]	PATHWAY: Amino-acid biosynthesis; L-tryptophan biosynthesis; L-tryptophan from chorismate: step 3/5.; PATHWAY: Amino-acid biosynthesis; L-tryptophan biosynthesis; L-tryptophan from chorismate: step 4/5.	
P00934	THRC_ECOLI	thrC b0004 JW0003	Threonine synthase (TS) (EC 4.2.3.1)	PATHWAY: Amino-acid biosynthesis; L-threonine biosynthesis; L-threonine from L-aspartate: step 5/5.	
P00944	XYLA_ECOLI	xylA b3565 JW3537	Xylose isomerase (EC 5.3.1.5) (D-xylulose keto-isomerase)		
P00954	SYW_ECOLI	trpS b3384 JW3347	Tryptophan--tRNA ligase (EC 6.1.1.2) (Tryptophanyl-tRNA synthetase) (TrpRS)		
P00961	SYGB_ECOLI	glyS glyS(B) b3559 JW3530	Glycine--tRNA ligase beta subunit (EC 6.1.1.14) (Glycyl-tRNA synthetase beta subunit) (GlyRS)		P00960
P02413	RL15_ECOLI	rplO b3301 JW3263	Large ribosomal subunit protein uL15 (50S ribosomal protein L15)		P36979
P02924	ARAF_ECOLI	araF b1901 JW1889	L-arabinose-binding periplasmic protein (ABP)		
P02932	PHOE_ECOLI	phoE ompE b0241 JW0231	Outer membrane porin PhoE (Outer membrane pore protein E)		
P03014	PINE_ECOLI	pinE pin b1158 JW1144	Serine recombinase PinE (EC 3.1.22.-) (EC 6.5.1.-) (DNA-invertase PinE) (DNA-invertase from lambdoid prophage e14) (Site-specific recombinase PinE)		
P03024	GALR_ECOLI	galR b2837 JW2805	HTH-type transcriptional regulator GalR (Galactose operon repressor)	PATHWAY: Carbohydrate metabolism; galactose metabolism [regulation].	P03024; P25748
P03817	MIOC_ECOLI	mioC yieB b3742 JW3720	Protein MioC		
P04335	FRSA_ECOLI	frsA yafA b0239 JW0229	Esterase FrsA (EC 3.1.1.1) (Fermentation/respiration switch protein)		
P04816	LIVK_ECOLI	livK b3458 JW3423	Leucine-specific-binding protein (L-BP) (LS-BP)		
P04951	KDSB_ECOLI	kdsB b0918 JW0901	3-deoxy-manno-octulosonate cytidylyltransferase (EC 2.7.7.38) (CMP-2-keto-3-deoxyoctulosonic acid synthase) (CKS) (CMP-KDO synthase)	PATHWAY: Nucleotide-sugar biosynthesis; CMP-3-deoxy-D-manno-octulosonate biosynthesis; CMP-3-deoxy-D-manno-octulosonate from 3-deoxy-D-manno-octulosonate and CTP: step 1/1. {ECO:0000255|HAMAP-Rule:MF_00057}.; PATHWAY: Bacterial outer membrane biogenesis; lipopolysaccharide biosynthesis. {ECO:0000255|HAMAP-Rule:MF_00057}.	P67430; P0ACU2; P0CE47
P05100	3MG1_ECOLI	tag b3549 JW3518	DNA-3-methyladenine glycosylase 1 (EC 3.2.2.20) (3-methyladenine-DNA glycosylase I, constitutive) (TAG I) (DNA-3-methyladenine glycosidase I) (DNA-3-methyladenine glycosylase I)		P0AFG8
P05459	PDXB_ECOLI	pdxB b2320 JW2317	Erythronate-4-phosphate dehydrogenase (EC 1.1.1.290)	PATHWAY: Cofactor biosynthesis; pyridoxine 5'-phosphate biosynthesis; pyridoxine 5'-phosphate from D-erythrose 4-phosphate: step 2/5. {ECO:0000255|HAMAP-Rule:MF_01825, ECO:0000269|PubMed:8595869}.	
P05706	PTHA_ECOLI	srlB gutB b2704 JW2673	PTS system glucitol/sorbitol-specific EIIA component (EIIA-Gut) (EIII-Gut) (Glucitol/sorbitol-specific phosphotransferase enzyme IIA component)		
P05707	SRLD_ECOLI	srlD gutD b2705 JW2674	Sorbitol-6-phosphate 2-dehydrogenase (EC 1.1.1.140) (Glucitol-6-phosphate dehydrogenase) (Ketosephosphate reductase)	PATHWAY: Carbohydrate metabolism; D-sorbitol degradation; D-fructose 6-phosphate from D-sorbitol 6-phosphate: step 1/1. {ECO:0000305|PubMed:6384188}.	
P05719	T1SK_ECOLI	hsdS hss b4348 JW4311	Type I restriction enzyme EcoKI specificity subunit (S protein) (Type I specificity subunit S.EcoKI) (S.EcoKI) (Type-1 restriction enzyme EcoKI specificity subunit)		
P05847	TTDA_ECOLI	ttdA ygjA b3061 JW3033	L(+)-tartrate dehydratase subunit alpha (L-TTD alpha) (EC 4.2.1.32)		P0ACL0
P06610	BTUE_ECOLI	btuE b1710 JW1700	Thioredoxin/glutathione peroxidase BtuE (EC 1.11.1.24) (EC 1.11.1.9)		
P06720	AGAL_ECOLI	melA mel-7 b4119 JW4080	Alpha-galactosidase (EC 3.2.1.22) (Melibiase)		
P06864	BGA2_ECOLI	ebgA b3076 JW5511	Evolved beta-galactosidase subunit alpha (Beta-gal) (EC 3.2.1.23) (Lactase)		P32053
P06986	HIS8_ECOLI	hisC b2021 JW2003	Histidinol-phosphate aminotransferase (EC 2.6.1.9) (Imidazole acetol-phosphate transaminase) (HPAT) (HspAT)	PATHWAY: Amino-acid biosynthesis; L-histidine biosynthesis; L-histidine from 5-phospho-alpha-D-ribose 1-diphosphate: step 7/9. {ECO:0000269|PubMed:2999081}.	
P06987	HIS7_ECOLI	hisB b2022 JW2004	Histidine biosynthesis bifunctional protein HisB [Includes: Histidinol-phosphatase (EC 3.1.3.15); Imidazoleglycerol-phosphate dehydratase (IGPD) (EC 4.2.1.19)]	PATHWAY: Amino-acid biosynthesis; L-histidine biosynthesis; L-histidine from 5-phospho-alpha-D-ribose 1-diphosphate: step 6/9. {ECO:0000255|HAMAP-Rule:MF_01022}.; PATHWAY: Amino-acid biosynthesis; L-histidine biosynthesis; L-histidine from 5-phospho-alpha-D-ribose 1-diphosphate: step 8/9. {ECO:0000255|HAMAP-Rule:MF_01022}.	P0ACA7; P06987
P06989	HIS2_ECOLI	hisI hisIE b2026 JW2008	Histidine biosynthesis bifunctional protein HisIE [Includes: Phosphoribosyl-AMP cyclohydrolase (PRA-CH) (EC 3.5.4.19); Phosphoribosyl-ATP pyrophosphatase (PRA-PH) (EC 3.6.1.31)]	PATHWAY: Amino-acid biosynthesis; L-histidine biosynthesis; L-histidine from 5-phospho-alpha-D-ribose 1-diphosphate: step 2/9.; PATHWAY: Amino-acid biosynthesis; L-histidine biosynthesis; L-histidine from 5-phospho-alpha-D-ribose 1-diphosphate: step 3/9.	
P07018	MCP4_ECOLI	tap b1885 JW1874	Methyl-accepting chemotaxis protein IV (MCP-IV) (Dipeptide chemoreceptor protein)		
P07023	TYRA_ECOLI	tyrA b2600 JW2581	T-protein [Includes: Chorismate mutase (CM) (EC 5.4.99.5); Prephenate dehydrogenase (PDH) (EC 1.3.1.12)]	PATHWAY: Amino-acid biosynthesis; L-tyrosine biosynthesis; (4-hydroxyphenyl)pyruvate from prephenate (NAD(+) route): step 1/1.; PATHWAY: Metabolic intermediate biosynthesis; prephenate biosynthesis; prephenate from chorismate: step 1/1.	
P07109	HISP_ECOLI	hisP b2306 JW2303	Histidine/lysine/arginine/ornithine transport ATP-binding protein HisP (EC 7.4.2.1)		
P07364	CHER_ECOLI	cheR cheX b1884 JW1873	Chemotaxis protein methyltransferase (EC 2.1.1.80)		
P07650	TYPH_ECOLI	deoA tpp ttg b4382 JW4345	Thymidine phosphorylase (EC 2.4.2.4) (TdRPase)	PATHWAY: Pyrimidine metabolism; dTMP biosynthesis via salvage pathway; dTMP from thymine: step 1/2.	
P07762	GLGB_ECOLI	glgB b3432 JW3395	1,4-alpha-glucan branching enzyme GlgB (EC 2.4.1.18) (1,4-alpha-D-glucan:1,4-alpha-D-glucan 6-glucosyl-transferase) (Alpha-(1->4)-glucan branching enzyme) (Glycogen branching enzyme) (BE)	PATHWAY: Glycan biosynthesis; glycogen biosynthesis.	
P07813	SYL_ECOLI	leuS b0642 JW0637	Leucine--tRNA ligase (EC 6.1.1.4) (Leucyl-tRNA synthetase) (LeuRS)		P33129; P15042
P08178	PUR5_ECOLI	purM purG b2499 JW2484	Phosphoribosylformylglycinamidine cyclo-ligase (EC 6.3.3.1) (AIR synthase) (AIRS) (Phosphoribosyl-aminoimidazole synthetase)	PATHWAY: Purine metabolism; IMP biosynthesis via de novo pathway; 5-amino-1-(5-phospho-D-ribosyl)imidazole from N(2)-formyl-N(1)-(5-phospho-D-ribosyl)glycinamide: step 2/2. {ECO:0000305|PubMed:3530323}.	
P08189	FIMF_ECOLI	fimF b4318 JW4281	Protein FimF		
P08190	FIMG_ECOLI	fimG b4319 JW4282	Protein FimG		P31697
P08194	GLPT_ECOLI	glpT b2240 JW2234	Glycerol-3-phosphate transporter (G-3-P transporter) (G-3-P permease)		
P08204	ARAB_ECOLI	araB b0063 JW0062	Ribulokinase (EC 2.7.1.16)	PATHWAY: Carbohydrate degradation; L-arabinose degradation via L-ribulose; D-xylulose 5-phosphate from L-arabinose (bacterial route): step 2/3.	
P08331	CPDB_ECOLI	cpdB b4213 JW4171	2',3'-cyclic-nucleotide 2'-phosphodiesterase/3'-nucleotidase (EC 3.1.3.6) (EC 3.1.4.16)		
P08365	CHPS_ECOLI	chpS chpBI yjfB b4224 JW5750	Antitoxin ChpS		P0A9M8
P08368	CREB_ECOLI	creB yjjE b4398 JW4361	Transcriptional regulatory protein CreB		P08368
P08400	PHOR_ECOLI	phoR nmpB b0400 JW0390	Phosphate regulon sensor protein PhoR (EC 2.7.13.3)		
P08401	CREC_ECOLI	creC phoM b4399 JW4362	Sensor protein CreC (EC 2.7.13.3)		
P08722	PTV3B_ECOLI	bglF bglC bglS b3722 JW3700	PTS system beta-glucoside-specific EIIBCA component (EIIBCA-Bgl) (EII-Bgl) [Includes: Beta-glucoside-specific phosphotransferase enzyme IIB component (EC 2.7.1.-) (PTS system beta-glucoside-specific EIIB component); Beta-glucoside permease IIC component (PTS system beta-glucoside-specific EIIC component); Beta-glucoside-specific phosphotransferase enzyme IIA component (PTS system beta-glucoside-specific EIIA component)]		
P08957	T1MK_ECOLI	hsdM hsm b4349 JW4312	Type I restriction enzyme EcoKI methylase subunit (M protein) (EC 2.1.1.72) (Type I methyltransferase M.EcoKI) (M.EcoKI)		P12295
P09053	AVTA_ECOLI	avtA b3572 JW5652	Valine--pyruvate aminotransferase (EC 2.6.1.66) (Alanine--valine transaminase) (Transaminase C)		
P09151	LEU1_ECOLI	leuA b0074 JW0073	2-isopropylmalate synthase (EC 2.3.3.13) (Alpha-IPM synthase) (Alpha-isopropylmalate synthase)	PATHWAY: Amino-acid biosynthesis; L-leucine biosynthesis; L-leucine from 3-methyl-2-oxobutanoate: step 1/4. {ECO:0000255|HAMAP-Rule:MF_01025}.	
P09184	VSR_ECOLI	vsr b1960 JW1943	DNA mismatch endonuclease Vsr (EC 3.1.-.-) (Type II nicking enzyme) (V.EcoKDcm) (Very short patch repair protein) (Vsr mismatch endonuclease)		P23367
P09378	RHAR_ECOLI	rhaR rhaC1 b3906 JW3877	HTH-type transcriptional activator RhaR (L-rhamnose operon transcriptional activator RhaR)		
P09549	DEDD_ECOLI	dedD b2314 JW5378	Cell division protein DedD		
P09551	ARGT_ECOLI	argT b2310 JW2307	Lysine/arginine/ornithine-binding periplasmic protein (LAO-binding protein)		
P09836	UHPC_ECOLI	uhpC b3667 JW3642	Membrane sensor protein UhpC		
P0A6A6	LEUC_ECOLI	leuC b0072 JW0071	3-isopropylmalate dehydratase large subunit (EC 4.2.1.33) (Alpha-IPM isomerase) (IPMI) (Isopropylmalate isomerase)	PATHWAY: Amino-acid biosynthesis; L-leucine biosynthesis; L-leucine from 3-methyl-2-oxobutanoate: step 2/4. {ECO:0000255|HAMAP-Rule:MF_01026}.	P30126
P0A6C5	ARGA_ECOLI	argA b2818 JW2786	Amino-acid acetyltransferase (EC 2.3.1.1) (N-acetylglutamate synthase) (AGS) (NAGS)	PATHWAY: Amino-acid biosynthesis; L-arginine biosynthesis; N(2)-acetyl-L-ornithine from L-glutamate: step 1/4. {ECO:0000269|PubMed:16890}.	
P0A6E9	BIOD2_ECOLI	bioD2 ynfK b1593 JW5264	ATP-dependent dethiobiotin synthetase BioD 2 (EC 6.3.3.3) (DTB synthetase 2) (DTBS 2) (Dethiobiotin synthase 2)	PATHWAY: Cofactor biosynthesis; biotin biosynthesis; biotin from 7,8-diaminononanoate: step 1/2. {ECO:0000255|HAMAP-Rule:MF_00336}.	
P0A6I3	COAA_ECOLI	coaA panK rts b3974 JW3942	Pantothenate kinase (EC 2.7.1.33) (Pantothenic acid kinase) (Rts protein)	PATHWAY: Cofactor biosynthesis; coenzyme A biosynthesis; CoA from (R)-pantothenate: step 1/5.	
P0A6I9	COAE_ECOLI	coaE yacE b0103 JW0100	Dephospho-CoA kinase (EC 2.7.1.24) (Dephosphocoenzyme A kinase)	PATHWAY: Cofactor biosynthesis; coenzyme A biosynthesis; CoA from (R)-pantothenate: step 5/5. {ECO:0000255|HAMAP-Rule:MF_00376, ECO:0000305|PubMed:11292795}.	
P0A6J1	CYSC_ECOLI	cysC b2750 JW2720	Adenylyl-sulfate kinase (EC 2.7.1.25) (APS kinase) (ATP adenosine-5'-phosphosulfate 3'-phosphotransferase) (Adenosine-5'-phosphosulfate kinase)	PATHWAY: Sulfur metabolism; hydrogen sulfide biosynthesis; sulfite from sulfate: step 2/3. {ECO:0000305|PubMed:1332767}.	
P0A6J8	DDLA_ECOLI	ddlA b0381 JW0372	D-alanine--D-alanine ligase A (EC 6.3.2.4) (D-Ala-D-Ala ligase A) (D-alanylalanine synthetase A)	PATHWAY: Cell wall biogenesis; peptidoglycan biosynthesis.	
P0A6L9	HSCB_ECOLI	hscB yfhE b2527 JW2511	Co-chaperone protein HscB (Hsc20)		
P0A6S3	FLGI_ECOLI	flgI fla FIX flaM b1080 JW1067	Flagellar P-ring protein (Basal body P-ring protein)		
P0A6T9	GCSH_ECOLI	gcvH b2904 JW2872	Glycine cleavage system H protein		
P0A6U8	GLGA_ECOLI	glgA b3429 JW3392	Glycogen synthase (EC 2.4.1.21) (Starch [bacterial glycogen] synthase)	PATHWAY: Glycan biosynthesis; glycogen biosynthesis.	
P0A6V8	GLK_ECOLI	glk b2388 JW2385	Glucokinase (EC 2.7.1.2) (Glucose kinase)		
P0A6W9	GSH1_ECOLI	gshA gsh-I b2688 JW2663	Glutamate--cysteine ligase (EC 6.3.2.2) (Gamma-ECS) (GCS) (Gamma-glutamylcysteine synthetase)	PATHWAY: Sulfur metabolism; glutathione biosynthesis; glutathione from L-cysteine and L-glutamate: step 1/2.	
P0A6Z1	HSCA_ECOLI	hscA hsc b2526 JW2510	Chaperone protein HscA (Hsc66)		
P0A734	MINE_ECOLI	minE b1174 JW1163	Cell division topological specificity factor		P0AEZ3; P0A734
P0A752	NADD_ECOLI	nadD ybeN b0639 JW0634	Nicotinate-nucleotide adenylyltransferase (EC 2.7.7.18) (Deamido-NAD(+) diphosphorylase) (Deamido-NAD(+) pyrophosphorylase) (Nicotinate mononucleotide adenylyltransferase) (NaMN adenylyltransferase)	PATHWAY: Cofactor biosynthesis; NAD(+) biosynthesis; deamido-NAD(+) from nicotinate D-ribonucleotide: step 1/1.	
P0A756	KEFG_ECOLI	kefG yheR b3351 JW3314	Glutathione-regulated potassium-efflux system ancillary protein KefG (Putative quinone oxidoreductase KefG) (EC 1.6.5.2)		
P0A761	NANE_ECOLI	nanE yhcJ b3223 JW3192	Putative N-acetylmannosamine-6-phosphate 2-epimerase (EC 5.1.3.9) (ManNAc-6-P epimerase)	PATHWAY: Amino-sugar metabolism; N-acetylneuraminate degradation; D-fructose 6-phosphate from N-acetylneuraminate: step 3/5.	P06709; P76316
P0A766	RSXA_ECOLI	rsxA rnfA ydgL b1627 JW1619	Ion-translocating oxidoreductase complex subunit A (EC 7.-.-.-) (Rsx electron transport complex subunit A)		
P0A780	NUSB_ECOLI	nusB groNB ssyB b0416 JW0406	Transcription antitermination protein NusB (Antitermination factor NusB) (N utilization substance protein B)		P0A7R5
P0A7A5	PIMT_ECOLI	pcm b2743 JW2713	Protein-L-isoaspartate O-methyltransferase (EC 2.1.1.77) (L-isoaspartyl protein carboxyl methyltransferase) (Protein L-isoaspartyl methyltransferase) (Protein-beta-aspartate methyltransferase) (PIMT)		
P0A7D7	PUR7_ECOLI	purC b2476 JW2461	Phosphoribosylaminoimidazole-succinocarboxamide synthase (EC 6.3.2.6) (SAICAR synthetase)	PATHWAY: Purine metabolism; IMP biosynthesis via de novo pathway; 5-amino-1-(5-phospho-D-ribosyl)imidazole-4-carboxamide from 5-amino-1-(5-phospho-D-ribosyl)imidazole-4-carboxylate: step 1/2.	
P0A7F3	PYRI_ECOLI	pyrI b4244 JW4203	Aspartate carbamoyltransferase regulatory chain		P0A786
P0A7H3	RECO_ECOLI	recO b2565 JW2549	DNA repair protein RecO (Recombination protein O)		P0A7H6; P0AGE0
P0A7I0	RF1_ECOLI	prfA sueB uar b1211 JW1202	Peptide chain release factor RF1 (RF-1)		
P0A7N1	RL31B_ECOLI	ykgM rpmE2 b0296 JW5035	Large ribosomal subunit protein bL31B (50S ribosomal protein L31 type B)		
P0A7Q1	RL35_ECOLI	rpmI b1717 JW1707	Large ribosomal subunit protein bL35 (50S ribosomal protein L35) (Ribosomal protein A)		
P0A7Q6	RL36_ECOLI	rpmJ b3299 JW3261	Large ribosomal subunit protein bL36A (50S ribosomal protein L36) (Ribosomal protein B)		
P0A7Y8	RNPA_ECOLI	rnpA b3704 JW3681	Ribonuclease P protein component (RNase P protein) (RNaseP protein) (EC 3.1.26.5) (Protein C5)		
P0A805	RRF_ECOLI	frr rrf b0172 JW0167	Ribosome-recycling factor (RRF) (Ribosome-releasing factor)		P0AD49; P0A7J7; P0A8E1
P0A843	TATE_ECOLI	tatE ybeC b0627 JW0622	Sec-independent protein translocase protein TatE		
P0A877	TRPA_ECOLI	trpA b1260 JW1252	Tryptophan synthase alpha chain (EC 4.2.1.20)	PATHWAY: Amino-acid biosynthesis; L-tryptophan biosynthesis; L-tryptophan from chorismate: step 5/5. {ECO:0000255|HAMAP-Rule:MF_00131}.	
P0A881	TRPR_ECOLI	trpR rtrY b4393 JW4356	Trp operon repressor		
P0A8A4	PSRP_ECOLI	ppsR ydiA b1703 JW1693	Phosphoenolpyruvate synthase regulatory protein (PEP synthase regulatory protein) (PSRP) (EC 2.7.11.33) (EC 2.7.4.28) (Pyruvate, water dikinase regulatory protein)		P33643
P0A8A8	RIMP_ECOLI	rimP yhbC b3170 JW5533	Ribosome maturation factor RimP		P0A7S3; P0A8H6
P0A8F4	URK_ECOLI	udk b2066 JW2051	Uridine kinase (EC 2.7.1.48) (Cytidine monophosphokinase) (Uridine monophosphokinase)	PATHWAY: Pyrimidine metabolism; CTP biosynthesis via salvage pathway; CTP from cytidine: step 1/3.; PATHWAY: Pyrimidine metabolism; UMP biosynthesis via salvage pathway; UMP from uridine: step 1/1.	
P0A8H8	YACG_ECOLI	yacG b0101 JW5008	DNA gyrase inhibitor YacG		
P0A8P1	LFTR_ECOLI	aat ycaA b0885 JW0868	Leucyl/phenylalanyl-tRNA--protein transferase (EC 2.3.2.6) (L/F-transferase) (Leucyltransferase) (Phenyalanyltransferase)		
P0A8Q6	CLPS_ECOLI	clpS yljA b0881 JW0865	ATP-dependent Clp protease adapter protein ClpS		P0ABH9; P0ABT2
P0A8T1	PRMA_ECOLI	prmA yhdI b3259 JW3227	Ribosomal protein L11 methyltransferase (L11 Mtase) (EC 2.1.1.-)		P0A7J7
P0A8U6	METJ_ECOLI	metJ b3938 JW3909	Met repressor (Met regulon regulatory protein MetJ)		P0AFF6
P0A8W2	SLYA_ECOLI	slyA b1642 JW5267	Transcriptional regulator SlyA		
P0A8Z3	YBGC_ECOLI	ybgC b0736 JW0726	Acyl-CoA thioester hydrolase YbgC (Acyl-CoA thioesterase) (EC 3.1.2.-)		P0A6A8; P0A7A7; P0ADZ0; P10408; O32591
P0A908	MIPA_ECOLI	mipA yeaF b1782 JW1771	MltA-interacting protein		
P0A927	TSX_ECOLI	tsx nupA b0411 JW0401	Nucleoside-specific channel-forming protein Tsx		
P0A944	RIMI_ECOLI	rimI b4373 JW4335	[Ribosomal protein bS18]-alanine N-acetyltransferase (EC 2.3.1.266) (KAT) (Peptidyl-lysine N-acetyltransferase) (EC 2.3.1.-)		
P0A996	GLPC_ECOLI	glpC b2243 JW2237	Anaerobic glycerol-3-phosphate dehydrogenase subunit C (G-3-P dehydrogenase)	PATHWAY: Polyol metabolism; glycerol degradation via glycerol kinase pathway; glycerone phosphate from sn-glycerol 3-phosphate (anaerobic route): step 1/1.	
P0A9C3	GALM_ECOLI	galM b0756 JW0739	Aldose 1-epimerase (EC 5.1.3.3) (Galactose mutarotase) (Type-1 mutarotase)	PATHWAY: Carbohydrate metabolism; hexose metabolism.	
P0A9D4	CYSE_ECOLI	cysE b3607 JW3582	Serine acetyltransferase (SAT) (EC 2.3.1.30)	PATHWAY: Amino-acid biosynthesis; L-cysteine biosynthesis; L-cysteine from L-serine: step 1/2.	P0ABK5
P0A9E2	SOXS_ECOLI	soxS b4062 JW4023	Regulatory protein SoxS		
P0A9F1	MNTR_ECOLI	mntR ybiQ b0817 JW0801	Transcriptional regulator MntR (Manganese transport regulator)		P16433; P30750
P0A9F3	CYSB_ECOLI	cysB b1275 JW1267	HTH-type transcriptional regulator CysB (Cys regulon transcriptional activator)		
P0A9H1	MUG_ECOLI	mug ygjF b3068 JW3040	G/U mismatch-specific DNA glycosylase (EC 3.2.2.28) (Double-strand-specific uracil glycosylase) (Mismatch-specific uracil DNA-glycosylase) (MUG)		
