Entry	Entry Name	Gene Names	Protein names	Organism	EC number	KEGG	GeneID
P0ABL1	NRFB_ECOLI	nrfB yjcI b4071 JW4032	Cytochrome c-type protein NrfB	Escherichia coli (strain K12)		ecj:JW4032;eco:b4071;ecoc:C3026_22005;	93777758;948573;
P0ABM1	CCMC_ECOLI	ccmC yejT yejU b2199 JW2187	Heme exporter protein C (Cytochrome c-type biogenesis protein CcmC)	Escherichia coli (strain K12)		ecj:JW2187;eco:b2199;ecoc:C3026_12290;	86860371;93774979;946703;
P0ABM9	CCMH_ECOLI	ccmH yejP b2194 JW2182	Cytochrome c-type biogenesis protein CcmH	Escherichia coli (strain K12)		ecj:JW2182;eco:b2194;ecoc:C3026_12265;	75172321;946623;
P0ABQ2	GARR_ECOLI	garR yhaE b3125 JW5526	2-hydroxy-3-oxopropionate reductase (EC 1.1.1.60) (Tartronate semialdehyde reductase) (TSAR)	Escherichia coli (strain K12)	1.1.1.60	ecj:JW5526;eco:b3125;	947631;
P0ABR5	HCAE_ECOLI	hcaE digA hcaA hcaA1 phdC1 yfhU b2538 JW2522	3-phenylpropionate/cinnamic acid dioxygenase subunit alpha (EC 1.14.12.19)	Escherichia coli (strain K12)	1.14.12.19	ecj:JW2522;eco:b2538;ecoc:C3026_14060;	93774598;946998;
P0ABR7	CNTA_ECOLI	yeaW b1802 JW5294	Carnitine monooxygenase oxygenase subunit (EC 1.14.13.239) (Carnitine monooxygenase alpha subunit)	Escherichia coli (strain K12)	1.14.13.239	ecj:JW5294;eco:b1802;ecoc:C3026_10270;	93776050;946325;
P0ABT5	DUSB_ECOLI	dusB yhdG b3260 JW3228	tRNA-dihydrouridine synthase B (EC 1.3.1.-)	Escherichia coli (strain K12)	1.3.1.-	ecj:JW3228;eco:b3260;ecoc:C3026_17735;	86862342;93778727;947707;
P0ABT8	YIJE_ECOLI	yijE b3943 JW5557	Probable cystine transporter YijE	Escherichia coli (strain K12)		ecj:JW5557;eco:b3943;ecoc:C3026_21310;	948445;
P0ABU5	ELBB_ECOLI	elbB elb2 yzzB b3209 JW3176	Glyoxalase ElbB (EC 4.2.1.-) (Sigma cross-reacting protein 27A) (SCRP-27A)	Escherichia coli (strain K12)	4.2.1.-	ecj:JW3176;eco:b3209;ecoc:C3026_17460;	947903;
P0ABW0	HCAC_ECOLI	hcaC hcaA3 phdB yfhW b2540 JW2524	3-phenylpropionate/cinnamic acid dioxygenase ferredoxin subunit	Escherichia coli (strain K12)		ecj:JW2524;eco:b2540;ecoc:C3026_14070;	93774596;947015;
P0ABZ4	KDSC_ECOLI	kdsC yrbI yrbJ b3198 JW3165	3-deoxy-D-manno-octulosonate 8-phosphate phosphatase KdsC (EC 3.1.3.45) (KDO 8-P phosphatase)	Escherichia coli (strain K12)	3.1.3.45	ecj:JW3165;eco:b3198;ecoc:C3026_17405;	93778783;947717;
P0AC28	5FCL_ECOLI	ygfA b2912 JW2879	5-formyltetrahydrofolate cyclo-ligase (5-FCL) (EC 6.3.3.2) (5,10-methenyltetrahydrofolate synthetase) (MTHFS)	Escherichia coli (strain K12)	6.3.3.2	ecj:JW2879;eco:b2912;	945167;
P0AC51	ZUR_ECOLI	zur yjbK b4046 JW5714	Zinc uptake regulation protein (Zinc uptake regulator)	Escherichia coli (strain K12)		ecj:JW5714;eco:b4046;ecoc:C3026_21865;	93777785;948552;
P0AC62	GLRX3_ECOLI	grxC yibM b3610 JW3585	Glutaredoxin 3 (Grx3)	Escherichia coli (strain K12)		ecj:JW3585;eco:b3610;ecoc:C3026_19575;	86861729;93778324;948132;
P0AC86	PHSG_ECOLI	glgP glgY b3428 JW3391	Glycogen phosphorylase (EC 2.4.1.1)	Escherichia coli (strain K12)	2.4.1.1	ecj:JW3391;eco:b3428;ecoc:C3026_18585;	93778561;947931;
P0AC94	GNTP_ECOLI	gntP yjiB b4321 JW4284	High-affinity gluconate transporter (Gluconate permease 3) (Gnt-III system)	Escherichia coli (strain K12)		ecj:JW4284;eco:b4321;ecoc:C3026_23340;	948848;
P0ACA3	SSPA_ECOLI	sspA pog ssp b3229 JW3198	Stringent starvation protein A	Escherichia coli (strain K12)		ecj:JW3198;eco:b3229;ecoc:C3026_17570;	86862382;89518065;944744;
P0ACA7	GSTB_ECOLI	gstB yliJ b0838 JW0822	Glutathione S-transferase GstB (EC 2.5.1.18)	Escherichia coli (strain K12)	2.5.1.18	ecj:JW0822;eco:b0838;ecoc:C3026_05245;	75170907;75204697;945469;
P0ACG4	HOKC_ECOLI	hokC gef b4412 JW5002 b0018.1	Toxic protein HokC (Protein Gef)	Escherichia coli (strain K12)		ecj:JW5002;eco:b4412;ecoc:C3026_00085;	2847744;86862532;
P0ACH5	MARA_ECOLI	marA b1531 JW5249	Multiple antibiotic resistance protein MarA	Escherichia coli (strain K12)		ecj:JW5249;eco:b1531;ecoc:C3026_08845;	93775695;947613;
P0ACI6	ASNC_ECOLI	asnC b3743 JW3721	Regulatory protein AsnC	Escherichia coli (strain K12)		ecj:JW3721;eco:b3743;ecoc:C3026_20280;	86861851;948259;
P0ACL5	GLCC_ECOLI	glcC yghN b2980 JW2947	Glc operon transcriptional activator (Glc regulatory protein) (HTH-type transcriptional regulator GlcC)	Escherichia coli (strain K12)		ecj:JW2947;eco:b2980;ecoc:C3026_16305;	75205188;947466;
P0ACL7	LLDR_ECOLI	lldR lctR b3604 JW3579	Putative L-lactate dehydrogenase operon regulatory protein	Escherichia coli (strain K12)		ecj:JW3579;eco:b3604;ecoc:C3026_19545;	93778318;948122;
P0ACP1	CRA_ECOLI	cra fruC fruR shl b0080 JW0078	Catabolite repressor/activator (Fructose repressor)	Escherichia coli (strain K12)		ecj:JW0078;eco:b0080;	86862590;944804;
P0ACQ0	RBSR_ECOLI	rbsR b3753 JW3732	Ribose operon repressor	Escherichia coli (strain K12)		ecj:JW3732;eco:b3753;	75173987;948266;
P0ACS5	ZNTR_ECOLI	zntR yhdM b3292 JW3254	HTH-type transcriptional regulator ZntR (Zn(II)-responsive regulator of zntA)	Escherichia coli (strain K12)		ecj:JW3254;eco:b3292;ecoc:C3026_17900;	86862310;93778695;947786;
P0ACS9	ACRR_ECOLI	acrR ybaH b0464 JW0453	HTH-type transcriptional regulator AcrR (Potential acrAB operon repressor)	Escherichia coli (strain K12)		ecj:JW0453;eco:b0464;ecoc:C3026_02275;	93776986;945516;
P0ACU0	CECR_ECOLI	cecR ybiH b0796 JW0780	HTH-type transcriptional dual regulator CecR (Regulator of cefoperazone and chloramphenicol sensitivity)	Escherichia coli (strain K12)		ecj:JW0780;eco:b0796;ecoc:C3026_05030;	75170861;75204911;945421;
P0ACU2	RUTR_ECOLI	rutR ycdC b1013 JW0998	HTH-type transcriptional regulator RutR (Rut operon repressor)	Escherichia coli (strain K12)		ecj:JW0998;eco:b1013;ecoc:C3026_06160;	75171089;945075;
P0ACU5	FABR_ECOLI	fabR yijC b3963 JW3935	HTH-type transcriptional repressor FabR	Escherichia coli (strain K12)		ecj:JW3935;eco:b3963;	948460;
P0ACV2	LPXP_ECOLI	lpxP ddg b2378 JW2375	Lipid A biosynthesis palmitoleoyltransferase (EC 2.3.1.242) (Kdo(2)-lipid IV(A) palmitoleoyltransferase)	Escherichia coli (strain K12)	2.3.1.242	ecj:JW2375;eco:b2378;ecoc:C3026_13225;	75202553;946847;
P0ACV4	LAPA_ECOLI	lapA yciS b1279 JW1271	Lipopolysaccharide assembly protein A	Escherichia coli (strain K12)		ecj:JW1271;eco:b1279;ecoc:C3026_07510;	75203392;944936;
P0ACZ8	CUSR_ECOLI	cusR ylcA b0571 JW0560	Transcriptional regulatory protein CusR	Escherichia coli (strain K12)		ecj:JW0560;eco:b0571;ecoc:C3026_02835;	93776917;945003;
P0AD01	DCUR_ECOLI	dcuR yjdG b4124 JW4085	Transcriptional regulatory protein DcuR	Escherichia coli (strain K12)		ecj:JW4085;eco:b4124;ecoc:C3026_22290;	75169642;75203994;948640;
P0AD03	LETA_ECOLI	letA yebS b1833 JW1822	Lipophilic envelope-spanning tunnel protein A (Intermembrane transport protein LetA)	Escherichia coli (strain K12)		ecj:JW1822;eco:b1833;ecoc:C3026_10445;	75171904;946353;
P0AD42	PGPC_ECOLI	pgpC yfhB b2560 JW5408	Phosphatidylglycerophosphatase C (EC 3.1.3.27) (Phosphatidylglycerolphosphate phosphatase C) (PGP phosphatase C)	Escherichia coli (strain K12)	3.1.3.27	ecj:JW5408;eco:b2560;ecoc:C3026_14170;	93774575;947026;
P0AD89	LPTN_ECOLI	tnaC tnaL b3707 JW3685	Tryptophanase operon leader peptide (TnaC)	Escherichia coli (strain K12)		ecj:JW3685;eco:b3707;ecoc:C3026_20100;	89518606;948223;
P0AD96	LIVJ_ECOLI	livJ b3460 JW3425	Leu/Ile/Val-binding protein (LIV-BP)	Escherichia coli (strain K12)		ecj:JW3425;eco:b3460;	93778531;947971;
P0ADC3	LOLC_ECOLI	lolC ycfU b1116 JW5161	Lipoprotein-releasing system transmembrane protein LolC	Escherichia coli (strain K12)		ecj:JW5161;eco:b1116;	93776292;945673;
P0ADC6	LPTG_ECOLI	lptG yjgQ b4262 JW5760	Lipopolysaccharide export system permease protein LptG	Escherichia coli (strain K12)		ecj:JW5760;eco:b4262;ecoc:C3026_22990;	75169783;75203517;945324;
P0ADD2	YJJB_ECOLI	yjjB b4363 JW4327	Probable succinate transporter subunit YjjB	Escherichia coli (strain K12)		ecj:JW4327;eco:b4363;ecoc:C3026_23570;	948811;
P0ADD5	YJJP_ECOLI	yjjP b4364 JW5796	Probable succinate transporter subunit YjjP	Escherichia coli (strain K12)		ecj:JW5796;eco:b4364;ecoc:C3026_23575;	948812;
P0ADE6	KBP_ECOLI	kbp ygaU yzzM b2665 JW2640	Potassium binding protein Kbp (K(+) binding protein Kbp)	Escherichia coli (strain K12)		ecj:JW2640;eco:b2665;ecoc:C3026_14690;	75058518;947144;
P0ADF6	EDD_ECOLI	edd b1851 JW1840	Phosphogluconate dehydratase (EC 4.2.1.12) (6-phosphogluconate dehydratase) (Entner-Doudoroff dehydrase)	Escherichia coli (strain K12)	4.2.1.12	ecj:JW1840;eco:b1851;ecoc:C3026_10545;	86859389;946362;
P0ADF8	ILVN_ECOLI	ilvN b3670 JW3645	Acetolactate synthase isozyme 1 small subunit (EC 2.2.1.6) (Acetohydroxy-acid synthase I small subunit) (AHAS-I) (ALS-I)	Escherichia coli (strain K12)	2.2.1.6	ecj:JW3645;eco:b3670;ecoc:C3026_19890;	86944341;93778411;948183;
P0ADG1	ILVM_ECOLI	ilvM b3769 JW3742	Acetolactate synthase isozyme 2 small subunit (EC 2.2.1.6) (ALS-II) (Acetohydroxy-acid synthase II small subunit) (AHAS-II)	Escherichia coli (strain K12)	2.2.1.6	ecj:JW3742;eco:b3769;ecoc:C3026_20415;	86861876;93778176;948279;
P0ADN6	LPTM_ECOLI	lptM yifL b4558 JW3781	LPS-assembly lipoprotein LptM (LptD oxidative maturation-associated lipoprotein)	Escherichia coli (strain K12)		ecj:JW3781;eco:b4558;ecoc:C3026_20615;	1450304;93778135;
P0ADP5	BIOP_ECOLI	bioP yigM b3827 JW3803	Biotin transporter (Plasmamembrane biotin transport protein)	Escherichia coli (strain K12)		ecj:JW3803;eco:b3827;	93778110;948309;
P0ADP7	UBIJ_ECOLI	ubiJ yigP b3834 JW3811	Ubiquinone biosynthesis accessory factor UbiJ	Escherichia coli (strain K12)		ecj:JW3811;eco:b3834;ecoc:C3026_20745;	93778101;948915;
P0ADQ2	FABY_ECOLI	fabY yiiD b3888 JW3859	Probable acyltransferase FabY (EC 2.3.1.-)	Escherichia coli (strain K12)	2.3.1.-	ecj:JW3859;eco:b3888;	948387;
P0ADR6	RLMM_ECOLI	rlmM ygdE b2806 JW2777	Ribosomal RNA large subunit methyltransferase M (EC 2.1.1.186) (23S rRNA (cytidine2498-2'-O)-methyltransferase) (23S rRNA 2'-O-ribose methyltransferase RlmM)	Escherichia coli (strain K12)	2.1.1.186	ecj:JW2777;eco:b2806;ecoc:C3026_15425;	75172890;75203803;947283;
P0ADU2	YGIN_ECOLI	ygiN b3029 JW2997	Probable quinol monooxygenase YgiN (QuMo) (EC 1.-.-.-)	Escherichia coli (strain K12)	1.-.-.-	ecj:JW2997;eco:b3029;ecoc:C3026_16545;	93778964;947506;
P0ADV7	MLAC_ECOLI	mlaC yrbC b3192 JW3159	Intermembrane phospholipid transport system binding protein MlaC	Escherichia coli (strain K12)		ecj:JW3159;eco:b3192;ecoc:C3026_17375;	75206048;947710;
P0ADW3	ZAPG_ECOLI	zapG lapD yhcB b3233 JW5539	Z-ring associated protein G (Cell division protein ZapG) (LPS assembly protein LapD)	Escherichia coli (strain K12)		ecj:JW5539;eco:b3233;ecoc:C3026_17590;	93778753;947815;
P0AE76	COBU_ECOLI	cobU b1993 JW1971	Bifunctional adenosylcobalamin biosynthesis protein CobU (Adenosylcobinamide kinase) (EC 2.7.1.156) (Adenosylcobinamide-phosphate guanylyltransferase) (EC 2.7.7.62)	Escherichia coli (strain K12)	2.7.1.156; 2.7.7.62	ecj:JW1971;eco:b1993;ecoc:C3026_11245;	946519;
P0AEA2	CSGG_ECOLI	csgG b1037 JW1020	Curli production assembly/transport component CsgG	Escherichia coli (strain K12)		ecj:JW1020;eco:b1037;ecoc:C3026_06315;	75171163;75203625;945619;
P0AEA5	CYOE_ECOLI	cyoE b0428 JW0418	Protoheme IX farnesyltransferase (EC 2.5.1.141) (Heme B farnesyltransferase) (Heme O synthase)	Escherichia coli (strain K12)	2.5.1.141	ecj:JW0418;eco:b0428;ecoc:C3026_02090;	75170446;75202853;945073;
P0AEB5	YNAI_ECOLI	ynaI b1330 JW1323	Low conductance mechanosensitive channel YnaI	Escherichia coli (strain K12)		ecj:JW1323;eco:b1330;ecoc:C3026_07790;	75171457;945898;
P0AED0	USPA_ECOLI	uspA b3495 JW3462	Universal stress protein A	Escherichia coli (strain K12)		ecj:JW3462;eco:b3495;ecoc:C3026_18930;	86862112;93778498;948007;
P0AED5	UVRY_ECOLI	uvrY yecB b1914 JW1899	Response regulator UvrY	Escherichia coli (strain K12)		ecj:JW1899;eco:b1914;ecoc:C3026_10860;	93776219;946424;
P0AEE1	DCRB_ECOLI	dcrB yhhR b3472 JW5682	Inner membrane lipoprotein DcrB	Escherichia coli (strain K12)		ecj:JW5682;eco:b3472;ecoc:C3026_18805;	93778519;947983;
P0AEF4	DPIA_ECOLI	dpiA citB criR mpdA b0620 JW0612	Transcriptional regulatory protein DpiA (Destabilizer of plasmid inheritance)	Escherichia coli (strain K12)		ecj:JW0612;eco:b0620;ecoc:C3026_03100;	75170624;75205018;947008;
P0AEH5	ELAB_ECOLI	elaB yfbD b2266 JW2261	Protein ElaB	Escherichia coli (strain K12)		ecj:JW2261;eco:b2266;ecoc:C3026_12655;	75172398;75205683;946751;
P0AEI4	RIMO_ECOLI	rimO yliG b0835 JW0819	Ribosomal protein uS12 methylthiotransferase RimO (uS12 MTTase) (uS12 methylthiotransferase) (EC 2.8.4.4) (Ribosomal protein uS12 (aspartate(89)-C(3))-methylthiotransferase) (Ribosome maturation factor RimO)	Escherichia coli (strain K12)	2.8.4.4	ecj:JW0819;eco:b0835;ecoc:C3026_05230;	75204700;945465;
P0AEI6	NUDJ_ECOLI	nudJ ymfB b1134 JW1120	Phosphatase NudJ (EC 3.6.1.-)	Escherichia coli (strain K12)	3.6.1.-	ecj:JW1120;eco:b1134;ecoc:C3026_06820;	75203720;945689;
P0AEJ8	EUTN_ECOLI	eutN cchB yffY b2456 JW2440	Bacterial microcompartment shell vertex protein EutN (Ethanolamine catabolic microcompartment shell protein EutN) (Ethanolamine utilization protein EutN)	Escherichia coli (strain K12)		ecj:JW2440;eco:b2456;ecoc:C3026_13630;	86947351;93774684;946945;
P0AEM0	FKBX_ECOLI	fkpB slpA yaaD b0028 JW0026	FKBP-type 16 kDa peptidyl-prolyl cis-trans isomerase (PPIase) (EC 5.2.1.8) (Rotamase)	Escherichia coli (strain K12)	5.2.1.8	ecj:JW0026;eco:b0028;ecoc:C3026_00135;	86944962;93777408;944807;
P0AEQ3	GLNH_ECOLI	glnH b0811 JW0796	Glutamine-binding periplasmic protein (GlnBP)	Escherichia coli (strain K12)		ecj:JW0796;eco:b0811;ecoc:C3026_05105;	93776617;944872;
P0AER3	GLTJ_ECOLI	gltJ b0654 JW0649	Glutamate/aspartate import permease protein GltJ	Escherichia coli (strain K12)		ecj:JW0649;eco:b0654;ecoc:C3026_03270;	75170657;75204985;945443;
P0AER5	GLTK_ECOLI	gltK b0653 JW0648	Glutamate/aspartate import permease protein GltK	Escherichia coli (strain K12)		ecj:JW0648;eco:b0653;ecoc:C3026_03265;	93776829;947354;
P0AER8	GLTS_ECOLI	gltS gltC b3653 JW3628	Sodium/glutamate symporter (Glutamate permease)	Escherichia coli (strain K12)		ecj:JW3628;eco:b3653;ecoc:C3026_19790;	93778368;948166;
P0AEU0	HISJ_ECOLI	hisJ b2309 JW2306	Histidine-binding periplasmic protein (HBP)	Escherichia coli (strain K12)		ecj:JW2306;eco:b2309;ecoc:C3026_12875;	86947252;93774865;945309;
P0AEZ7	MLTD_ECOLI	mltD dniR yafG b0211 JW5018	Membrane-bound lytic murein transglycosylase D (EC 4.2.2.n1) (Murein hydrolase D) (Regulatory protein DniR)	Escherichia coli (strain K12)	4.2.2.n1	ecj:JW5018;eco:b0211;ecoc:C3026_00985;	93777212;945694;
P0AEZ9	MOAB_ECOLI	moaB chlA2 b0782 JW0765	Molybdenum cofactor biosynthesis protein B	Escherichia coli (strain K12)		ecj:JW0765;eco:b0782;ecoc:C3026_04960;	93776648;945396;
P0AF03	MOG_ECOLI	mog chlG mogA yaaG b0009 JW0008	Molybdopterin adenylyltransferase (MPT adenylyltransferase) (EC 2.7.7.75)	Escherichia coli (strain K12)	2.7.7.75	ecj:JW0008;eco:b0009;ecoc:C3026_00050;	75169908;944760;
P0AF26	NARJ_ECOLI	narJ b1226 JW1217	Nitrate reductase molybdenum cofactor assembly chaperone NarJ (Redox enzyme maturation protein NarJ)	Escherichia coli (strain K12)		ecj:JW1217;eco:b1226;ecoc:C3026_07210;	945807;
P0AF98	LPTF_ECOLI	lptF yjgP b4261 JW4218	Lipopolysaccharide export system permease protein LptF	Escherichia coli (strain K12)		ecj:JW4218;eco:b4261;ecoc:C3026_22985;	75169782;75203518;948795;
P0AFA9	NIKC_ECOLI	nikC b3478 JW3443	Nickel transport system permease protein NikC	Escherichia coli (strain K12)		ecj:JW3443;eco:b3478;ecoc:C3026_18835;	93778513;947990;
P0AFG0	NUSG_ECOLI	nusG b3982 JW3945	Transcription termination/antitermination protein NusG	Escherichia coli (strain K12)		ecj:JW3945;eco:b3982;ecoc:C3026_21510;	93777912;948485;
P0AFH0	OGT_ECOLI	ogt b1335 JW1329	Methylated-DNA--protein-cysteine methyltransferase (EC 2.1.1.63) (6-O-methylguanine-DNA methyltransferase) (MGMT) (O-6-methylguanine-DNA-alkyltransferase)	Escherichia coli (strain K12)	2.1.1.63	ecj:JW1329;eco:b1335;ecoc:C3026_07815;	945853;
P0AFH2	OPPB_ECOLI	oppB b1244 JW1236	Oligopeptide transport system permease protein OppB	Escherichia coli (strain K12)		ecj:JW1236;eco:b1244;ecoc:C3026_07310;	75203356;945823;
P0AFH6	OPPC_ECOLI	oppC b1245 JW1237	Oligopeptide transport system permease protein OppC	Escherichia coli (strain K12)		ecj:JW1237;eco:b1245;ecoc:C3026_07315;	93775310;945810;
P0AFJ5	PHOB_ECOLI	phoB b0399 JW0389	Phosphate regulon transcriptional regulatory protein PhoB	Escherichia coli (strain K12)		ecj:JW0389;eco:b0399;ecoc:C3026_01940;	86862944;93777061;945046;
P0AFK4	POTB_ECOLI	potB b1125 JW1111	Spermidine/putrescine transport system permease protein PotB	Escherichia coli (strain K12)		ecj:JW1111;eco:b1125;	945692;
P0AFK6	POTC_ECOLI	potC b1124 JW1110	Spermidine/putrescine transport system permease protein PotC	Escherichia coli (strain K12)		ecj:JW1110;eco:b1124;ecoc:C3026_06765;	86863623;93776286;945691;
P0AFK9	POTD_ECOLI	potD b1123 JW1109	Spermidine/putrescine-binding periplasmic protein (SPBP)	Escherichia coli (strain K12)		ecj:JW1109;eco:b1123;ecoc:C3026_06760;	86863622;945682;
P0AFL1	POTI_ECOLI	potI b0857 JW0841	Putrescine transport system permease protein PotI	Escherichia coli (strain K12)		ecj:JW0841;eco:b0857;ecoc:C3026_05345;	89520233;945485;
P0AFL9	PQIA_ECOLI	pqiA pqi5A b0950 JW0933	Intermembrane transport protein PqiA (Paraquat-inducible protein A)	Escherichia coli (strain K12)		ecj:JW0933;eco:b0950;ecoc:C3026_05815;	93776464;944999;
P0AFN2	PSPC_ECOLI	pspC b1306 JW1299	Phage shock protein C	Escherichia coli (strain K12)		ecj:JW1299;eco:b1306;ecoc:C3026_07660;	93775432;945499;
P0AFP2	ATL_ECOLI	atl ybaZ b0454 JW0444	DNA base-flipping protein (Alkyltransferase-like protein ATL)	Escherichia coli (strain K12)		ecj:JW0444;eco:b0454;	945094;
P0AFP9	YBHR_ECOLI	ybhR b0792 JW5803	Probable multidrug ABC transporter permease YbhR	Escherichia coli (strain K12)		ecj:JW5803;eco:b0792;ecoc:C3026_05010;	93776638;945403;
P0AFQ2	YBHS_ECOLI	ybhS b0793 JW0777	Probable multidrug ABC transporter permease YbhS	Escherichia coli (strain K12)		ecj:JW0777;eco:b0793;ecoc:C3026_05015;	75170858;945411;
P0AFQ7	YCFH_ECOLI	ycfH b1100 JW1086	Uncharacterized metal-dependent hydrolase YcfH (EC 3.1.-.-)	Escherichia coli (strain K12)	3.1.-.-	ecj:JW1086;eco:b1100;ecoc:C3026_06645;	93776308;945656;
P0AFR7	YCJO_ECOLI	ycjO b1311 JW1304	Maltose transport system permease protein YcjO	Escherichia coli (strain K12)		ecj:JW1304;eco:b1311;ecoc:C3026_07685;	93775437;945888;
P0AFR9	YDCV_ECOLI	ydcV b1443 JW1438	Inner membrane ABC transporter permease protein YdcV	Escherichia coli (strain K12)		ecj:JW1438;eco:b1443;ecoc:C3026_08395;	75171524;945903;
P0AFS5	TQSA_ECOLI	tqsA ydgG b1601 JW1593	AI-2 transport protein TqsA (Transport of quorum-sensing signal protein)	Escherichia coli (strain K12)		ecj:JW1593;eco:b1601;ecoc:C3026_09220;	93775749;946142;
P0AFT5	BTSR_ECOLI	btsR yehT b2125 JW5352	Transcriptional regulatory protein BtsR	Escherichia coli (strain K12)		ecj:JW5352;eco:b2125;ecoc:C3026_11915;	86860293;93775070;949024;
P0AFU8	RISA_ECOLI	ribC ribE b1662 JW1654	Riboflavin synthase (RS) (EC 2.5.1.9)	Escherichia coli (strain K12)	2.5.1.9	ecj:JW1654;eco:b1662;ecoc:C3026_09535;	93775817;945848;
P0AFW4	RNK_ECOLI	rnk b0610 JW0602	Regulator of nucleoside diphosphate kinase	Escherichia coli (strain K12)		ecj:JW0602;eco:b0610;ecoc:C3026_03050;	93776875;947546;
P0AFX4	RSD_ECOLI	rsd b3995 JW3959	Regulator of sigma D	Escherichia coli (strain K12)		ecj:JW3959;eco:b3995;ecoc:C3026_21580;	75169441;75205513;948496;
P0AFZ7	TRKH_ECOLI	trkH b3849 JW5576	Trk system potassium uptake protein TrkH	Escherichia coli (strain K12)		ecj:JW5576;eco:b3849;ecoc:C3026_20810;	93778088;948333;
P0AG00	WZZE_ECOLI	wzzE wzz yifC b3785 JW5601	ECA polysaccharide chain length modulation protein	Escherichia coli (strain K12)		ecj:JW5601;eco:b3785;ecoc:C3026_20495;	93778159;944815;
P0AG03	UBIX_ECOLI	ubiX dedF b2311 JW2308	Flavin prenyltransferase UbiX (EC 2.5.1.129)	Escherichia coli (strain K12)	2.5.1.129	ecj:JW2308;eco:b2311;ecoc:C3026_12885;	949033;
P0AG40	RIBF_ECOLI	ribF yaaC b0025 JW0023	Bifunctional riboflavin kinase/FMN adenylyltransferase (Riboflavin biosynthesis protein RibF) [Includes: Riboflavin kinase (EC 2.7.1.26) (Flavokinase); FMN adenylyltransferase (EC 2.7.7.2) (FAD pyrophosphorylase) (FAD synthase)]	Escherichia coli (strain K12)	2.7.1.26; 2.7.7.2	ecj:JW0023;eco:b0025;ecoc:C3026_00120;	93777411;949129;
P0AG44	RL17_ECOLI	rplQ b3294 JW3256	Large ribosomal subunit protein bL17 (50S ribosomal protein L17)	Escherichia coli (strain K12)		ecj:JW3256;eco:b3294;ecoc:C3026_17910;	947784;99707778;99810659;
P0AG48	RL21_ECOLI	rplU b3186 JW3153	Large ribosomal subunit protein bL21 (50S ribosomal protein L21)	Escherichia coli (strain K12)		ecj:JW3153;eco:b3186;ecoc:C3026_17345;	86862417;93778795;949057;
P0AG51	RL30_ECOLI	rpmD b3302 JW3264	Large ribosomal subunit protein uL30 (50S ribosomal protein L30)	Escherichia coli (strain K12)		ecj:JW3264;eco:b3302;ecoc:C3026_17950;	86862300;93778685;947797;
P0AG76	SBCD_ECOLI	sbcD yajA b0398 JW0388	Nuclease SbcCD subunit D	Escherichia coli (strain K12)		ecj:JW0388;eco:b0398;ecoc:C3026_01935;	93777062;945049;
P0AG78	SUBI_ECOLI	sbp b3917 JW3888	Sulfate-binding protein (Sulfate starvation-induced protein 2) (SSI2)	Escherichia coli (strain K12)		ecj:JW3888;eco:b3917;ecoc:C3026_21175;	93777981;948411;
P0AG82	PSTS_ECOLI	pstS phoS b3728 JW3706	Phosphate-binding protein PstS (PBP)	Escherichia coli (strain K12)		ecj:JW3706;eco:b3728;ecoc:C3026_20205;	75205442;948237;
P0AGA6	UHPA_ECOLI	uhpA b3669 JW3644	Transcriptional regulatory protein UhpA	Escherichia coli (strain K12)		ecj:JW3644;eco:b3669;ecoc:C3026_19885;	93778410;948178;
P0AGC5	MLTF_ECOLI	mltF yfhD b2558 JW2542	Membrane-bound lytic murein transglycosylase F (EC 4.2.2.n1) (Murein lyase F)	Escherichia coli (strain K12)	4.2.2.n1	ecj:JW2542;eco:b2558;ecoc:C3026_14160;	75206251;947028;
P0AGG4	THIO2_ECOLI	trxC yfiG b2582 JW2566	Thioredoxin 2 (Trx-2) (EC 1.8.1.8) (Protein-disulfide reductase)	Escherichia coli (strain K12)	1.8.1.8	ecj:JW2566;eco:b2582;ecoc:C3026_14310;	86860704;93774504;947062;
P0AGH3	SAPB_ECOLI	sapB b1293 JW1286	Putrescine export system permease protein SapB	Escherichia coli (strain K12)		ecj:JW1286;eco:b1293;ecoc:C3026_07590;	93775418;946191;
P0AGH5	SAPC_ECOLI	sapC b1292 JW1285	Putrescine export system permease protein SapC	Escherichia coli (strain K12)		ecj:JW1285;eco:b1292;ecoc:C3026_07585;	93775417;945266;
P0AGL2	TDCF_ECOLI	tdcF yhaR b3113 JW5521	Putative reactive intermediate deaminase TdcF (EC 3.5.4.-)	Escherichia coli (strain K12)	3.5.4.-	ecj:JW5521;eco:b3113;ecoc:C3026_16980;	93778872;947624;
P0AGL5	RATA_ECOLI	ratA pasT yfjG b2619 JW2600	Ribosome association toxin RatA (Toxin RatA)	Escherichia coli (strain K12)		ecj:JW2600;eco:b2619;ecoc:C3026_14495;	945614;
P0AGL7	RSME_ECOLI	rsmE yggJ b2946 JW2913	Ribosomal RNA small subunit methyltransferase E (EC 2.1.1.193) (16S rRNA m3U1498 methyltransferase)	Escherichia coli (strain K12)	2.1.1.193	ecj:JW2913;eco:b2946;ecoc:C3026_16125;	75173052;945816;
P0AGM9	XANP_ECOLI	xanP yicE b3654 JW3629	Xanthine permease XanP	Escherichia coli (strain K12)		ecj:JW3629;eco:b3654;ecoc:C3026_19795;	93778369;948172;
P0C066	MLTC_ECOLI	mltC yggZ b2963 JW5481	Membrane-bound lytic murein transglycosylase C (EC 4.2.2.n1) (Murein lyase C)	Escherichia coli (strain K12)	4.2.2.n1	ecj:JW5481;eco:b2963;ecoc:C3026_16215;	86861053;945428;
P0C0L9	ISCX_ECOLI	iscX yfhJ b2524 JW2508	Protein IscX	Escherichia coli (strain K12)		ecj:JW2508;eco:b2524;ecoc:C3026_13990;	86947414;93774612;945196;
P0C0U4	RIMK_ECOLI	rimK b0852 JW0836	Ribosomal protein bS6--L-glutamate ligase (EC 6.3.2.-) (Polyglutamate synthase) (Ribosomal protein bS6 modification protein)	Escherichia coli (strain K12)	6.3.2.-	ecj:JW0836;eco:b0852;ecoc:C3026_05315;	93776570;945484;
P0C8J6	GATY_ECOLI	gatY yegF b2096 JW5343	D-tagatose-1,6-bisphosphate aldolase subunit GatY (TBPA) (TagBP aldolase) (EC 4.1.2.40) (D-tagatose-bisphosphate aldolase class II) (Tagatose-bisphosphate aldolase)	Escherichia coli (strain K12)	4.1.2.40	ecj:JW5343;eco:b2096;ecoc:C3026_11765;	946636;
P0C960	EMTA_ECOLI	emtA mltE sltZ ycgP b1193 JW5821	Endo-type membrane-bound lytic murein transglycosylase A (EC 4.2.2.n2) (Peptidoglycan lytic endotransglycosylase)	Escherichia coli (strain K12)	4.2.2.n2	ecj:JW5821;eco:b1193;ecoc:C3026_07020;	93776239;945655;
P0CI31	HCAB_ECOLI	hcaB phdD yfhX b2541 JW2525	3-phenylpropionate-dihydrodiol/cinnamic acid-dihydrodiol dehydrogenase (EC 1.3.1.87) (2,3-dihydroxy-2,3-dihydrophenylpropionate dehydrogenase) (3-(cis-5,6-dihydroxycyclohexa-1,3-dien-1-yl)propanoate dehydrogenase) (CI-dihydrodiol dehydrogenase) (Cis-3-(2-carboxyethenyl)-3,5-cyclohexadiene-1,2-diol dehydrogenase) (Cis-3-(2-carboxyethyl)-3,5-cyclohexadiene-1,2-diol dehydrogenase) (PP-dihydrodiol dehydrogenase)	Escherichia coli (strain K12)	1.3.1.87	ecj:JW2525;eco:b2541;ecoc:C3026_14075;	945346;
P0DKB3	MNTS_ECOLI	mntS rybA b4705 JW0800.1	Small protein MntS	Escherichia coli (strain K12)		eco:b4705;ecoc:C3026_05135;	14678509;75170883;75204930;
P0DMC9	RCSA_ECOLI	rcsA b1951 JW1935	Transcriptional regulatory protein RcsA (Colanic acid capsular biosynthesis activation protein A)	Escherichia coli (strain K12)		ecj:JW1935;eco:b1951;ecoc:C3026_11045;	946467;
P0DW56	SPFP_ECOLI	spfP b4837	Small protein SpfP	Escherichia coli (strain K12)			
P10100	RLPA_ECOLI	rlpA b0633 JW0628	Endolytic peptidoglycan transglycosylase RlpA (EC 4.2.2.-) (Rare lipoprotein A)	Escherichia coli (strain K12)	4.2.2.-	ecj:JW0628;eco:b0633;ecoc:C3026_03165;	945241;
P10151	LEUO_ECOLI	leuO b0076 JW0075	HTH-type transcriptional regulator LeuO	Escherichia coli (strain K12)		ecj:JW0075;eco:b0076;	949034;
P10346	GLNQ_ECOLI	glnQ b0809 JW0794	Glutamine transport ATP-binding protein GlnQ	Escherichia coli (strain K12)		ecj:JW0794;eco:b0809;ecoc:C3026_05095;	945435;
P10384	FADL_ECOLI	fadL ttr b2344 JW2341	Long-chain fatty acid transport protein (Outer membrane FadL protein) (Outer membrane flp protein)	Escherichia coli (strain K12)		ecj:JW2341;eco:b2344;ecoc:C3026_13045;	946820;
