Entry	Entry Name	Gene Names	Protein names	Pathway	Interacts with
P0ADU5	YGIW_ECOLI	ygiW b3024 JW2992	Protein YgiW		
P0ADW6	YHCC_ECOLI	yhcC b3211 JW3178	Protein YhcC		
P0ADX9	RSMD_ECOLI	rsmD yhhF b3465 JW3430	Ribosomal RNA small subunit methyltransferase D (EC 2.1.1.171) (16S rRNA m2G966 methyltransferase) (rRNA (guanine-N(2)-)-methyltransferase)		P0A6Y8; P0CE47
P0ADZ7	YAJC_ECOLI	yajC b0407 JW0397	Sec translocon accessory complex subunit YajC		P31224
P0AE26	ARAH_ECOLI	araH b4460 JW1887	L-arabinose transport system permease protein AraH		
P0AE30	ARTM_ECOLI	artM b0861 JW0845	Arginine ABC transporter permease protein ArtM		
P0AE34	ARTQ_ECOLI	artQ b0862 JW0846	Arginine ABC transporter permease protein ArtQ		
P0AE37	ASTA_ECOLI	astA ydjV b1747 JW1736	Arginine N-succinyltransferase (AST) (EC 2.3.1.109) (AOST)	PATHWAY: Amino-acid degradation; L-arginine degradation via AST pathway; L-glutamate and succinate from L-arginine: step 1/5.	
P0AE39	YPDB_ECOLI	ypdB b2381 JW2378	Transcriptional regulatory protein YpdB		
P0AE45	PAEA_ECOLI	paeA ytfL b4218 JW4177	Polyamine export protein		
P0AE56	BFD_ECOLI	bfd yheA b3337 JW3299	Bacterioferritin-associated ferredoxin (Bfd)		
P0AE60	CEDA_ECOLI	cedA ydjP b1731 JW1720	Cell division activator CedA		
P0AE95	CSGE_ECOLI	csgE b1039 JW1022	Curli production assembly/transport component CsgE		P0AE95; P0AEA2
P0AE98	CSGF_ECOLI	csgF b1038 JW1021	Curli production assembly/transport component CsgF		
P0AEB0	CYSW_ECOLI	cysW b2423 JW2416	Sulfate transport system permease protein CysW		
P0AED9	DCM_ECOLI	dcm mec b1961 JW1944	DNA-cytosine methyltransferase (EC 2.1.1.37) (Type II methyltransferase M.EcoKDcm) (M.EcoKDcm)		P06959
P0AEK0	EXOX_ECOLI	exoX yobC b1844 JW1833	Exodeoxyribonuclease 10 (EC 3.1.11.-) (Exodeoxyribonuclease X) (Exo X) (Exonuclease X)		
P0AEL3	FEOA_ECOLI	feoA b3408 JW3371	Fe(2+) transport protein A (Ferrous iron transport protein A)		
P0AEL6	FEPB_ECOLI	fepB b0592 JW0584	Ferric enterobactin-binding periplasmic protein FepB		
P0AEM4	FLGM_ECOLI	flgM b1071 JW1058	Negative regulator of flagellin synthesis (Anti-sigma-28 factor)		P0AEM6
P0AEP1	GALP_ECOLI	galP b2943 JW2910	Galactose-proton symporter (Galactose transporter)		
P0AEQ6	GLNP_ECOLI	glnP b0810 JW0795	Glutamine transport system permease protein GlnP		
P0AEU3	HISM_ECOLI	hisM b2307 JW2304	Histidine/lysine/arginine/ornithine transport system permease protein HisM		
P0AEW1	HYFE_ECOLI	hyfE b2485 JW2470	Hydrogenase-4 component E (EC 1.-.-.-)		
P0AEW4	CPDA_ECOLI	cpdA icc b3032 JW3000	3',5'-cyclic adenosine monophosphate phosphodiesterase CpdA (3',5'-cyclic AMP phosphodiesterase) (cAMP phosphodiesterase) (EC 3.1.4.53)		
P0AEX3	KGTP_ECOLI	kgtP witA b2587 JW2571	Alpha-ketoglutarate permease		
P0AF01	MODB_ECOLI	modB chlJ b0764 JW0747	Molybdenum transport system permease protein ModB		
P0AF08	APBC_ECOLI	mrp b2113 JW2100	Iron-sulfur cluster carrier protein		
P0AF10	MTLR_ECOLI	mtlR b3601 JW3575	Mannitol operon repressor (Mannitol repressor protein)		
P0AF20	NAGC_ECOLI	nagC nagR b0676 JW0662	DNA-binding transcriptional dual regulator NagC (N-acetylglucosamine repressor) (NagC repressor)		
P0AF40	YIJD_ECOLI	yijD b3964 JW3936	Inner membrane protein YijD		
P0AF43	YJBB_ECOLI	yjbB b4020 JW3980	Putative inorganic phosphate export protein YjbB		
P0AF63	NSRR_ECOLI	nsrR yjeB b4178 JW4136	HTH-type transcriptional repressor NsrR		
P0AF96	TABA_ECOLI	tabA yjgK b4252 JW5756	Toxin-antitoxin biofilm protein TabA		
P0AFA5	NFRB_ECOLI	nfrB b0569 JW0558	Bacteriophage adsorption protein B (Bacteriophage N4 adsorption protein B)		
P0AFJ1	YJDM_ECOLI	yjdM phnA b4108 JW4069	Phosphonoacetate hydrolase YjdM (EC 3.11.1.2)		
P0AFK0	PMBA_ECOLI	pmbA tldE b4235 JW4194	Metalloprotease PmbA (EC 3.4.-.-) (Protein TldE)		
P0AFK2	PNUC_ECOLI	pnuC b0751 JW0734	Nicotinamide riboside transporter PnuC		
P0AFM9	PSPB_ECOLI	pspB b1305 JW1298	Phage shock protein B		P0AFN2
P0AFR4	YCIO_ECOLI	yciO b1267 JW5196	Threonylcarbamoyl-AMP synthase YciO (EC 2.7.7.87) (L-threonylcarbamoyladenylate synthase)		
P0AFS1	LSRD_ECOLI	lsrD ydeZ b1515 JW1508	Autoinducer 2 import system permease protein LsrD (AI-2 import system permease protein LsrD)		
P0AFV2	YHID_ECOLI	yhiD yhhE b3508 JW5670	Putative magnesium transporter YhiD		
P0AFV8	PSPD_ECOLI	pspD b1307 JW1300	Phage shock protein D		
P0AFY2	SANA_ECOLI	sanA yeiF b2144 JW2132	Protein SanA		
P0AG14	SOHB_ECOLI	sohB b1272 JW1264	Probable protease SohB (EC 3.4.21.-)		
P0AG34	RHTB_ECOLI	rhtB yigK b3824 JW5585	Homoserine/homoserine lactone efflux protein		
P0AG38	RHTC_ECOLI	rhtC yigJ b3823 JW5586	Threonine efflux protein		
P0AG84	YGHA_ECOLI	yghA b3003 JW2972	Uncharacterized oxidoreductase YghA (EC 1.-.-.-)		
P0AGG8	TLDD_ECOLI	tldD yhdO b3244 JW3213	Metalloprotease TldD (EC 3.4.-.-)		
P0AGH8	PSTC_ECOLI	pstC phoW b3727 JW3705	Phosphate transport system permease protein PstC		
P0AGI4	XYLH_ECOLI	xylH b3568 JW3540	Xylose transport system permease protein XylH		
P0AGI8	TRKA_ECOLI	trkA b3290 JW3251	Trk system potassium uptake protein TrkA (K(+)-uptake protein TrkA)		P69829
P0AGJ2	TRMH_ECOLI	trmH spoU b3651 JW3626	tRNA (guanosine(18)-2'-O)-methyltransferase (EC 2.1.1.34) (tRNA [Gm18] methyltransferase)		
P0AGK4	YHBY_ECOLI	yhbY b3180 JW3147	RNA-binding protein YhbY		P0AG30
P0C8J8	GATZ_ECOLI	gatZ b2095 JW2082	D-tagatose-1,6-bisphosphate aldolase subunit GatZ	PATHWAY: Carbohydrate metabolism; D-tagatose 6-phosphate degradation; D-glyceraldehyde 3-phosphate and glycerone phosphate from D-tagatose 6-phosphate: step 2/2.	
P0C8K0	KBAZ_ECOLI	kbaZ agaZ yhaX b3132 JW3101	D-tagatose-1,6-bisphosphate aldolase subunit KbaZ	PATHWAY: Carbohydrate metabolism; D-tagatose 6-phosphate degradation; D-glyceraldehyde 3-phosphate and glycerone phosphate from D-tagatose 6-phosphate: step 2/2.	
P0CB39	EPTC_ECOLI	eptC cptA yijP b3955 JW3927	Phosphoethanolamine transferase EptC (EC 2.7.-.-)	PATHWAY: Bacterial outer membrane biogenesis; LPS core biosynthesis.	
P0CE44	UIDB_ECOLI	uidB gusB uidP b1616 JW1608	Glucuronide carrier protein homolog		
P0CF88	INSI1_ECOLI	insI1 b0256 JW0246	Transposase InsI for insertion sequence element IS30A		
P0CK95	ACFD_ECOLI	yghJ b4466 JW5925 ECK2968	Putative lipoprotein AcfD homolog		
P0DP21	YJIP_ECOLI	yjiP rpnD b4338 JW5953	Putative inactive recombination-promoting nuclease-like protein YjiP		
P0DP70	PHNE2_ECOLI	phnE phnE2 b4103 JW4065	Putative cryptic phosphonate transport system permease protein PhnE2		
P0DP89	ILVGP_ECOLI	ilvG b4488 b3767	Putative acetolactate synthase isozyme 2 large subunit (AHAS-II) (ALS-II) (Acetohydroxy-acid synthase II large subunit)	PATHWAY: Amino-acid biosynthesis; L-isoleucine biosynthesis; L-isoleucine from 2-oxobutanoate: step 1/4.; PATHWAY: Amino-acid biosynthesis; L-valine biosynthesis; L-valine from pyruvate: step 1/4.	
P10371	HIS4_ECOLI	hisA b2024 JW2006	1-(5-phosphoribosyl)-5-[(5-phosphoribosylamino)methylideneamino] imidazole-4-carboxamide isomerase (EC 5.3.1.16) (Phosphoribosylformimino-5-aminoimidazole carboxamide ribotide isomerase)	PATHWAY: Amino-acid biosynthesis; L-histidine biosynthesis; L-histidine from 5-phospho-alpha-D-ribose 1-diphosphate: step 4/9.	
P10423	IAP_ECOLI	iap b2753 JW2723	Alkaline phosphatase isozyme conversion protein (EC 3.4.11.-)		
P10805	ENVY_ECOLI	envY b0566 JW0555	Porin thermoregulatory protein EnvY		
P11072	LIT_ECOLI	lit b1139 JW1125	Cell death peptidase (Bacteriophage T4 late gene expression-blocking protein) (GpLit)		
P11446	ARGC_ECOLI	argC b3958 JW3930	N-acetyl-gamma-glutamyl-phosphate reductase (AGPR) (EC 1.2.1.38) (N-acetyl-glutamate semialdehyde dehydrogenase) (NAGSA dehydrogenase)	PATHWAY: Amino-acid biosynthesis; L-arginine biosynthesis; N(2)-acetyl-L-ornithine from L-glutamate: step 3/4. {ECO:0000255|HAMAP-Rule:MF_00150, ECO:0000305|PubMed:13863980}.	
P11875	SYR_ECOLI	argS b1876 JW1865	Arginine--tRNA ligase (EC 6.1.1.19) (Arginyl-tRNA synthetase) (ArgRS)		
P11988	BGLB_ECOLI	bglB b3721 JW3699	6-phospho-beta-glucosidase BglB (EC 3.2.1.86) (Phospho-beta-glucosidase B)		
P11989	BGLG_ECOLI	bglG bglC b3723 JW3701	Cryptic beta-glucoside bgl operon antiterminator		P06710; P0AA04; P08839; P77700
P12999	BIOC_ECOLI	bioC b0777 JW0760	Malonyl-[acyl-carrier protein] O-methyltransferase (Malonyl-ACP O-methyltransferase) (EC 2.1.1.197) (Biotin synthesis protein BioC)	PATHWAY: Cofactor biosynthesis; biotin biosynthesis.	
P13024	FDHE_ECOLI	fdhE b3891 JW3862	Protein FdhE		P24183; P32176
P15006	MCRC_ECOLI	mcrC b4345 JW5789	Type IV methyl-directed restriction enzyme EcoKMcrBC (EcoKMcrBC) (Protein McrC)		P15005
P15070	FLIN_ECOLI	fliN flaN motD b1946 JW1930	Flagellar motor switch protein FliN		P06974
P15082	SRLR_ECOLI	srlR gutR b2707 JW2676	Glucitol operon repressor		P09373; P76092
P15286	FLK_ECOLI	flk div b2321 JW2318	Flagellar regulator Flk (Flagellar transcriptional regulator Flk) (Fluke)		
P15639	PUR9_ECOLI	purH b4006 JW3970	Bifunctional purine biosynthesis protein PurH [Includes: Phosphoribosylaminoimidazolecarboxamide formyltransferase (EC 2.1.2.3) (AICAR transformylase); IMP cyclohydrolase (EC 3.5.4.10) (ATIC) (IMP synthase) (Inosinicase)]	PATHWAY: Purine metabolism; IMP biosynthesis via de novo pathway; 5-formamido-1-(5-phospho-D-ribosyl)imidazole-4-carboxamide from 5-amino-1-(5-phospho-D-ribosyl)imidazole-4-carboxamide (10-formyl THF route): step 1/1.; PATHWAY: Purine metabolism; IMP biosynthesis via de novo pathway; IMP from 5-formamido-1-(5-phospho-D-ribosyl)imidazole-4-carboxamide: step 1/1.	
P15977	MALQ_ECOLI	malQ malA b3416 JW3379	4-alpha-glucanotransferase (EC 2.4.1.25) (Amylomaltase) (Disproportionating enzyme) (D-enzyme)		
P16525	TUS_ECOLI	tus tau b1610 JW1602	DNA replication terminus site-binding protein (Ter-binding protein)		P0ACB0
P16677	PHNC_ECOLI	phnC b4106 JW4067	Phosphonates import ATP-binding protein PhnC (EC 7.3.2.2)		
P16682	PHND_ECOLI	phnD psiD b4105 JW4066	Phosphonates-binding periplasmic protein		
P16689	PHNM_ECOLI	phnM b4095 JW4056	Alpha-D-ribose 1-methylphosphonate 5-triphosphate diphosphatase (RPnTP diphosphatase) (EC 3.6.1.63)		
P16690	PHNN_ECOLI	phnN b4094 JW4055	Ribose 1,5-bisphosphate phosphokinase PhnN (EC 2.7.4.23) (Ribose 1,5-bisphosphokinase)	PATHWAY: Metabolic intermediate biosynthesis; 5-phospho-alpha-D-ribose 1-diphosphate biosynthesis; 5-phospho-alpha-D-ribose 1-diphosphate from D-ribose 5-phosphate (route II): step 3/3.	
P16701	CYST_ECOLI	cysU cysT b2424 JW2417	Sulfate transport system permease protein CysT		
P17410	CHBR_ECOLI	chbR celD b1735 JW1724	HTH-type transcriptional regulator ChbR (Chb operon repressor)		
P17583	CYNX_ECOLI	cynX b0341 JW0332	Cyanate transport protein CynX		
P18393	YBDZ_ECOLI	ybdZ b4511 JW0577	Enterobactin biosynthesis protein YbdZ		
P18811	MALI_ECOLI	malI b1620 JW1612	Maltose regulon regulatory protein MalI		
P19317	NARW_ECOLI	narW b1466 JW1461	Probable nitrate reductase molybdenum cofactor assembly chaperone NarW (Redox enzyme maturation protein NarW)		P09152; P11349; P19318; P19319
P19769	INSK_ECOLI	insK dinS b3558 JW3528	Putative transposase InsK for insertion sequence element IS150		
P19930	HYAD_ECOLI	hyaD b0975 JW0957	Hydrogenase 1 maturation protease (EC 3.4.23.-)		P0ACD8; P00956
P20605	FIC_ECOLI	fic b3361 JW3324	Probable protein adenylyltransferase Fic (EC 2.7.7.108) (Cell filamentation protein Fic)		P06710
P21169	DCOR_ECOLI	speC b2965 JW5482	Constitutive ornithine decarboxylase (EC 4.1.1.17)	PATHWAY: Amine and polyamine biosynthesis; putrescine biosynthesis via L-ornithine pathway; putrescine from L-ornithine: step 1/1.	
P21367	YCAC_ECOLI	ycaC b0897 JW0880	Probable hydrolase YcaC (EC 4.-.-.-)		
P21420	NMPC_ECOLI	nmpC phmA b0553	Putative outer membrane porin protein NmpC		
P21515	ACPH_ECOLI	acpH yajB b0404 JW0394	Acyl carrier protein phosphodiesterase (ACP phosphodiesterase) (EC 3.1.4.14)		
P21893	RECJ_ECOLI	recJ b2892 JW2860	Single-stranded-DNA-specific exonuclease RecJ (EC 3.1.-.-)		P14294
P22586	FLIO_ECOLI	fliO flaP flbD b1947 JW5316	Flagellar protein FliO		
P23839	YICC_ECOLI	yicC orfX b3644 JW3619	Endoribonuclease YicC (EC 3.1.26.-)		
P23841	XAPR_ECOLI	xapR pndR yfeB b2405 JW2396	HTH-type transcriptional regulator XapR (Xanthosine operon regulatory protein)		
P23842	PDEA_ECOLI	pdeA yfeA b2395 JW5391	Probable cyclic di-GMP phosphodiesterase PdeA (EC 3.1.4.52)		
P23898	NLPC_ECOLI	nlpC b1708 JW1698	Probable endopeptidase NlpC (EC 3.4.-.-) (ORF-17) (Probable lipoprotein NlpC)		
P23910	ARAJ_ECOLI	araJ b0396 JW0386	Putative transporter AraJ		
P24174	MANC_ECOLI	manC cpsB rfbM b2049 JW2034	Mannose-1-phosphate guanylyltransferase (EC 2.7.7.13) (GDP-mannose pyrophosphorylase) (GMP) (GMPP)	PATHWAY: Nucleotide-sugar biosynthesis; GDP-alpha-D-mannose biosynthesis; GDP-alpha-D-mannose from alpha-D-mannose 1-phosphate (GTP route): step 1/1.	
P24175	MANB_ECOLI	manB cpsG rfbL b2048 JW2033	Phosphomannomutase (PMM) (EC 5.4.2.8)	PATHWAY: Nucleotide-sugar biosynthesis; GDP-alpha-D-mannose biosynthesis; alpha-D-mannose 1-phosphate from D-fructose 6-phosphate: step 2/2.	
P24181	ACRF_ECOLI	acrF envD b3266 JW3234	Multidrug export protein AcrF (Acriflavine resistance protein F) (Protein EnvD)		
P24200	MCRA_ECOLI	mcrA rglA b1159 JW1145	Type IV methyl-directed restriction enzyme EcoKMcrA (EcoKMcrA) (EC 3.1.21.-) (5-methylcytosine-specific restriction enzyme A)		
P24202	MRR_ECOLI	mrr b4351 JW4314	Type IV methyl-directed restriction enzyme EcoKMrr (EcoKMrr) (Mrr restriction system protein)		
P24218	INTD_ECOLI	intD int b0537 JW0525	Prophage integrase IntD (Prophage DLP12 integrase) (Prophage QSR' integrase)		
P24240	ASCB_ECOLI	ascB b2716 JW2686	6-phospho-beta-glucosidase AscB (EC 3.2.1.86)		
P24241	PTIBC_ECOLI	ascF b2715 JW5435	PTS system arbutin-, cellobiose-, and salicin-specific EIIBC component (EIIBC-Asc) (EII-Asc) [Includes: Arbutin-, cellobiose-, and salicin-specific phosphotransferase enzyme IIB component (EC 2.7.1.-) (PTS system arbutin-, cellobiose-, and salicin-specific EIIB component); Arbutin, cellobiose, and salicin permease IIC component (PTS system arbutin-, cellobiose-, and salicin-specific EIIC component)]		
P24242	ASCG_ECOLI	ascG b2714 JW5434	HTH-type transcriptional regulator AscG (Cryptic asc operon repressor)		
P24244	APPX_ECOLI	appX yccB b4592 JW0961.1 b0979.1	Putative cytochrome bd-II ubiquinol oxidase subunit AppX		
P25549	ASLA_ECOLI	aslA atsA b3801 JW3773	Putative sulfatase AslA (EC 3.1.6.-)		
P25741	WAAP_ECOLI	waaP rfaP b3630 JW3605	Lipopolysaccharide core heptose(I) kinase WaaP (EC 2.7.1.235)	PATHWAY: Bacterial outer membrane biogenesis; LPS core biosynthesis. {ECO:0000250|UniProtKB:Q9R9D6}.	
P25744	MDTG_ECOLI	mdtG yceE b1053 JW1040	Multidrug resistance protein MdtG		
P25748	GALS_ECOLI	galS b2151 JW2138	HTH-type transcriptional regulator GalS (Mgl repressor and galactose ultrainduction factor)		P03024
P25772	LIGB_ECOLI	ligB yicF b3647 JW3622	DNA ligase B (EC 6.5.1.2) (Polydeoxyribonucleotide synthase [NAD(+)] B)		
P25960	LEP4_ECOLI	gspO hofD hopD hopO yheC b3335 JW3297	Prepilin leader peptidase/N-methyltransferase [Includes: Leader peptidase (EC 3.4.23.43) (Prepilin peptidase); N-methyltransferase (EC 2.1.1.-)]		
P26266	FEPE_ECOLI	fepE b0587 JW0579	Ferric enterobactin transport protein FepE		
P26365	AMIB_ECOLI	amiB yjeD b4169 JW4127	N-acetylmuramoyl-L-alanine amidase AmiB (EC 3.5.1.28)		
P26612	AMY2_ECOLI	amyA yedC b1927 JW1912	Cytoplasmic alpha-amylase (EC 3.2.1.1) (1,4-alpha-D-glucan glucanohydrolase)		
P26649	GLGS_ECOLI	glgS scoR b3049 JW3021	Surface composition regulator		
P27111	CYNR_ECOLI	cynR b0338 JW5894	HTH-type transcriptional regulator CynR (Cyn operon transcriptional activator)		
P27126	WAAS_ECOLI	waaS rfaS b3629 JW3604	Lipopolysaccharide core biosynthesis protein WaaS	PATHWAY: Bacterial outer membrane biogenesis; LPS core biosynthesis. {ECO:0000305|PubMed:1385388}.; PATHWAY: Bacterial outer membrane biogenesis; LOS core biosynthesis. {ECO:0000305|PubMed:1385388}.	
P27127	WAAB_ECOLI	waaB rfaB b3628 JW3603	Lipopolysaccharide 1,6-galactosyltransferase (EC 2.4.1.-) (UDP-D-galactose:(Glucosyl)lipopolysaccharide-alpha-1,3-D-galactosyltransferase)	PATHWAY: Bacterial outer membrane biogenesis; LPS core biosynthesis. {ECO:0000269|PubMed:24479701}.	
P27240	WAAY_ECOLI	waaY rfaY b3625 JW3600	Lipopolysaccharide core heptose(II) kinase WaaY (EC 2.7.1.-)	PATHWAY: Bacterial outer membrane biogenesis; LPS core biosynthesis. {ECO:0000250|UniProtKB:Q9ZIS7}.	
P27242	WAAU_ECOLI	waaU rfaK waaK b3623 JW3598	Putative lipopolysaccharide heptosyltransferase 4 (EC 2.4.1.-) (ADP-heptose:LPS heptosyltransferase 4) (HepIV transferase)	PATHWAY: Bacterial outer membrane biogenesis; LPS core biosynthesis. {ECO:0000269|PubMed:1385388}.	
P27832	WECD_ECOLI	wecD rffC yifH b3790 JW5597	dTDP-fucosamine acetyltransferase (EC 2.3.1.210) (TDP-fucosamine acetyltransferase) (dTDP-4-amino-4,6-dideoxy-D-galactose acyltransferase)	PATHWAY: Bacterial outer membrane biogenesis; enterobacterial common antigen biosynthesis. {ECO:0000255|HAMAP-Rule:MF_02027}.	
P27835	WZYE_ECOLI	wzyE wzy b3793 JW3769	Probable ECA polymerase	PATHWAY: Bacterial outer membrane biogenesis; enterobacterial common antigen biosynthesis. {ECO:0000255|HAMAP-Rule:MF_01003, ECO:0000269|PubMed:16199561}.	
P27836	WECG_ECOLI	wecG rffM b3794 JW3770	UDP-N-acetyl-D-mannosaminuronic acid transferase (UDP-ManNAcA transferase) (EC 2.4.1.180)	PATHWAY: Bacterial outer membrane biogenesis; enterobacterial common antigen biosynthesis. {ECO:0000255|HAMAP-Rule:MF_01001}.	
P27862	YIGZ_ECOLI	yigZ b3848 JW5577	IMPACT family member YigZ		P0DTT0; P06612
P28249	ASMA_ECOLI	asmA yegA b2064 JW2049	Protein AsmA		
P30128	GREB_ECOLI	greB b3406 JW3369	Transcription elongation factor GreB (Transcript cleavage factor GreB)		
P30130	FIMD_ECOLI	fimD b4317 JW5780	Outer membrane usher protein FimD		P31697
P30149	YABI_ECOLI	yabI b0065 JW5005	Inner membrane protein YabI		
P30235	PSUK_ECOLI	psuK pscK yeiC b2166 JW2153	Pseudouridine kinase (EC 2.7.1.83)		
P30859	ARTI_ECOLI	artI b0863 JW0847	Putative ABC transporter arginine-binding protein 2		
P31060	MODF_ECOLI	modF ORF6 phrA b0760 JW0743	ABC transporter ATP-binding protein ModF (Photorepair protein PhrA)		
P31068	FLIH_ECOLI	fliH fla AII.3 fla BIII b1940 JW1924	Flagellar assembly protein FliH		
P31122	SOTB_ECOLI	sotB ydeA b1528 JW1521	Sugar efflux transporter		
P31125	EAMA_ECOLI	eamA ydeD b1533 JW5250	Probable amino-acid metabolite efflux pump		
P31126	YDEE_ECOLI	ydeE ydeF b1534 JW1527	Uncharacterized MFS-type transporter YdeE		
P31436	SETC_ECOLI	setC yicK b3659 JW3633	Sugar efflux transporter C		
P31440	ADEQ_ECOLI	adeQ yicO b3664 JW5636	Adenine permease AdeQ		
P31442	EMRD_ECOLI	emrD yicQ b3673 JW5634	Multidrug resistance protein D		
P31452	PTXC_ECOLI	glvC ptiC b3683 JW3660	Phosphotransferase IIC component GlvC (PTS system EIIC component)		
P31459	DGOK_ECOLI	dgoK yidV b3693 JW3670	2-dehydro-3-deoxygalactonokinase (EC 2.7.1.58) (2-keto-3-deoxy-galactonokinase) (2-oxo-3-deoxygalactonate kinase)	PATHWAY: Carbohydrate acid metabolism; D-galactonate degradation; D-glyceraldehyde 3-phosphate and pyruvate from D-galactonate: step 2/3.	
P31462	MDTL_ECOLI	mdtL yidY b3710 JW3688	Multidrug resistance protein MdtL		
P31463	YIDZ_ECOLI	yidZ b3711 JW3689	HTH-type transcriptional regulator YidZ		
P31474	HSRA_ECOLI	hsrA yieO b3754 JW3733	Probable transport protein HsrA (High-copy suppressor of rspA)		
P31548	THIQ_ECOLI	thiQ yabJ b0066 JW0065	Thiamine import ATP-binding protein ThiQ (EC 7.6.2.15)		
P31549	THIP_ECOLI	thiP yabK b0067 JW0066	Thiamine transport system permease protein ThiP		
P31574	FIXB_ECOLI	fixB yaaR b0042 JW0041	Protein FixB	PATHWAY: Amine and polyamine metabolism; carnitine metabolism.	P0AES0; P06993
P31600	NFRA_ECOLI	nfrA b0568 JW0557	Bacteriophage adsorption protein A (Bacteriophage N4 adsorption protein A)		
P31665	RPNC_ECOLI	rpnC yadD b0132 JW5010	Recombination-promoting nuclease RpnC (EC 3.1.21.-)		
P31802	NARP_ECOLI	narP b2193 JW2181	Nitrate/nitrite response regulator protein NarP		
P31825	TRMN6_ECOLI	yfiC b2575 JW2559	tRNA1(Val) (adenine(37)-N6)-methyltransferase (EC 2.1.1.223) (tRNA m6A37 methyltransferase)		
P31826	YDDA_ECOLI	yddA b1496 JW5242	Inner membrane ABC transporter ATP-binding protein YddA (CDS102)		
P31828	PQQL_ECOLI	pqqL yddC b1494 JW1489	Probable zinc protease PqqL (EC 3.4.24.-)		
P32137	YIHP_ECOLI	yihP b3877 JW3848	Putative 2,3-dihydroxypropane-1-sulfonate exporter		
P32154	PTFLB_ECOLI	frvB yiiJ b3899 JW5562	Fructose-like PTS system EIIBC component [Includes: PTS system fructose-like EIIB component (EC 2.7.1.202) (Fructose-like phosphotransferase enzyme IIB component); PTS system fructose-like EIIC component (Fructose-like permease IIC component)]		
P32155	PTFLA_ECOLI	frvA yiiK b3900 JW3871	PTS system fructose-like EIIA component (Fructose-like phosphotransferase enzyme IIA component)		
P32672	PTFC2_ECOLI	frwC yijJ b3949 JW3921	Fructose-like permease IIC component 2 (PTS system fructose-like EIIC component 2)		
P32675	PFLC_ECOLI	pflC yijM b3952 JW3924	Pyruvate formate-lyase 2-activating enzyme (EC 1.97.1.4) (Formate-C-acetyltransferase-activating enzyme 2) (PFL-activating enzyme 2)		
P32676	PTFB3_ECOLI	frwD yijN b3953 JW3925	PTS system fructose-like EIIB component 3 (EC 2.7.1.202) (Fructose-like phosphotransferase enzyme IIB component 3)		
P32696	PSPG_ECOLI	pspG yjbO b4050 JW5716	Phage shock protein G		P0AFN2
P32701	PDEC_ECOLI	pdeC yjcC b4061 JW4022	Probable cyclic di-GMP phosphodiesterase PdeC (EC 3.1.4.52)		
P32710	NRFE_ECOLI	nrfE yjcL b4074 JW4035	Probable cytochrome c-type biogenesis protein NrfE		
P32711	NRFF_ECOLI	nrfF yjcM b4075 JW4036	Formate-dependent nitrite reductase complex subunit NrfF		
P32714	MDTP_ECOLI	mdtP yjcP b4080 JW4041	Multidrug resistance outer membrane protein MdtP		
P32720	ALSC_ECOLI	alsC yjcV b4086 JW4047	D-allose transport system permease protein AlsC		
P33014	TSUB_ECOLI	tsuB yeeD b2012 JW1994	Putative sulfur carrier protein TsuB (Thiosulfate uptake protein B)		P63284
P33021	NUPX_ECOLI	nupX yeiJ b2161 JW2148	Putative nucleoside permease NupX		
P33024	PSUT_ECOLI	psuT pscT yeiM b2164 JW2151	Putative pseudouridine transporter		
P33128	YADV_ECOLI	yadV ecpD b0140 JW0136	Probable fimbrial chaperone YadV		
P33135	FLIR_ECOLI	fliR flaP b1950 JW1934	Flagellar biosynthetic protein FliR		
P33136	OPGG_ECOLI	mdoG opgG b1048 JW1035	Glucans biosynthesis protein G	PATHWAY: Glycan metabolism; osmoregulated periplasmic glucan (OPG) biosynthesis.	
P33222	YJFC_ECOLI	yjfC b4186 JW4144	Putative acid--amine ligase YjfC (EC 6.3.1.-)		
P33228	RECT_ECOLI	recT b1349 JW1343	Protein RecT (P33)		
P33230	RCBA_ECOLI	rcbA ydaC b1347 JW1341	Double-strand break reduction protein		P75728
P33234	ADIY_ECOLI	adiY b4116 JW4077	HTH-type transcriptional regulator AdiY		
P33340	YEHA_ECOLI	yehA b2108 JW2095	Uncharacterized fimbrial-like protein YehA		
P33341	YEHB_ECOLI	yehB b2109 JW2096	Outer membrane usher protein YehB		
P33342	YEHC_ECOLI	yehC b2110 JW2097	Probable fimbrial chaperone YehC		
P33343	YEHD_ECOLI	yehD b2111 JW2098	Uncharacterized fimbrial-like protein YehD		
P33362	YEHZ_ECOLI	yehZ osmF b2131 JW2119	Glycine betaine-binding protein YehZ		
P33369	MDTQ_ECOLI	mdtQ yohG yohH b2139 JW5838/JW5358 b2138	Putative multidrug resistance outer membrane protein MdtQ		
P33593	NIKD_ECOLI	nikD b3479 JW3444	Nickel import ATP-binding protein NikD (EC 7.2.2.11)		
P33594	NIKE_ECOLI	nikE b3480 JW3445	Nickel import ATP-binding protein NikE (EC 7.2.2.11)		
P33595	SGRR_ECOLI	sgrR yabN b0069 JW0068	HTH-type transcriptional regulator SgrR		
P33596	RECX_ECOLI	recX oraA b2698 JW2668	Regulatory protein RecX (Protein OraA)		P61949
P33920	NDPA_ECOLI	yejK b2186 JW2174	Nucleoid-associated protein YejK		
P34749	HOFQ_ECOLI	hofQ hopQ b3391 JW3354	DNA utilization protein HofQ		
P36561	COBS_ECOLI	cobS b1992 JW1970	Adenosylcobinamide-GDP ribazoletransferase (EC 2.7.8.26) (Cobalamin synthase) (Cobalamin-5'-phosphate synthase)	PATHWAY: Cofactor biosynthesis; adenosylcobalamin biosynthesis; adenosylcobalamin from cob(II)yrinate a,c-diamide: step 7/7.	
P36562	COBT_ECOLI	cobT b1991 JW1969	Nicotinate-nucleotide--dimethylbenzimidazole phosphoribosyltransferase (NN:DBI PRT) (EC 2.4.2.21) (N(1)-alpha-phosphoribosyltransferase)	PATHWAY: Nucleoside biosynthesis; alpha-ribazole biosynthesis; alpha-ribazole from 5,6-dimethylbenzimidazole: step 1/2.	
P36647	PPDD_ECOLI	ppdD b0108 JW0104	Prepilin peptidase-dependent protein D		
P36667	WBBL_ECOLI	wbbL b4571 JW2016 b2031	Rhamnosyltransferase WbbL (EC 2.4.1.-)	PATHWAY: Bacterial outer membrane biogenesis; lipopolysaccharide biosynthesis.	
P36678	GSPM_ECOLI	gspM hopZ pshM b3334 JW5704	Putative type II secretion system protein M (T2SS protein M) (Putative general secretion pathway protein M) (Transport protein PshM)		
P36771	LRHA_ECOLI	lrhA genR b2289 JW2284	Probable HTH-type transcriptional regulator LrhA		
P36879	YADG_ECOLI	yadG b0127 JW0123	Uncharacterized ABC transporter ATP-binding protein YadG		P69910
P36995	CSPB_ECOLI	cspB b1557 JW1549	Cold shock-like protein CspB (CSP-B)		
P37009	FBPC_ECOLI	fbpC afuC yagC b0262 JW0254	Fe(3+) ions import ATP-binding protein FbpC (EC 7.2.2.7)		
P37016	YADK_ECOLI	yadK b0136 JW0132	Uncharacterized fimbrial-like protein YadK		
P37017	YADL_ECOLI	yadL b0137 JW0133	Uncharacterized fimbrial-like protein YadL		
P37018	YADM_ECOLI	yadM b0138 JW0134	Uncharacterized fimbrial-like protein YadM		
P37024	HRPB_ECOLI	hrpB yadO b0148 JW0144	ATP-dependent RNA helicase HrpB (EC 3.6.4.13)		
P37047	CDAR_ECOLI	cdaR sdaR yaeG b0162 JW5013	Carbohydrate diacid regulator (Sugar diacid regulator)		
P37049	YAEI_ECOLI	yaeI b0164 JW5014	Phosphodiesterase YaeI (EC 3.1.4.-)		
P37050	YADN_ECOLI	yadN b0141 JW0137	Uncharacterized fimbrial-like protein YadN		
P37127	AEGA_ECOLI	aegA yffG b2468 JW2452	Putative oxidoreductase AegA (Anaerobically expressed gene A)		
P37147	FXSA_ECOLI	fxsA yjeG b4140 JW4100	UPF0716 protein FxsA (Suppressor of F exclusion of phage T7)		
P37180	HYBB_ECOLI	hybB b2995 JW5494	Probable Ni/Fe-hydrogenase 2 b-type cytochrome subunit		
P37182	HYBD_ECOLI	hybD b2993 JW2961	Hydrogenase 2 maturation protease (EC 3.4.23.-)		
P37195	DCTR_ECOLI	dctR yhiF b3507 JW3475	HTH-type transcriptional regulator DctR		P0DMC7
