Entry	Entry Name	Gene Names	Protein names	Organism	EC number	KEGG	GeneID
P15288	PEPD_ECOLI	pepD pepH b0237 JW0227	Cytosol non-specific dipeptidase (EC 3.4.13.18) (Aminoacyl-histidine dipeptidase) (Beta-alanyl-histidine dipeptidase) (Carnosinase) (Cysteinylglycinase) (Peptidase D) (Xaa-His dipeptidase) (X-His dipeptidase)	Escherichia coli (strain K12)	3.4.13.18	ecj:JW0227;eco:b0237;ecoc:C3026_01125;ecoc:C3026_23860;	945013;
P15373	PRLF_ECOLI	prlF sohA b3129 JW3098	Antitoxin PrlF (HtrA suppressor protein SohA)	Escherichia coli (strain K12)		ecj:JW3098;eco:b3129;ecoc:C3026_17055;	75203755;947639;
P15640	PUR2_ECOLI	purD b4005 JW3969	Phosphoribosylamine--glycine ligase (EC 6.3.4.13) (GARS) (Glycinamide ribonucleotide synthetase) (Phosphoribosylglycinamide synthetase)	Escherichia coli (strain K12)	6.3.4.13	ecj:JW3969;eco:b4005;ecoc:C3026_21630;	948504;
P15723	DGTP_ECOLI	dgt b0160 JW0156	Deoxyguanosinetriphosphate triphosphohydrolase (dGTP triphosphohydrolase) (dGTPase) (EC 3.1.5.1)	Escherichia coli (strain K12)	3.1.5.1	ecj:JW0156;eco:b0160;ecoc:C3026_00730;	947177;
P15770	AROE_ECOLI	aroE b3281 JW3242	Shikimate dehydrogenase (NADP(+)) (SD) (SDH) (EC 1.1.1.25)	Escherichia coli (strain K12)	1.1.1.25	ecj:JW3242;eco:b3281;ecoc:C3026_17845;	947776;
P15877	DHG_ECOLI	gcd b0124 JW0120	Quinoprotein glucose dehydrogenase (EC 1.1.5.2) (Glucose dehydrogenase [pyrroloquinoline-quinone])	Escherichia coli (strain K12)	1.1.5.2	ecj:JW0120;eco:b0124;ecoc:C3026_00525;	944830;
P15993	AROP_ECOLI	aroP b0112 JW0108	Aromatic amino acid transport protein AroP (Aromatic amino acid:H(+) symporter AroP) (General aromatic amino acid permease) (General aromatic transport system)	Escherichia coli (strain K12)		ecj:JW0108;eco:b0112;	75202073;946018;
P16384	MIAA_ECOLI	miaA trpX b4171 JW4129	tRNA dimethylallyltransferase (EC 2.5.1.75) (Dimethylallyl diphosphate:tRNA dimethylallyltransferase) (DMAPP:tRNA dimethylallyltransferase) (DMATase) (Isopentenyl-diphosphate:tRNA isopentenyltransferase) (IPP transferase) (IPPT) (IPTase)	Escherichia coli (strain K12)	2.5.1.75	ecj:JW4129;eco:b4171;ecoc:C3026_22540;	93777650;948690;
P16456	SELD_ECOLI	selD fdhB b1764 JW1753	Selenide, water dikinase (EC 2.7.9.3) (Selenium donor protein) (Selenophosphate synthase)	Escherichia coli (strain K12)	2.7.9.3	ecj:JW1753;eco:b1764;ecoc:C3026_10065;	75057654;946768;
P16528	ICLR_ECOLI	iclR b4018 JW3978	Transcriptional repressor IclR (Acetate operon repressor)	Escherichia coli (strain K12)		ecj:JW3978;eco:b4018;ecoc:C3026_21705;	93777877;948524;
P16659	SYP_ECOLI	proS drpA b0194 JW0190	Proline--tRNA ligase (EC 6.1.1.15) (Global RNA synthesis factor) (Prolyl-tRNA synthetase) (ProRS)	Escherichia coli (strain K12)	6.1.1.15	ecj:JW0190;eco:b0194;ecoc:C3026_00900;	949116;
P16686	PHNH_ECOLI	phnH b4100 JW4061	Alpha-D-ribose 1-methylphosphonate 5-triphosphate synthase subunit PhnH (RPnTP synthase subunit PhnH) (EC 2.7.8.37)	Escherichia coli (strain K12)	2.7.8.37	ecj:JW4061;eco:b4100;ecoc:C3026_22160;	948619;
P16687	PHNI_ECOLI	phnI b4099 JW4060	Alpha-D-ribose 1-methylphosphonate 5-triphosphate synthase subunit PhnI (RPnTP synthase subunit PhnI) (EC 2.7.8.37) (Ribose 1-methylphosphonate 5-triphosphate synthase nucleosidase subunit)	Escherichia coli (strain K12)	2.7.8.37	ecj:JW4060;eco:b4099;ecoc:C3026_22155;	948605;
P16688	PHNJ_ECOLI	phnJ b4098 JW4059	Alpha-D-ribose 1-methylphosphonate 5-phosphate C-P lyase (PRPn C-P lyase) (EC 4.7.1.1)	Escherichia coli (strain K12)	4.7.1.1	ecj:JW4059;eco:b4098;ecoc:C3026_22150;	948606;
P16692	PHNP_ECOLI	phnP b4092 JW4053	Phosphoribosyl 1,2-cyclic phosphate phosphodiesterase (EC 3.1.4.55) (Phosphoribosyl cyclic phosphodiesterase)	Escherichia coli (strain K12)	3.1.4.55	ecj:JW4053;eco:b4092;ecoc:C3026_22120;	948600;
P16703	CYSM_ECOLI	cysM b2421 JW2414	Cysteine synthase B (CSase B) (EC 2.5.1.47) (O-acetylserine (thiol)-lyase B) (OAS-TL B) (O-acetylserine sulfhydrylase B)	Escherichia coli (strain K12)	2.5.1.47	ecj:JW2414;eco:b2421;ecoc:C3026_13455;	946888;
P16869	FHUE_ECOLI	fhuE b1102 JW1088	Hydroxamate siderophore receptor FhuE (Ferric iron uptake protein) (Ferric-coprogen receptor FhuE) (Outer-membrane receptor for Fe(III)-coprogen, Fe(III)-ferrioxamine B and Fe(III)-rhodotrulic acid) (TonB-dependent transporter receptor FhuE) (TBDT receptor FhuE)	Escherichia coli (strain K12)		ecj:JW1088;eco:b1102;ecoc:C3026_06655;	945649;
P16926	MREC_ECOLI	mreC b3250 JW3219	Cell shape-determining protein MreC (Cell shape protein MreC) (Rod shape-determining protein MreC)	Escherichia coli (strain K12)		ecj:JW3219;eco:b3250;	947655;
P17109	MEND_ECOLI	menD b2264 JW5374	2-succinyl-5-enolpyruvyl-6-hydroxy-3-cyclohexene-1-carboxylate synthase (SEPHCHC synthase) (EC 2.2.1.9) (Menaquinone biosynthesis protein MenD)	Escherichia coli (strain K12)	2.2.1.9	ecj:JW5374;eco:b2264;ecoc:C3026_12645;	946720;
P17115	GUTQ_ECOLI	gutQ srlQ b2708 JW5431	Arabinose 5-phosphate isomerase GutQ (API) (G-API) (EC 5.3.1.13) (Phosphosugar aldol-ketol isomerase)	Escherichia coli (strain K12)	5.3.1.13	ecj:JW5431;eco:b2708;ecoc:C3026_14905;	947587;
P17117	NFSA_ECOLI	nfsA mda18 mdaA ybjB b0851 JW0835	Oxygen-insensitive NADPH nitroreductase (EC 1.-.-.-) (Modulator of drug activity A)	Escherichia coli (strain K12)	1.-.-.-	ecj:JW0835;eco:b0851;ecoc:C3026_05310;	945483;
P17169	GLMS_ECOLI	glmS b3729 JW3707	Glutamine--fructose-6-phosphate aminotransferase [isomerizing] (EC 2.6.1.16) (D-fructose-6-phosphate amidotransferase) (GFAT) (Glucosamine-6-phosphate synthase) (Hexosephosphate aminotransferase) (L-glutamine--D-fructose-6-phosphate amidotransferase)	Escherichia coli (strain K12)	2.6.1.16	ecj:JW3707;eco:b3729;	75173963;948241;
P17411	CHBF_ECOLI	chbF celF ydjD b1734 JW1723	6-phospho-beta-glucosidase (EC 3.2.1.86) (Cellobiose-6-phosphate hydrolase) (Phospho-chitobiase)	Escherichia coli (strain K12)	3.2.1.86	ecj:JW1723;eco:b1734;ecoc:C3026_09910;	946266;
P17443	MURG_ECOLI	murG b0090 JW0088	UDP-N-acetylglucosamine--N-acetylmuramyl-(pentapeptide) pyrophosphoryl-undecaprenol N-acetylglucosamine transferase (EC 2.4.1.227) (Undecaprenyl-PP-MurNAc-pentapeptide-UDPGlcNAc GlcNAc transferase)	Escherichia coli (strain K12)	2.4.1.227	ecj:JW0088;eco:b0090;ecoc:C3026_00355;	946321;
P17444	BETA_ECOLI	betA b0311 JW0303	Oxygen-dependent choline dehydrogenase (CDH) (CHD) (EC 1.1.99.1) (Betaine aldehyde dehydrogenase) (BADH) (EC 1.2.1.8)	Escherichia coli (strain K12)	1.1.99.1; 1.2.1.8	ecj:JW0303;eco:b0311;ecoc:C3026_01520;ecoc:C3026_24695;	945716;
P17445	BETB_ECOLI	betB b0312 JW0304	Betaine aldehyde dehydrogenase (BADH) (EC 1.2.1.8)	Escherichia coli (strain K12)	1.2.1.8	ecj:JW0304;eco:b0312;ecoc:C3026_01525;ecoc:C3026_24700;	947376;
P17846	CYSI_ECOLI	cysI b2763 JW2733	Sulfite reductase [NADPH] hemoprotein beta-component (SiR-HP) (SiRHP) (EC 1.8.1.2)	Escherichia coli (strain K12)	1.8.1.2	ecj:JW2733;eco:b2763;ecoc:C3026_15185;	947231;
P17854	CYSH_ECOLI	cysH b2762 JW2732	Phosphoadenosine 5'-phosphosulfate reductase (PAPS reductase) (EC 1.8.4.8) (3'-phosphoadenylylsulfate reductase) (PAPS reductase, thioredoxin dependent) (PAPS sulfotransferase) (PAdoPS reductase)	Escherichia coli (strain K12)	1.8.4.8	ecj:JW2732;eco:b2762;ecoc:C3026_15180;	75058622;947230;
P17888	PRIA_ECOLI	priA srgA b3935 JW3906	Replication restart protein PriA (ATP-dependent DNA helicase PriA) (EC 5.6.2.4) (DNA 3'-5' helicase PriA) (DNA replication initiation factor PriA) (Primosomal protein n') (Replication factor Y)	Escherichia coli (strain K12)	5.6.2.4	ecj:JW3906;eco:b3935;ecoc:C3026_21265;	948426;
P17952	MURC_ECOLI	murC b0091 JW0089	UDP-N-acetylmuramate--L-alanine ligase (EC 6.3.2.8) (UDP-N-acetylmuramoyl-L-alanine synthetase)	Escherichia coli (strain K12)	6.3.2.8	ecj:JW0089;eco:b0091;ecoc:C3026_00360;	75202092;946153;
P17993	UBIG_ECOLI	ubiG pufX yfaB b2232 JW2226	Ubiquinone biosynthesis O-methyltransferase (2-octaprenyl-6-hydroxyphenol methylase) (EC 2.1.1.222) (3-demethylubiquinone-8 3-O-methyltransferase) (EC 2.1.1.64)	Escherichia coli (strain K12)	2.1.1.222; 2.1.1.64	ecj:JW2226;eco:b2232;ecoc:C3026_12470;	75172359;75206477;946607;
P18196	MINC_ECOLI	minC b1176 JW1165	Septum site-determining protein MinC	Escherichia coli (strain K12)		ecj:JW1165;eco:b1176;ecoc:C3026_06930;	945744;
P18200	PGPA_ECOLI	pgpA yajN b0418 JW0408	Phosphatidylglycerophosphatase A (EC 3.1.3.27) (Phosphatidylglycerolphosphate phosphatase A) (PGP phosphatase A)	Escherichia coli (strain K12)	3.1.3.27	ecj:JW0408;eco:b0418;ecoc:C3026_02040;	93777042;947542;
P18335	ARGD_ECOLI	argD dapC dtu b3359 JW3322	Acetylornithine/succinyldiaminopimelate aminotransferase (ACOAT) (DapATase) (Succinyldiaminopimelate transferase) (EC 2.6.1.11) (EC 2.6.1.17)	Escherichia coli (strain K12)	2.6.1.11; 2.6.1.17	ecj:JW3322;eco:b3359;ecoc:C3026_18245;	947864;
P18775	DMSA_ECOLI	dmsA b0894 JW5118	Dimethyl sulfoxide reductase DmsA (DMSO reductase) (DMSOR) (Me2SO reductase) (EC 1.8.5.3)	Escherichia coli (strain K12)	1.8.5.3	ecj:JW5118;eco:b0894;ecoc:C3026_05530;	75170969;945508;
P18776	DMSB_ECOLI	dmsB b0895 JW0878	Anaerobic dimethyl sulfoxide reductase chain B (DMSO reductase iron-sulfur subunit)	Escherichia coli (strain K12)		ecj:JW0878;eco:b0895;ecoc:C3026_05535;	86863417;93776525;945507;
P18843	NADE_ECOLI	nadE efg ntrL b1740 JW1729	NH(3)-dependent NAD(+) synthetase (EC 6.3.1.5) (Nicotinamide adenine dinucleotide synthetase) (NADS) (Nitrogen regulatory protein)	Escherichia coli (strain K12)	6.3.1.5	ecj:JW1729;eco:b1740;ecoc:C3026_09940;	946946;
P18956	GGT_ECOLI	ggt b3447 JW3412	Glutathione hydrolase proenzyme (EC 3.4.19.13) (Gamma-glutamyltranspeptidase proenzyme) (GGT) (EC 2.3.2.2) [Cleaved into: Glutathione hydrolase large chain; Glutathione hydrolase small chain]	Escherichia coli (strain K12)	2.3.2.2; 3.4.19.13	ecj:JW3412;eco:b3447;ecoc:C3026_18670;	947947;
P19318	NARY_ECOLI	narY b1467 JW1462	Respiratory nitrate reductase 2 beta chain (EC 1.7.5.1)	Escherichia coli (strain K12)	1.7.5.1	ecj:JW1462;eco:b1467;ecoc:C3026_08515;	946034;
P19319	NARZ_ECOLI	narZ b1468 JW1463	Respiratory nitrate reductase 2 alpha chain (EC 1.7.5.1)	Escherichia coli (strain K12)	1.7.5.1	ecj:JW1463;eco:b1468;ecoc:C3026_08520;	945999;
P19624	PDXA_ECOLI	pdxA b0052 JW0051	4-hydroxythreonine-4-phosphate dehydrogenase (EC 1.1.1.262) (4-(phosphohydroxy)-L-threonine dehydrogenase)	Escherichia coli (strain K12)	1.1.1.262	ecj:JW0051;eco:b0052;ecoc:C3026_00270;	944919;
P19636	EUTC_ECOLI	eutC b2440 JW2433	Ethanolamine ammonia-lyase small subunit (EAL small subunit) (EC 4.3.1.7) (Ethanolamine ammonia-lyase beta subunit) (Ethanolamine ammonia-lyase light chain) (Ethanolamine deaminase small subunit)	Escherichia coli (strain K12)	4.3.1.7	ecj:JW2433;eco:b2440;ecoc:C3026_13550;	946925;
P19925	ENTD_ECOLI	entD b0583 JW5085	Enterobactin synthase component D (4'-phosphopantetheinyl transferase EntD) (EC 2.7.8.-) (Enterochelin synthase D)	Escherichia coli (strain K12)	2.7.8.-	ecj:JW5085;eco:b0583;	945194;
P19926	AGP_ECOLI	agp b1002 JW0987	Glucose-1-phosphatase (G1Pase) (EC 3.1.3.10)	Escherichia coli (strain K12)	3.1.3.10	ecj:JW0987;eco:b1002;ecoc:C3026_06100;	945773;
P19934	TOLA_ECOLI	tolA cim excC lky b0739 JW0729	Tol-Pal system protein TolA	Escherichia coli (strain K12)		ecj:JW0729;eco:b0739;ecoc:C3026_03710;	946625;
P20083	PARE_ECOLI	parE nfxD b3030 JW2998	DNA topoisomerase 4 subunit B (EC 5.6.2.2) (Topoisomerase IV subunit B)	Escherichia coli (strain K12)	5.6.2.2	ecj:JW2998;eco:b3030;ecoc:C3026_16550;	93778963;947501;
P20966	PTFBC_ECOLI	fruA ptsF b2167 JW2154	PTS system fructose-specific EIIB'BC component (EIIB'BC-Fru) [Includes: PTS system fructose-specific EIIB component (EC 2.7.1.202) (EIII-Fru) (Fructose-specific phosphotransferase enzyme IIB component); PTS system fructose-specific EIIC component (Fructose permease IIC component)]	Escherichia coli (strain K12)	2.7.1.202	ecj:JW2154;eco:b2167;ecoc:C3026_12140;	946672;
P21151	FADA_ECOLI	fadA oldA b3845 JW5578	3-ketoacyl-CoA thiolase FadA (EC 2.3.1.16) (Acetyl-CoA acyltransferase) (Beta-ketothiolase) (Fatty acid oxidation complex subunit beta)	Escherichia coli (strain K12)	2.3.1.16	ecj:JW5578;eco:b3845;ecoc:C3026_20790;	948324;
P21156	CYSD_ECOLI	cysD b2752 JW2722	Sulfate adenylyltransferase subunit 2 (EC 2.7.7.4) (ATP-sulfurylase small subunit) (Sulfate adenylate transferase) (SAT)	Escherichia coli (strain K12)	2.7.7.4	ecj:JW2722;eco:b2752;ecoc:C3026_15130;	93779254;947217;
P21165	PEPQ_ECOLI	pepQ b3847 JW3823	Xaa-Pro dipeptidase (X-Pro dipeptidase) (EC 3.4.13.9) (Imidodipeptidase) (Proline dipeptidase) (Prolidase)	Escherichia coli (strain K12)	3.4.13.9	ecj:JW3823;eco:b3847;ecoc:C3026_20800;	86861950;948335;
P21170	SPEA_ECOLI	speA b2938 JW2905	Biosynthetic arginine decarboxylase (ADC) (EC 4.1.1.19)	Escherichia coli (strain K12)	4.1.1.19	ecj:JW2905;eco:b2938;ecoc:C3026_16085;	947432;
P21177	FADB_ECOLI	fadB oldB b3846 JW3822	Fatty acid oxidation complex subunit alpha [Includes: Enoyl-CoA hydratase/Delta(3)-cis-Delta(2)-trans-enoyl-CoA isomerase/3-hydroxybutyryl-CoA epimerase (EC 4.2.1.17) (EC 5.1.2.3) (EC 5.3.3.8); 3-hydroxyacyl-CoA dehydrogenase (EC 1.1.1.35)]	Escherichia coli (strain K12)	1.1.1.35; 4.2.1.17; 5.1.2.3; 5.3.3.8	ecj:JW3822;eco:b3846;ecoc:C3026_20795;	948336;
P21179	CATE_ECOLI	katE b1732 JW1721	Catalase HPII (EC 1.11.1.6) (Hydroxyperoxidase II)	Escherichia coli (strain K12)	1.11.1.6	ecj:JW1721;eco:b1732;ecoc:C3026_09900;	946234;
P21338	RNI_ECOLI	rna rnsA b0611 JW0603	Ribonuclease I (RNase I) (EC 4.6.1.21) (Enterobacter ribonuclease)	Escherichia coli (strain K12)	4.6.1.21	ecj:JW0603;eco:b0611;ecoc:C3026_03055;	949065;
P21345	GLTP_ECOLI	gltP b4077 JW4038	Glutamate/aspartate-proton symporter GltP (Glutamate-aspartate carrier protein) (Proton-glutamate-aspartate transport protein)	Escherichia coli (strain K12)		ecj:JW4038;eco:b4077;ecoc:C3026_22035;	948591;
P21369	PNCA_ECOLI	pncA nam ydjB b1768 JW1757	Nicotinamidase (EC 3.5.1.19) (Nicotinamide deamidase) (NAMase) (Pyrazinamidase) (PZAase) (EC 3.5.1.-)	Escherichia coli (strain K12)	3.5.1.-; 3.5.1.19	ecj:JW1757;eco:b1768;ecoc:C3026_10095;	946276;
P21437	GLPX2_ECOLI	yggF yggK b2930 JW2897	Fructose-1,6-bisphosphatase 2 class 2 (FBPase 2 class 2) (EC 3.1.3.11) (D-fructose-1,6-bisphosphate 1-phosphohydrolase 2 class 2)	Escherichia coli (strain K12)	3.1.3.11	ecj:JW2897;eco:b2930;ecoc:C3026_16050;	947410;
P21499	RNR_ECOLI	rnr vacB yjeC b4179 JW5741	Ribonuclease R (RNase R) (EC 3.1.13.1) (Protein VacB)	Escherichia coli (strain K12)	3.1.13.1	ecj:JW5741;eco:b4179;ecoc:C3026_22580;	948692;
P21507	SRMB_ECOLI	srmB rbaB rhlA b2576 JW2560	ATP-dependent RNA helicase SrmB (EC 3.6.4.13)	Escherichia coli (strain K12)	3.6.4.13	ecj:JW2560;eco:b2576;ecoc:C3026_14270;	947055;
P21513	RNE_ECOLI	rne ams hmp1 b1084 JW1071	Ribonuclease E (RNase E) (EC 3.1.26.12)	Escherichia coli (strain K12)	3.1.26.12	ecj:JW1071;eco:b1084;ecoc:C3026_06565;	945641;
P21514	PDEL_ECOLI	pdeL yahA b0315 JW0307	Cyclic di-GMP phosphodiesterase PdeL (EC 3.1.4.52)	Escherichia coli (strain K12)	3.1.4.52	ecj:JW0307;eco:b0315;ecoc:C3026_01545;ecoc:C3026_24715;	947459;
P21599	KPYK2_ECOLI	pykA b1854 JW1843	Pyruvate kinase II (EC 2.7.1.40) (PK-2)	Escherichia coli (strain K12)	2.7.1.40	ecj:JW1843;eco:b1854;ecoc:C3026_10565;	93776121;946527;
P21645	LPXD_ECOLI	lpxD firA omsA b0179 JW0174	UDP-3-O-(3-hydroxymyristoyl)glucosamine N-acyltransferase (UDP-3-O-(3-OHC14)-GlcN N-acyltransferase) (EC 2.3.1.191) (Protein FirA) (Rifampicin resistance protein) (UDP-3-O-(3-hydroxytetradecanoyl)glucosamine N-acyltransferase)	Escherichia coli (strain K12)	2.3.1.191	ecj:JW0174;eco:b0179;ecoc:C3026_00820;	86862689;944882;
P21693	DBPA_ECOLI	dbpA b1343 JW1337	ATP-dependent RNA helicase DbpA (EC 3.6.4.13)	Escherichia coli (strain K12)	3.6.4.13	ecj:JW1337;eco:b1343;ecoc:C3026_07870;	947153;
P21829	YBHA_ECOLI	ybhA b0766 JW0749	Pyridoxal phosphate phosphatase YbhA (PLP phosphatase) (EC 3.1.3.74)	Escherichia coli (strain K12)	3.1.3.74	ecj:JW0749;eco:b0766;ecoc:C3026_03885;	945372;
P21865	KDPD_ECOLI	kdpD b0695 JW0683	Sensor protein KdpD (EC 2.7.13.3)	Escherichia coli (strain K12)	2.7.13.3	ecj:JW0683;eco:b0695;ecoc:C3026_03470;	946744;
P21888	SYC_ECOLI	cysS b0526 JW0515	Cysteine--tRNA ligase (EC 6.1.1.16) (Cysteinyl-tRNA synthetase) (CysRS)	Escherichia coli (strain K12)	6.1.1.16	ecj:JW0515;eco:b0526;ecoc:C3026_02580;	946969;
P22106	ASNB_ECOLI	asnB b0674 JW0660	Asparagine synthetase B [glutamine-hydrolyzing] (AS-B) (EC 6.3.5.4)	Escherichia coli (strain K12)	6.3.5.4	ecj:JW0660;eco:b0674;ecoc:C3026_03350;	89519974;945281;
P22188	MURE_ECOLI	murE b0085 JW0083	UDP-N-acetylmuramoyl-L-alanyl-D-glutamate--2,6-diaminopimelate ligase (EC 6.3.2.13) (Meso-A2pm-adding enzyme) (Meso-diaminopimelate-adding enzyme) (UDP-MurNAc-L-Ala-D-Glu:meso-diaminopimelate ligase) (UDP-MurNAc-tripeptide synthetase) (UDP-N-acetylmuramyl-tripeptide synthetase)	Escherichia coli (strain K12)	6.3.2.13	ecj:JW0083;eco:b0085;ecoc:C3026_00330;	944791;
P22255	CYSQ_ECOLI	cysQ amtA b4214 JW4172	3'(2'),5'-bisphosphate nucleotidase CysQ (EC 3.1.3.7) (3'(2'),5-bisphosphonucleoside 3'(2')-phosphohydrolase) (3'-phosphoadenosine 5'-phosphate phosphatase) (PAP phosphatase) (DPNPase)	Escherichia coli (strain K12)	3.1.3.7	ecj:JW4172;eco:b4214;ecoc:C3026_22760;	948728;
P22256	GABT_ECOLI	gabT b2662 JW2637	4-aminobutyrate aminotransferase GabT (EC 2.6.1.19) (5-aminovalerate transaminase) (EC 2.6.1.48) (GABA aminotransferase) (GABA-AT) (Gamma-amino-N-butyrate transaminase) (GABA transaminase) (Glutamate:succinic semialdehyde transaminase) (L-AIBAT)	Escherichia coli (strain K12)	2.6.1.19; 2.6.1.48	ecj:JW2637;eco:b2662;ecoc:C3026_14675;	948067;
P22259	PCKA_ECOLI	pckA pck b3403 JW3366	Phosphoenolpyruvate carboxykinase (ATP) (PCK) (PEP carboxykinase) (PEPCK) (EC 4.1.1.49)	Escherichia coli (strain K12)	4.1.1.49	ecj:JW3366;eco:b3403;ecoc:C3026_18465;	945667;
P22333	ADD_ECOLI	add b1623 JW1615	Adenosine deaminase (EC 3.5.4.4) (Adenosine aminohydrolase)	Escherichia coli (strain K12)	3.5.4.4	ecj:JW1615;eco:b1623;ecoc:C3026_09330;	75171683;75204467;945851;
P22523	MUKB_ECOLI	mukB b0924 JW0907	Chromosome partition protein MukB (Structural maintenance of chromosome-related protein)	Escherichia coli (strain K12)		ecj:JW0907;eco:b0924;ecoc:C3026_05680;	945549;
P22525	YCBB_ECOLI	ycbB b0925 JW0908	Probable L,D-transpeptidase YcbB (EC 2.-.-.-)	Escherichia coli (strain K12)	2.-.-.-	ecj:JW0908;eco:b0925;ecoc:C3026_05685;	945541;
P22564	RIHC_ECOLI	rihC yaaF b0030 JW0028	Non-specific ribonucleoside hydrolase RihC (EC 3.2.-.-) (Purine/pyrimidine ribonucleoside hydrolase)	Escherichia coli (strain K12)	3.2.-.-	ecj:JW0028;eco:b0030;ecoc:C3026_00145;	75169929;944796;
P22634	MURI_ECOLI	murI dga glr yijA b3967 JW5550	Glutamate racemase (EC 5.1.1.3)	Escherichia coli (strain K12)	5.1.1.3	ecj:JW5550;eco:b3967;	948467;
P22729	LIVM_ECOLI	livM b3456 JW3421	High-affinity branched-chain amino acid transport system permease protein LivM (LIV-I protein M)	Escherichia coli (strain K12)		ecj:JW3421;eco:b3456;ecoc:C3026_18720;	947966;
P22731	LIVF_ECOLI	livF b3454 JW3419	High-affinity branched-chain amino acid transport ATP-binding protein LivF (LIV-I protein F)	Escherichia coli (strain K12)		ecj:JW3419;eco:b3454;	86862152;86948307;947961;
P23003	TRMA_ECOLI	trmA b3965 JW3937	tRNA/tmRNA (uracil-C(5))-methyltransferase (EC 2.1.1.-) (EC 2.1.1.35) (tRNA (uracil(54)-C(5))-methyltransferase) (tRNA(m5U54)-methyltransferase) (RUMT) (tmRNA (uracil(341)-C(5))-methyltransferase)	Escherichia coli (strain K12)	2.1.1.-; 2.1.1.35	ecj:JW3937;eco:b3965;ecoc:C3026_21425;	75203203;947143;
P23256	MALY_ECOLI	malY b1622 JW1614	Protein MalY [Includes: Cystathionine beta-lyase MalY (CBL) (EC 4.4.1.13) (Beta-cystathionase MalY) (Cysteine lyase MalY) (Cysteine-S-conjugate beta-lyase MalY); Maltose regulon modulator]	Escherichia coli (strain K12)	4.4.1.13	ecj:JW1614;eco:b1622;ecoc:C3026_09325;	945937;
P23367	MUTL_ECOLI	mutL b4170 JW4128	DNA mismatch repair protein MutL	Escherichia coli (strain K12)		ecj:JW4128;eco:b4170;ecoc:C3026_22535;	948691;
P23484	FECI_ECOLI	fecI b4293 JW4253	Ferric citrate uptake sigma factor FecI	Escherichia coli (strain K12)		ecj:JW4253;eco:b4293;ecoc:C3026_23150;	93777538;946839;
P23522	GARL_ECOLI	garL yhaF b3126 JW3095	5-keto-4-deoxy-D-glucarate aldolase (KDGluc aldolase) (KDGlucA) (EC 4.1.2.20) (2-dehydro-3-deoxy-D-glucarate aldolase) (2-keto-3-deoxy-D-glucarate aldolase) (5-dehydro-4-deoxy-D-glucarate aldolase) (Alpha-keto-beta-deoxy-D-glucarate aldolase)	Escherichia coli (strain K12)	4.1.2.20	ecj:JW3095;eco:b3126;ecoc:C3026_17040;	947630;
P23538	PPSA_ECOLI	ppsA pps b1702 JW1692	Phosphoenolpyruvate synthase (PEP synthase) (EC 2.7.9.2) (Pyruvate, water dikinase)	Escherichia coli (strain K12)	2.7.9.2	ecj:JW1692;eco:b1702;ecoc:C3026_09745;	75171769;75203549;946209;
P23721	SERC_ECOLI	serC pdxC pdxF b0907 JW0890	Phosphoserine aminotransferase (EC 2.6.1.52) (Phosphohydroxythreonine aminotransferase) (PSAT)	Escherichia coli (strain K12)	2.6.1.52	ecj:JW0890;eco:b0907;ecoc:C3026_05595;	945527;
P23827	ECOT_ECOLI	eco eti b2209 JW2197	Ecotin	Escherichia coli (strain K12)		ecj:JW2197;eco:b2209;ecoc:C3026_12345;	946700;
P23830	PSS_ECOLI	pssA pss b2585 JW2569	CDP-diacylglycerol--serine O-phosphatidyltransferase PssA (EC 2.7.8.8) (Phosphatidylserine synthase)	Escherichia coli (strain K12)	2.7.8.8	ecj:JW2569;eco:b2585;ecoc:C3026_14325;	75172701;75206279;947059;
P23836	PHOP_ECOLI	phoP b1130 JW1116	Transcriptional regulatory protein PhoP	Escherichia coli (strain K12)		ecj:JW1116;eco:b1130;ecoc:C3026_06800;	945697;
P23837	PHOQ_ECOLI	phoQ b1129 JW1115	Sensor protein PhoQ (EC 2.7.13.3) (EC 3.1.3.-) (Sensor histidine protein kinase/phosphatase PhoQ)	Escherichia coli (strain K12)	2.7.13.3; 3.1.3.-	ecj:JW1115;eco:b1129;ecoc:C3026_06795;	93776281;946326;
P23843	OPPA_ECOLI	oppA b1243 JW1235	Periplasmic oligopeptide-binding protein OppA (Polyamine-induced protein) (PI protein)	Escherichia coli (strain K12)		ecj:JW1235;eco:b1243;	945830;
P23845	CYSN_ECOLI	cysN b2751 JW2721	Sulfate adenylyltransferase subunit 1 (EC 2.7.7.4) (ATP-sulfurylase large subunit) (Sulfate adenylate transferase) (SAT)	Escherichia coli (strain K12)	2.7.7.4	ecj:JW2721;eco:b2751;ecoc:C3026_15125;	93779255;947219;
P23847	DPPA_ECOLI	dppA b3544 JW3513	Dipeptide-binding protein (DBP) (Periplasmic dipeptide transport protein)	Escherichia coli (strain K12)		ecj:JW3513;eco:b3544;ecoc:C3026_19210;	75173738;75201993;948062;
P23857	PSPE_ECOLI	pspE b1308 JW1301	Thiosulfate sulfurtransferase PspE (TST) (EC 2.8.1.1) (Phage shock protein E)	Escherichia coli (strain K12)	2.8.1.1	ecj:JW1301;eco:b1308;ecoc:C3026_07670;	93775434;945652;
P23862	PRIC_ECOLI	priC b0467 JW0456	Replication restart protein PriC (Primosomal replication protein n'')	Escherichia coli (strain K12)		ecj:JW0456;eco:b0467;ecoc:C3026_02295;	75170485;945071;
P23865	PRC_ECOLI	prc tsp b1830 JW1819	Tail-specific protease (EC 3.4.21.102) (C-terminal-processing peptidase) (PRC protein) (Protease Re)	Escherichia coli (strain K12)	3.4.21.102	ecj:JW1819;eco:b1830;ecoc:C3026_10430;	946096;
P23872	AES_ECOLI	aes ybaC b0476 JW0465	Acetyl esterase (EC 3.1.1.-) (EcE)	Escherichia coli (strain K12)	3.1.1.-	ecj:JW0465;eco:b0476;ecoc:C3026_02340;	947514;
P23873	HIPB_ECOLI	hipB b1508 JW1501	Antitoxin HipB	Escherichia coli (strain K12)		ecj:JW1501;eco:b1508;ecoc:C3026_08725;	946065;
P23874	HIPA_ECOLI	hipA b1507 JW1500	Serine/threonine-protein kinase toxin HipA (Ser/Thr-protein kinase HipA) (EC 2.7.11.1) (Toxin HipA)	Escherichia coli (strain K12)	2.7.11.1	ecj:JW1500;eco:b1507;ecoc:C3026_08720;	946064;
P23882	FMT_ECOLI	fmt yhdD b3288 JW3249	Methionyl-tRNA formyltransferase (EC 2.1.2.9) (Met-tRNA(fMet) formyltransferase)	Escherichia coli (strain K12)	2.1.2.9	ecj:JW3249;eco:b3288;ecoc:C3026_17875;	947779;
P23883	PUUC_ECOLI	puuC aldH b1300 JW1293	NADP/NAD-dependent aldehyde dehydrogenase PuuC (ALDH) (EC 1.2.1.5) (3-hydroxypropionaldehyde dehydrogenase) (Gamma-glutamyl-gamma-aminobutyraldehyde dehydrogenase) (Gamma-Glu-gamma-aminobutyraldehyde dehydrogenase)	Escherichia coli (strain K12)	1.2.1.5	ecj:JW1293;eco:b1300;ecoc:C3026_07630;	947003;
P23886	CYDC_ECOLI	cydC mdrA mdrH surB b0886 JW0869	Glutathione/L-cysteine transport system ATP-binding/permease protein CydC (EC 7.4.2.-)	Escherichia coli (strain K12)	7.4.2.-	ecj:JW0869;eco:b0886;ecoc:C3026_05495;	945504;
P23890	CADC_ECOLI	cadC b4133 JW4094	Transcriptional activator CadC (Membrane-integrated pH sensor CadC)	Escherichia coli (strain K12)		ecj:JW4094;eco:b4133;ecoc:C3026_22340;	948653;
P23893	GSA_ECOLI	hemL gsa popC b0154 JW0150	Glutamate-1-semialdehyde 2,1-aminomutase (GSA) (EC 5.4.3.8) (Glutamate-1-semialdehyde aminotransferase) (GSA-AT)	Escherichia coli (strain K12)	5.4.3.8	ecj:JW0150;eco:b0154;ecoc:C3026_00700;	946892;
P23894	HTPX_ECOLI	htpX b1829 JW1818	Protease HtpX (EC 3.4.24.-) (Heat shock protein HtpX)	Escherichia coli (strain K12)	3.4.24.-	ecj:JW1818;eco:b1829;ecoc:C3026_10425;	946076;
P23895	EMRE_ECOLI	emrE eb mvrC b0543 JW0531	Multidrug transporter EmrE (Efflux-multidrug resistance protein EmrE) (Ethidium resistance protein) (Methyl viologen resistance protein C)	Escherichia coli (strain K12)		ecj:JW0531;eco:b0543;ecoc:C3026_02670;	948442;
P23908	ARGE_ECOLI	argE b3957 JW3929	Acetylornithine deacetylase (AO) (Acetylornithinase) (EC 3.5.1.16) (N-acetylornithinase) (NAO)	Escherichia coli (strain K12)	3.5.1.16	ecj:JW3929;eco:b3957;ecoc:C3026_21385;	948456;
P23909	MUTS_ECOLI	mutS fdv b2733 JW2703	DNA mismatch repair protein MutS	Escherichia coli (strain K12)		ecj:JW2703;eco:b2733;ecoc:C3026_15035;	947206;
P23930	LNT_ECOLI	lnt cutE b0657 JW0654	Apolipoprotein N-acyltransferase (ALP N-acyltransferase) (EC 2.3.1.269) (Copper homeostasis protein CutE)	Escherichia coli (strain K12)	2.3.1.269	ecj:JW0654;eco:b0657;ecoc:C3026_03285;	946201;
P24171	DCP_ECOLI	dcp b1538 JW1531	Dipeptidyl carboxypeptidase (EC 3.4.15.5) (Peptidyl-dipeptidase Dcp)	Escherichia coli (strain K12)	3.4.15.5	ecj:JW1531;eco:b1538;ecoc:C3026_08885;	946084;
