Entry	Entry Name	Gene Names	Protein names	Pathway	Interacts with
P0AG80	UGPB_ECOLI	ugpB b3453 JW3418	sn-glycerol-3-phosphate-binding periplasmic protein UgpB (Bile-responsive chaperone)		
P0AG86	SECB_ECOLI	secB b3609 JW3584	Protein-export protein SecB (Chaperone SecB)		P0AE88; P10408
P0AG90	SECD_ECOLI	secD b0408 JW0398	Protein translocase subunit SecD (Sec translocon accessory complex subunit SecD)		P07395
P0AG93	SECF_ECOLI	secF b0409 JW0399	Protein translocase subunit SecF (Sec translocon accessory complex subunit SecF)		
P0AG96	SECE_ECOLI	secE prlG b3981 JW3944	Protein translocase subunit SecE		P10408; P0AGA2
P0AG99	SECG_ECOLI	secG b3175 JW3142	Protein-export membrane protein SecG (P12) (Preprotein translocase band 1 subunit)		P10408; P0AGA2
P0AGA2	SECY_ECOLI	secY prlA b3300 JW3262	Protein translocase subunit SecY		P0A910; P10408; P0AG96; P0AG99
P0AGB0	SERB_ECOLI	serB b4388 JW4351	Phosphoserine phosphatase (PSP) (PSPase) (EC 3.1.3.3) (O-phosphoserine phosphohydrolase)	PATHWAY: Amino-acid biosynthesis; L-serine biosynthesis; L-serine from 3-phospho-D-glycerate: step 3/3.	
P0AGB3	RPOH_ECOLI	rpoH fam hin htpR b3461 JW3426	RNA polymerase sigma factor RpoH (Heat shock regulatory protein F33.4) (RNA polymerase sigma-32 factor)		P0A6Y8; P0AGD7; P0AAI3; P0A6F5
P0AGB6	RPOE_ECOLI	rpoE sigE b2573 JW2557	ECF RNA polymerase sigma-E factor (RNA polymerase sigma-E factor) (Sigma-24)		Q46864
P0AGC0	UHPT_ECOLI	uhpT b3666 JW3641	Hexose-6-phosphate:phosphate antiporter		
P0AGC3	SLT_ECOLI	slt sltY b4392 JW4355	Soluble lytic murein transglycosylase (EC 4.2.2.n1) (Exomuramidase) (Peptidoglycan lytic exotransglycosylase) (Slt70)		
P0AGD1	SODC_ECOLI	sodC b1646 JW1638	Superoxide dismutase [Cu-Zn] (EC 1.15.1.1) (Bacteriocuprein)		
P0AGD3	SODF_ECOLI	sodB b1656 JW1648	Superoxide dismutase [Fe] (EC 1.15.1.1)		
P0AGD7	SRP54_ECOLI	ffh b2610 JW5414	Signal recognition particle protein (EC 3.6.5.4) (Fifty-four homolog) (Ffh) (p48)		P10121; P0AGB3
P0AGE0	SSB_ECOLI	ssb exrB lexC b4059 JW4020	Single-stranded DNA-binding protein (SSB) (Helix-destabilizing protein)		P27296; P0ABS5; P06710; P28905; P17888; P0A7H3; P0AGE0
P0AGE4	SSTT_ECOLI	sstT ygjU b3089 JW3060	Serine/threonine transporter SstT (Na(+)/serine-threonine symporter)		
P0AGE6	CHRR_ECOLI	chrR yieF b3713 JW3691	Quinone reductase (EC 1.6.5.2) (Chromate reductase) (CHRR) (EC 1.6.-.-) (NAD(P)H dehydrogenase (quinone))		
P0AGE9	SUCD_ECOLI	sucD b0729 JW0718	Succinate--CoA ligase [ADP-forming] subunit alpha (EC 6.2.1.5) (Succinyl-CoA synthetase subunit alpha) (SCS-alpha)	PATHWAY: Carbohydrate metabolism; tricarboxylic acid cycle; succinate from succinyl-CoA (ligase route): step 1/1. {ECO:0000255|HAMAP-Rule:MF_01988, ECO:0000305|PubMed:10353839}.	P0A836
P0AGF2	CSDE_ECOLI	csdE ygdK b2811 JW2782	Sulfur acceptor protein CsdE		Q46925; Q46927
P0AGF4	XYLE_ECOLI	xylE b4031 JW3991	D-xylose-proton symporter (D-xylose transporter)		
P0AGF6	TDCB_ECOLI	tdcB b3117 JW3088	L-threonine dehydratase catabolic TdcB (EC 4.3.1.19) (L-serine dehydratase) (EC 4.3.1.17) (Threonine deaminase)	PATHWAY: Amino-acid degradation; L-threonine degradation via propanoate pathway; propanoate from L-threonine: step 1/4.	
P0AGG0	THIL_ECOLI	thiL b0417 JW0407	Thiamine-monophosphate kinase (TMP kinase) (Thiamine-phosphate kinase) (EC 2.7.4.16)	PATHWAY: Cofactor biosynthesis; thiamine diphosphate biosynthesis; thiamine diphosphate from thiamine phosphate: step 1/1.	
P0AGG2	TESB_ECOLI	tesB b0452 JW0442	Acyl-CoA thioesterase 2 (EC 3.1.2.20) (Thioesterase II) (TEII)		
P0AGI1	RBSC_ECOLI	rbsC b3750 JW3729	Ribose import permease protein RbsC		P04983; P02925
P0AGJ7	TRML_ECOLI	trmL yibK b3606 JW3581	tRNA (cytidine(34)-2'-O)-methyltransferase (EC 2.1.1.207) (tRNA (cytidine/uridine-2'-O-)-methyltransferase TrmL)		
P0AGJ9	SYY_ECOLI	tyrS b1637 JW1629	Tyrosine--tRNA ligase (EC 6.1.1.1) (Tyrosyl-tRNA synthetase) (TyrRS)		
P0AGK1	UBIA_ECOLI	ubiA cyr b4040 JW4000	4-hydroxybenzoate octaprenyltransferase (EC 2.5.1.39) (4-HB polyprenyltransferase) (PHB octaprenyl transferase)	PATHWAY: Cofactor biosynthesis; ubiquinone biosynthesis. {ECO:0000255|HAMAP-Rule:MF_01635, ECO:0000269|PubMed:4552989}.	
P0AGK8	ISCR_ECOLI	iscR yfhP b2531 JW2515	HTH-type transcriptional regulator IscR		P0AGK8
P0AGM7	URAA_ECOLI	uraA b2497 JW2482	Uracil permease (Uracil transporter) (Uracil/H(+) symporter UraA)		
P0C018	RL18_ECOLI	rplR b3304 JW3266	Large ribosomal subunit protein uL18 (50S ribosomal protein L18)		
P0C037	PPNP_ECOLI	ppnP yaiE b0391 JW0382	Pyrimidine/purine nucleoside phosphorylase (EC 2.4.2.1) (EC 2.4.2.2) (Adenosine phosphorylase) (Cytidine phosphorylase) (Guanosine phosphorylase) (Inosine phosphorylase) (Thymidine phosphorylase) (Uridine phosphorylase) (Xanthosine phosphorylase)		
P0C054	IBPA_ECOLI	ibpA hslT htpN b3687 JW3664	Small heat shock protein IbpA (16 kDa heat shock protein A)		P0C054; P0C058
P0C058	IBPB_ECOLI	ibpB hslS htpE b3686 JW3663	Small heat shock protein IbpB (16 kDa heat shock protein B)		P0C054; P0C058
P0C077	RELE_ECOLI	relE b1563 JW1555	mRNA interferase toxin RelE (EC 3.1.-.-) (Endoribonuclease RelE) (Toxin RelE)		P0C079
P0C079	RELB_ECOLI	relB b1564 JW1556	Antitoxin RelB		P0C077
P0C093	SLMA_ECOLI	slmA ttk yicB b3641 JW5641	Nucleoid occlusion factor SlmA (Protein Ttk) (Synthetically lethal with a defective Min system protein A)		P0C093
P0C0K3	SRKA_ECOLI	srkA rdoA yihE b3859 JW3831	Stress response kinase A (EC 2.7.11.1) (Serine/threonine protein kinase YihE) (Serine/threonine-protein kinase SrkA)		
P0C0L2	OSMC_ECOLI	osmC b1482 JW1477	Peroxiredoxin OsmC (EC 1.11.1.-) (Osmotically-inducible protein C)		
P0C0L7	PROP_ECOLI	proP b4111 JW4072	Proline/betaine transporter (Proline porter II) (PPII)		
P0C0R7	RLME_ECOLI	rlmE ftsJ mrsF rrmJ b3179 JW3146	Ribosomal RNA large subunit methyltransferase E (EC 2.1.1.166) (23S rRNA Um2552 methyltransferase) (Cell division protein FtsJ) (rRNA (uridine-2'-O-)-methyltransferase)		
P0C0S1	MSCS_ECOLI	mscS yggB b2924 JW2891	Small-conductance mechanosensitive channel		P0C0S1
P0C0T5	MEPA_ECOLI	mepA b2328 JW2325	Penicillin-insensitive murein endopeptidase (EC 3.4.24.-) (D-alanyl-D-alanine-endopeptidase) (DD-endopeptidase)		
P0C0V0	DEGP_ECOLI	degP htrA ptd b0161 JW0157	Periplasmic serine endoprotease DegP (EC 3.4.21.107) (Heat shock protein DegP) (Protease Do)		P0C0V0; P0A910; P06996; P02666; P00698
P0C7L2	PAAJ_ECOLI	paaJ paaE ydbW b1397 JW1392	3-oxoadipyl-CoA/3-oxo-5,6-dehydrosuberyl-CoA thiolase (EC 2.3.1.174) (EC 2.3.1.223)	PATHWAY: Aromatic compound metabolism; phenylacetate degradation.	
P0CE47	EFTU1_ECOLI	tufA b3339 JW3301	Elongation factor Tu 1 (EF-Tu 1) (EC 3.6.5.3) (Bacteriophage Q beta RNA-directed RNA polymerase subunit III) (P-43)		P61517; P76251; P15038; P0A6Y5; P00956; P04951; P10441; P22634; P23909; P33590; P0A6Z6; P77756; P0AG30; P0ADX9; P0A6P1; P0A8J4; P63389; P39408; Q06259; P14647
P0CE48	EFTU2_ECOLI	tufB b3980 JW3943	Elongation factor Tu 2 (EF-Tu 2) (EC 3.6.5.3) (Bacteriophage Q beta RNA-directed RNA polymerase subunit III) (P-43)		P0A6P1
P0CG19	RNPH_ECOLI	rph orfE b3643 JW3618	Truncated inactive ribonuclease PH (Truncated inactive RNase PH) (Inactive RNase PH) (Truncated RNase PH)		
P0DM85	RDCA_ECOLI	rdcA crfC yjdA b4109 JW4070	Regulator of diguanylate cyclase RdcA (EC 3.6.-.-) (Clamp-binding protein CrfC) (Clamp-binding sister replication fork colocalization protein) (Dynamin-like GTPase RdcA) (Regulator of a diguanylate cyclase A)		
P0DMC5	RCSC_ECOLI	rcsC b2218 JW5917/JW5920	Sensor histidine kinase RcsC (EC 2.7.13.3) (Capsular synthesis regulator component C)		
P0DMC7	RCSB_ECOLI	rcsB b2217 JW2205	Transcriptional regulatory protein RcsB (Capsular synthesis regulator component B)		P39404; P37195; P0DMC7; P39838
P0DTT0	BIPA_ECOLI	bipA o591 typA yihK b3871 JW5571	Large ribosomal subunit assembly factor BipA (EC 3.6.5.-) (50S ribosomal subunit assembly factor BipA) (GTP-binding protein BipA/TypA) (Ribosome assembly factor BipA) (Ribosome-dependent GTPase BipA) (Tyrosine phosphorylated protein A)		P75864; P0A898; P27862
P0DTV7	SPEFL_ECOLI	speFL b4803	Leader peptide SpeFL (Arrest peptide SpeFL)		
P10121	FTSY_ECOLI	ftsY b3464 JW3429	Signal recognition particle receptor FtsY (SRP receptor) (EC 3.6.5.4)		P0AGD7
P10378	ENTE_ECOLI	entE b0594 JW0586	Enterobactin synthase component E (EC 6.3.2.14) (2,3-dihydroxybenzoate-AMP ligase) (DHB-AMP ligase) (2,3-dihydroxybenzoate-AMP synthase) (EC 6.2.1.71) (Dihydroxybenzoic acid-activating enzyme) (Enterochelin synthase E)	PATHWAY: Siderophore biosynthesis; enterobactin biosynthesis. {ECO:0000305|PubMed:9485415}.	P15047; P0ADI4
P10408	SECA_ECOLI	secA azi pea prlD b0098 JW0096	Protein translocase subunit SecA (EC 7.4.2.8)		P02943; P0A910; P00634; P10408; P0AG86; P0AG96; P0AG99; P0AGA2; P0A8Z3
P10443	DPO3A_ECOLI	dnaE polC b0184 JW0179	DNA polymerase III subunit alpha (EC 2.7.7.7)		P0A988; P03007; P06710; P28630; P0A7K2; P77806
P10902	NADB_ECOLI	nadB nicB b2574 JW2558	L-aspartate oxidase (LASPO) (EC 1.4.3.16) (L-aspartate:fumarate oxidoreductase) (EC 1.5.99.-) (Quinolinate synthetase B)	PATHWAY: Cofactor biosynthesis; NAD(+) biosynthesis; iminoaspartate from L-aspartate (oxidase route): step 1/1. {ECO:0000269|PubMed:7033218, ECO:0000305|PubMed:2841129}.	
P10903	NARK_ECOLI	narK b1223 JW1214	Nitrate/nitrite antiporter NarK (Nitrate/nitrite exchanger) (Nitrite extrusion protein 1) (Nitrite facilitator 1)		
P10905	UGPA_ECOLI	ugpA b3452 JW3417	sn-glycerol-3-phosphate transport system permease protein UgpA		
P10906	UGPE_ECOLI	ugpE b3451 JW3416	sn-glycerol-3-phosphate transport system permease protein UgpE		
P10907	UGPC_ECOLI	ugpC b3450 JW3415	sn-glycerol-3-phosphate import ATP-binding protein UgpC (EC 7.6.2.10)		
P10908	UGPQ_ECOLI	ugpQ b3449 JW3414	Glycerophosphodiester phosphodiesterase, cytoplasmic (Glycerophosphoryl diester phosphodiesterase, cytoplasmic) (EC 3.1.4.46)		
P11071	ACEK_ECOLI	aceK b4016 JW3976	Isocitrate dehydrogenase kinase/phosphatase (IDH kinase/phosphatase) (IDHK/P) (EC 2.7.11.5) (EC 3.1.3.-)		P08200
P11349	NARH_ECOLI	narH b1225 JW1216	Respiratory nitrate reductase 1 beta chain (EC 1.7.5.1) (Nitrate reductase A subunit beta) (Quinol-nitrate oxidoreductase subunit beta)		P42593; P09152; P19317; P19318; P19319
P11350	NARI_ECOLI	narI chlI b1227 JW1218	Respiratory nitrate reductase 1 gamma chain (EC 1.7.5.1) (Cytochrome B-NR) (Nitrate reductase A subunit gamma) (Quinol-nitrate oxidoreductase subunit gamma)		
P11454	ENTF_ECOLI	entF b0586 JW0578	Enterobactin synthase component F (EC 6.3.2.14) (Enterochelin synthase F) (Nonribosomal peptide synthetase EntF) [Includes: L-serine--[L-seryl-carrier protein] ligase (EC 6.2.1.72) (Serine-activating enzyme) (Seryl-AMP ligase)]	PATHWAY: Siderophore biosynthesis; enterobactin biosynthesis. {ECO:0000269|PubMed:1826089, ECO:0000269|PubMed:216414, ECO:0000269|PubMed:9485415}.	
P11458	NADA_ECOLI	nadA nicA b0750 JW0733	Quinolinate synthase (EC 2.5.1.72) (Quinolinate synthetase A)	PATHWAY: Cofactor biosynthesis; NAD(+) biosynthesis; quinolinate from iminoaspartate: step 1/1. {ECO:0000255|HAMAP-Rule:MF_00567, ECO:0000269|PubMed:10648170}.	
P11551	FUCP_ECOLI	fucP b2801 JW2772	L-fucose-proton symporter (6-deoxy-L-galactose permease) (L-fucose permease) (L-fucose-H(+) symport protein)		
P11557	DAMX_ECOLI	damX yhfB b3388 JW3351	Cell division protein DamX		
P11667	ARGO_ECOLI	argO yggA b2923 JW2890	Arginine exporter protein ArgO		
P11868	TDCD_ECOLI	tdcD yhaA b3115 JW5806	Propionate kinase (EC 2.7.2.15)	PATHWAY: Amino-acid degradation; L-threonine degradation via propanoate pathway; propanoate from L-threonine: step 4/4. {ECO:0000255|HAMAP-Rule:MF_01881}.	P37747
P11880	MURF_ECOLI	murF mra b0086 JW0084	UDP-N-acetylmuramoyl-tripeptide--D-alanyl-D-alanine ligase (EC 6.3.2.10) (D-alanyl-D-alanine-adding enzyme) (UDP-MurNAc-pentapeptide synthetase)	PATHWAY: Cell wall biogenesis; peptidoglycan biosynthesis. {ECO:0000255|HAMAP-Rule:MF_02019, ECO:0000269|PubMed:2186811}.	
P12008	AROC_ECOLI	aroC b2329 JW2326	Chorismate synthase (CS) (EC 4.2.3.5) (5-enolpyruvylshikimate-3-phosphate phospholyase) (EPSP phospholyase)	PATHWAY: Metabolic intermediate biosynthesis; chorismate biosynthesis; chorismate from D-erythrose 4-phosphate and phosphoenolpyruvate: step 7/7. {ECO:0000255|HAMAP-Rule:MF_00300}.	
P12281	MOEA_ECOLI	moeA bisB chlE narE b0827 JW0811	Molybdopterin molybdenumtransferase (MPT Mo-transferase) (EC 2.10.1.1)	PATHWAY: Cofactor biosynthesis; molybdopterin biosynthesis.	P32173; P12281; P0A796
P12282	MOEB_ECOLI	moeB chlN b0826 JW0810	Molybdopterin-synthase adenylyltransferase (EC 2.7.7.80) (MoaD protein adenylase) (Molybdopterin-converting factor subunit 1 adenylase) (Sulfur carrier protein MoaD adenylyltransferase)	PATHWAY: Cofactor biosynthesis; molybdopterin biosynthesis.	P0A6Y8
P12295	UNG_ECOLI	ung b2580 JW2564	Uracil-DNA glycosylase (UDG) (EC 3.2.2.27)		P08957; P0A763; P14739
P12758	UDP_ECOLI	udp b3831 JW3808	Uridine phosphorylase (UPase) (UrdPase) (EC 2.4.2.3)	PATHWAY: Pyrimidine metabolism; UMP biosynthesis via salvage pathway; uracil from uridine (phosphorylase route): step 1/1.	
P12995	BIOA_ECOLI	bioA b0774 JW0757	Adenosylmethionine-8-amino-7-oxononanoate aminotransferase (EC 2.6.1.62) (7,8-diamino-pelargonic acid aminotransferase) (DAPA AT) (DAPA aminotransferase) (7,8-diaminononanoate synthase) (DANS) (Diaminopelargonic acid synthase)	PATHWAY: Cofactor biosynthesis; biotin biosynthesis; 7,8-diaminononanoate from 8-amino-7-oxononanoate (SAM route): step 1/1.	
P12996	BIOB_ECOLI	bioB b0775 JW0758	Biotin synthase (EC 2.8.1.6) (Biotin synthetase)	PATHWAY: Cofactor biosynthesis; biotin biosynthesis; biotin from 7,8-diaminononanoate: step 2/2. {ECO:0000305|PubMed:3058702}.	Q47147
P12998	BIOF_ECOLI	bioF b0776 JW0759	8-amino-7-oxononanoate synthase (AONS) (EC 2.3.1.47) (7-keto-8-amino-pelargonic acid synthase) (7-KAP synthase) (KAPA synthase) (8-amino-7-ketopelargonate synthase)	PATHWAY: Cofactor biosynthesis; biotin biosynthesis. {ECO:0000305|PubMed:3058702}.	
P13000	BIOD1_ECOLI	bioD1 b0778 JW0761	ATP-dependent dethiobiotin synthetase BioD 1 (EC 6.3.3.3) (DTB synthetase 1) (DTBS 1) (Dethiobiotin synthase 1)	PATHWAY: Cofactor biosynthesis; biotin biosynthesis; biotin from 7,8-diaminononanoate: step 1/2. {ECO:0000255|HAMAP-Rule:MF_00336}.	
P13001	BIOH_ECOLI	bioH bioB b3412 JW3375	Pimeloyl-[acyl-carrier protein] methyl ester esterase (EC 3.1.1.85) (Biotin synthesis protein BioH) (Carboxylesterase BioH)	PATHWAY: Cofactor biosynthesis; biotin biosynthesis.	P0A6A8
P13009	METH_ECOLI	metH b4019 JW3979	Methionine synthase (EC 2.1.1.13) (5-methyltetrahydrofolate--homocysteine methyltransferase) (Methionine synthase, vitamin-B12-dependent) (MS)	PATHWAY: Amino-acid biosynthesis; L-methionine biosynthesis via de novo pathway; L-methionine from L-homocysteine (MetH route): step 1/1.	
P13029	KATG_ECOLI	katG b3942 JW3914	Catalase-peroxidase (CP) (EC 1.11.1.21) (Hydroperoxidase I) (HPI) (Peroxidase/catalase)		
P13035	GLPD_ECOLI	glpD glyD b3426 JW3389	Aerobic glycerol-3-phosphate dehydrogenase (EC 1.1.5.3)	PATHWAY: Polyol metabolism; glycerol degradation via glycerol kinase pathway; glycerone phosphate from sn-glycerol 3-phosphate (aerobic route): step 1/1.	P0AEE8
P13036	FECA_ECOLI	fecA b4291 JW4251	Fe(3+) dicitrate transport protein FecA (Iron(III) dicitrate transport protein FecA)		P02929
P13039	FES_ECOLI	fes b0585 JW0576	Iron(III) enterobactin esterase (EC 3.1.1.108) (Enterochelin esterase) (Ferric enterobactin esterase)		
P13445	RPOS_ECOLI	rpoS appR katF nur otsX sigS b2741 JW5437	RNA polymerase sigma factor RpoS (Sigma S) (Sigma-38)		P0A8V2
P13458	SBCC_ECOLI	sbcC rmuA b0397 JW0387	Nuclease SbcCD subunit C		P76092
P13482	TREA_ECOLI	treA osmA b1197 JW1186	Periplasmic trehalase (EC 3.2.1.28) (Alpha,alpha-trehalase) (Alpha,alpha-trehalose glucohydrolase) (Tre37A)		
P13518	CSRD_ECOLI	csrD yhdA b3252 JW3221	RNase E specificity factor CsrD (Regulator of CsrB and CsrC decay CsrD)		
P13656	CHIA_ECOLI	chiA yheB b3338 JW3300	Probable bifunctional chitinase/lysozyme [Includes: Chitinase (EC 3.2.1.14); Lysozyme (EC 3.2.1.17)]		
P13738	NHAA_ECOLI	nhaA ant b0019 JW0018	Na(+)/H(+) antiporter NhaA (Na(+)/H(+) exchanger) (Na(+)/Li(+)/H(+) antiporter) (Sodium/proton antiporter NhaA)		
P14081	SELB_ECOLI	selB fdhA b3590 JW3563	Selenocysteine-specific elongation factor (SelB translation factor)		P23721
P14175	PROV_ECOLI	proV b2677 JW2652	Glycine betaine/proline betaine transport system ATP-binding protein ProV		P14176
P14176	PROW_ECOLI	proW b2678 JW2653	Glycine betaine/proline betaine transport system permease protein ProW		P14175
P14294	TOP3_ECOLI	topB b1763 JW1752	DNA topoisomerase 3 (EC 5.6.2.1) (DNA topoisomerase III)		P45544; P28632; P21893
P14375	ZRAR_ECOLI	zraR hydG b4004 JW3968	Transcriptional regulatory protein ZraR		
P14377	ZRAS_ECOLI	zraS hydH b4003 JW3967	Sensor histidine kinase ZraS (EC 2.7.13.3)		
P14407	FUMB_ECOLI	fumB b4122 JW4083	Fumarate hydratase class I, anaerobic (EC 4.2.1.2) (D-tartrate dehydratase) (EC 4.2.1.81) (Fumarase B)		
P14900	MURD_ECOLI	murD b0088 JW0086	UDP-N-acetylmuramoylalanine--D-glutamate ligase (EC 6.3.2.9) (D-glutamic acid-adding enzyme) (UDP-N-acetylmuramoyl-L-alanyl-D-glutamate synthetase)	PATHWAY: Cell wall biogenesis; peptidoglycan biosynthesis.	P14900; P0AGG4
P15005	MCRB_ECOLI	mcrB rglB b4346 JW5871	Type IV methyl-directed restriction enzyme EcoKMcrB subunit (EcoKMcrBC) (5-methylcytosine-specific restriction enzyme B) (EC 3.1.21.-)		P15005; P15006; P31806
P15028	FECB_ECOLI	fecB b4290 JW4250	Fe(3+) dicitrate-binding periplasmic protein FecB (Iron(III) dicitrate-binding periplasmic protein)		
P15029	FECD_ECOLI	fecD b4288 JW4248	Fe(3+) dicitrate transport system permease protein FecD (Iron(III) dicitrate transport system permease protein FecD)		
P15030	FECC_ECOLI	fecC b4289 JW4249	Fe(3+) dicitrate transport system permease protein FecC (Iron(III) dicitrate transport system permease protein FecC)		
P15034	AMPP_ECOLI	pepP b2908 JW2876	Xaa-Pro aminopeptidase (EC 3.4.11.9) (Aminoacylproline aminopeptidase) (Aminopeptidase P II) (APP-II) (X-Pro aminopeptidase)		P60560; P15288
P15042	DNLJ_ECOLI	ligA dnaL lig lop pdeC b2411 JW2403	DNA ligase (EC 6.5.1.2) (Polydeoxyribonucleotide synthase [NAD(+)])		P07813
P15043	RECQ_ECOLI	recQ b3822 JW5855	ATP-dependent DNA helicase RecQ (EC 5.6.2.4) (DNA 3'-5' helicase RecQ)		
P15047	ENTA_ECOLI	entA b0596 JW0588	2,3-dihydro-2,3-dihydroxybenzoate dehydrogenase (DiDHB-DH) (EC 1.3.1.28) (Trans-2,3-dihydro-2,3-dihydroxybenzoate dehydrogenase)	PATHWAY: Siderophore biosynthesis; enterobactin biosynthesis. {ECO:0000305}.	P15047; P10378
P15067	GLGX_ECOLI	glgX glyX b3431 JW3394	Glycogen debranching enzyme (EC 3.2.1.196) (Glycogen operon protein GlgX) (Limit dextrin alpha-1,6-maltotetraose-hydrolase)	PATHWAY: Glycan degradation; glycogen degradation. {ECO:0000255|HAMAP-Rule:MF_01248, ECO:0000269|PubMed:15687211, ECO:0000269|PubMed:779849}.	
P15254	PUR4_ECOLI	purL purI b2557 JW2541	Phosphoribosylformylglycinamidine synthase (FGAM synthase) (FGAMS) (EC 6.3.5.3) (Formylglycinamide ribonucleotide amidotransferase) (FGAR amidotransferase) (FGAR-AT)	PATHWAY: Purine metabolism; IMP biosynthesis via de novo pathway; 5-amino-1-(5-phospho-D-ribosyl)imidazole from N(2)-formyl-N(1)-(5-phospho-D-ribosyl)glycinamide: step 1/2. {ECO:0000255|HAMAP-Rule:MF_00419}.	
P15288	PEPD_ECOLI	pepD pepH b0237 JW0227	Cytosol non-specific dipeptidase (EC 3.4.13.18) (Aminoacyl-histidine dipeptidase) (Beta-alanyl-histidine dipeptidase) (Carnosinase) (Cysteinylglycinase) (Peptidase D) (Xaa-His dipeptidase) (X-His dipeptidase)		P60560; P15034
P15373	PRLF_ECOLI	prlF sohA b3129 JW3098	Antitoxin PrlF (HtrA suppressor protein SohA)		
P15640	PUR2_ECOLI	purD b4005 JW3969	Phosphoribosylamine--glycine ligase (EC 6.3.4.13) (GARS) (Glycinamide ribonucleotide synthetase) (Phosphoribosylglycinamide synthetase)	PATHWAY: Purine metabolism; IMP biosynthesis via de novo pathway; N(1)-(5-phospho-D-ribosyl)glycinamide from 5-phospho-alpha-D-ribose 1-diphosphate: step 2/2. {ECO:0000305|PubMed:2182115}.	
P15723	DGTP_ECOLI	dgt b0160 JW0156	Deoxyguanosinetriphosphate triphosphohydrolase (dGTP triphosphohydrolase) (dGTPase) (EC 3.1.5.1)		
P15770	AROE_ECOLI	aroE b3281 JW3242	Shikimate dehydrogenase (NADP(+)) (SD) (SDH) (EC 1.1.1.25)	PATHWAY: Metabolic intermediate biosynthesis; chorismate biosynthesis; chorismate from D-erythrose 4-phosphate and phosphoenolpyruvate: step 4/7. {ECO:0000255|HAMAP-Rule:MF_00222}.	P31064
P15877	DHG_ECOLI	gcd b0124 JW0120	Quinoprotein glucose dehydrogenase (EC 1.1.5.2) (Glucose dehydrogenase [pyrroloquinoline-quinone])		Q46925; P0AFQ7
P15993	AROP_ECOLI	aroP b0112 JW0108	Aromatic amino acid transport protein AroP (Aromatic amino acid:H(+) symporter AroP) (General aromatic amino acid permease) (General aromatic transport system)		
P16384	MIAA_ECOLI	miaA trpX b4171 JW4129	tRNA dimethylallyltransferase (EC 2.5.1.75) (Dimethylallyl diphosphate:tRNA dimethylallyltransferase) (DMAPP:tRNA dimethylallyltransferase) (DMATase) (Isopentenyl-diphosphate:tRNA isopentenyltransferase) (IPP transferase) (IPPT) (IPTase)		
P16456	SELD_ECOLI	selD fdhB b1764 JW1753	Selenide, water dikinase (EC 2.7.9.3) (Selenium donor protein) (Selenophosphate synthase)		
P16528	ICLR_ECOLI	iclR b4018 JW3978	Transcriptional repressor IclR (Acetate operon repressor)		P67910; P16528
P16659	SYP_ECOLI	proS drpA b0194 JW0190	Proline--tRNA ligase (EC 6.1.1.15) (Global RNA synthesis factor) (Prolyl-tRNA synthetase) (ProRS)		
P16686	PHNH_ECOLI	phnH b4100 JW4061	Alpha-D-ribose 1-methylphosphonate 5-triphosphate synthase subunit PhnH (RPnTP synthase subunit PhnH) (EC 2.7.8.37)		P16686
P16687	PHNI_ECOLI	phnI b4099 JW4060	Alpha-D-ribose 1-methylphosphonate 5-triphosphate synthase subunit PhnI (RPnTP synthase subunit PhnI) (EC 2.7.8.37) (Ribose 1-methylphosphonate 5-triphosphate synthase nucleosidase subunit)		P16685
P16688	PHNJ_ECOLI	phnJ b4098 JW4059	Alpha-D-ribose 1-methylphosphonate 5-phosphate C-P lyase (PRPn C-P lyase) (EC 4.7.1.1)		
P16692	PHNP_ECOLI	phnP b4092 JW4053	Phosphoribosyl 1,2-cyclic phosphate phosphodiesterase (EC 3.1.4.55) (Phosphoribosyl cyclic phosphodiesterase)		
P16703	CYSM_ECOLI	cysM b2421 JW2414	Cysteine synthase B (CSase B) (EC 2.5.1.47) (O-acetylserine (thiol)-lyase B) (OAS-TL B) (O-acetylserine sulfhydrylase B)	PATHWAY: Amino-acid biosynthesis; L-cysteine biosynthesis; L-cysteine from L-serine: step 2/2.	P24182
P16869	FHUE_ECOLI	fhuE b1102 JW1088	Hydroxamate siderophore receptor FhuE (Ferric iron uptake protein) (Ferric-coprogen receptor FhuE) (Outer-membrane receptor for Fe(III)-coprogen, Fe(III)-ferrioxamine B and Fe(III)-rhodotrulic acid) (TonB-dependent transporter receptor FhuE) (TBDT receptor FhuE)		
P16926	MREC_ECOLI	mreC b3250 JW3219	Cell shape-determining protein MreC (Cell shape protein MreC) (Rod shape-determining protein MreC)		
P17109	MEND_ECOLI	menD b2264 JW5374	2-succinyl-5-enolpyruvyl-6-hydroxy-3-cyclohexene-1-carboxylate synthase (SEPHCHC synthase) (EC 2.2.1.9) (Menaquinone biosynthesis protein MenD)	PATHWAY: Quinol/quinone metabolism; 1,4-dihydroxy-2-naphthoate biosynthesis; 1,4-dihydroxy-2-naphthoate from chorismate: step 2/7. {ECO:0000255|HAMAP-Rule:MF_01659}.; PATHWAY: Quinol/quinone metabolism; menaquinone biosynthesis. {ECO:0000255|HAMAP-Rule:MF_01659}.	
P17115	GUTQ_ECOLI	gutQ srlQ b2708 JW5431	Arabinose 5-phosphate isomerase GutQ (API) (G-API) (EC 5.3.1.13) (Phosphosugar aldol-ketol isomerase)		
P17117	NFSA_ECOLI	nfsA mda18 mdaA ybjB b0851 JW0835	Oxygen-insensitive NADPH nitroreductase (EC 1.-.-.-) (Modulator of drug activity A)		P28630
P17169	GLMS_ECOLI	glmS b3729 JW3707	Glutamine--fructose-6-phosphate aminotransferase [isomerizing] (EC 2.6.1.16) (D-fructose-6-phosphate amidotransferase) (GFAT) (Glucosamine-6-phosphate synthase) (Hexosephosphate aminotransferase) (L-glutamine--D-fructose-6-phosphate amidotransferase)		P62615; P76093
P17411	CHBF_ECOLI	chbF celF ydjD b1734 JW1723	6-phospho-beta-glucosidase (EC 3.2.1.86) (Cellobiose-6-phosphate hydrolase) (Phospho-chitobiase)		
P17443	MURG_ECOLI	murG b0090 JW0088	UDP-N-acetylglucosamine--N-acetylmuramyl-(pentapeptide) pyrophosphoryl-undecaprenol N-acetylglucosamine transferase (EC 2.4.1.227) (Undecaprenyl-PP-MurNAc-pentapeptide-UDPGlcNAc GlcNAc transferase)	PATHWAY: Cell wall biogenesis; peptidoglycan biosynthesis. {ECO:0000255|HAMAP-Rule:MF_00033, ECO:0000269|PubMed:1649817}.	P0AGJ5
P17444	BETA_ECOLI	betA b0311 JW0303	Oxygen-dependent choline dehydrogenase (CDH) (CHD) (EC 1.1.99.1) (Betaine aldehyde dehydrogenase) (BADH) (EC 1.2.1.8)	PATHWAY: Amine and polyamine biosynthesis; betaine biosynthesis via choline pathway; betaine aldehyde from choline (cytochrome c reductase route): step 1/1. {ECO:0000255|HAMAP-Rule:MF_00750}.	
P17445	BETB_ECOLI	betB b0312 JW0304	Betaine aldehyde dehydrogenase (BADH) (EC 1.2.1.8)	PATHWAY: Amine and polyamine biosynthesis; betaine biosynthesis via choline pathway; betaine from betaine aldehyde: step 1/1. {ECO:0000255|HAMAP-Rule:MF_00804}.	
P17846	CYSI_ECOLI	cysI b2763 JW2733	Sulfite reductase [NADPH] hemoprotein beta-component (SiR-HP) (SiRHP) (EC 1.8.1.2)	PATHWAY: Sulfur metabolism; hydrogen sulfide biosynthesis; hydrogen sulfide from sulfite (NADPH route): step 1/1. {ECO:0000255|HAMAP-Rule:MF_01540}.	
P17854	CYSH_ECOLI	cysH b2762 JW2732	Phosphoadenosine 5'-phosphosulfate reductase (PAPS reductase) (EC 1.8.4.8) (3'-phosphoadenylylsulfate reductase) (PAPS reductase, thioredoxin dependent) (PAPS sulfotransferase) (PAdoPS reductase)	PATHWAY: Sulfur metabolism; hydrogen sulfide biosynthesis; sulfite from sulfate: step 3/3. {ECO:0000255|HAMAP-Rule:MF_00063}.	
P17888	PRIA_ECOLI	priA srgA b3935 JW3906	Replication restart protein PriA (ATP-dependent DNA helicase PriA) (EC 5.6.2.4) (DNA 3'-5' helicase PriA) (DNA replication initiation factor PriA) (Primosomal protein n') (Replication factor Y)		P07013; P0AGE0
P17952	MURC_ECOLI	murC b0091 JW0089	UDP-N-acetylmuramate--L-alanine ligase (EC 6.3.2.8) (UDP-N-acetylmuramoyl-L-alanine synthetase)	PATHWAY: Cell wall biogenesis; peptidoglycan biosynthesis.	P77609; P39328
