Entry	Entry Name	Gene Names	Protein names	Pathway	Interacts with
A5A616	MGTS_ECOLI	mgtS yneM b4599 JW1527.1	Small protein MgtS		
O32583	THIS_ECOLI	thiS thiG1 b4407 JW3955	Sulfur carrier protein ThiS (Thiamine biosynthesis protein ThiS)	PATHWAY: Cofactor biosynthesis; thiamine diphosphate biosynthesis.	
P00350	6PGD_ECOLI	gnd b2029 JW2011	6-phosphogluconate dehydrogenase, decarboxylating (EC 1.1.1.44)	PATHWAY: Carbohydrate degradation; pentose phosphate pathway; D-ribulose 5-phosphate from D-glucose 6-phosphate (oxidative stage): step 3/3. {ECO:0000305|PubMed:19686854}.	P00350
P00363	FRDA_ECOLI	frdA b4154 JW4115	Fumarate reductase flavoprotein subunit (EC 1.3.5.1) (Quinol-fumarate reductase flavoprotein subunit) (QFR flavoprotein subunit)		P0AC47; P0ACB4; P76111
P00370	DHE4_ECOLI	gdhA b1761 JW1750	NADP-specific glutamate dehydrogenase (NADP-GDH) (EC 1.4.1.4)		
P00393	NDH_ECOLI	ndh b1109 JW1095	Type II NADH:quinone oxidoreductase (EC 1.6.5.9) (Cupric reductase) (EC 1.16.1.-) (NADH dehydrogenase-2) (NADH dh II) (NDH-2) (NADH-quinone reductase) (NQR) (NADH:ubiquinone oxidoreductase) (Respiratory NADH dehydrogenase)		
P00448	SODM_ECOLI	sodA b3908 JW3879	Superoxide dismutase [Mn] (EC 1.15.1.1) (MnSOD)		
P00452	RIR1_ECOLI	nrdA dnaF b2234 JW2228	Ribonucleoside-diphosphate reductase 1 subunit alpha (EC 1.17.4.1) (Protein B1) (Ribonucleoside-diphosphate reductase 1 R1 subunit) (Ribonucleotide reductase 1)		P00452; P69924
P00490	PHSM_ECOLI	malP b3417 JW5689	Maltodextrin phosphorylase (EC 2.4.1.1)		
P00509	AAT_ECOLI	aspC b0928 JW0911	Aspartate aminotransferase (AspAT) (EC 2.6.1.1) (Transaminase A)		P00509
P00550	PTM3C_ECOLI	mtlA b3599 JW3573	PTS system mannitol-specific EIICBA component (EIICBA-Mtl) (EII-Mtl) [Includes: Mannitol permease IIC component (PTS system mannitol-specific EIIC component); Mannitol-specific phosphotransferase enzyme IIB component (EC 2.7.1.197) (PTS system mannitol-specific EIIB component); Mannitol-specific phosphotransferase enzyme IIA component (PTS system mannitol-specific EIIA component)]		
P00561	AK1H_ECOLI	thrA thrA1 thrA2 b0002 JW0001	Bifunctional aspartokinase/homoserine dehydrogenase 1 (Aspartokinase I/homoserine dehydrogenase I) (AKI-HDI) [Includes: Aspartokinase (EC 2.7.2.4); Homoserine dehydrogenase (EC 1.1.1.3)]	PATHWAY: Amino-acid biosynthesis; L-lysine biosynthesis via DAP pathway; (S)-tetrahydrodipicolinate from L-aspartate: step 1/4. {ECO:0000250|UniProtKB:Q9SA18}.; PATHWAY: Amino-acid biosynthesis; L-methionine biosynthesis via de novo pathway; L-homoserine from L-aspartate: step 1/3. {ECO:0000250|UniProtKB:Q9SA18}.; PATHWAY: Amino-acid biosynthesis; L-methionine biosynthesis via de novo pathway; L-homoserine from L-aspartate: step 3/3. {ECO:0000250|UniProtKB:Q9SA18}.; PATHWAY: Amino-acid biosynthesis; L-threonine biosynthesis; L-threonine from L-aspartate: step 1/5. {ECO:0000250|UniProtKB:Q9SA18}.; PATHWAY: Amino-acid biosynthesis; L-threonine biosynthesis; L-threonine from L-aspartate: step 3/5. {ECO:0000250|UniProtKB:Q9SA18}.	
P00562	AK2H_ECOLI	metL metM b3940 JW3911	Bifunctional aspartokinase/homoserine dehydrogenase 2 (Aspartokinase II/homoserine dehydrogenase II) (AKII-HDII) [Includes: Aspartokinase (EC 2.7.2.4); Homoserine dehydrogenase (EC 1.1.1.3)]	PATHWAY: Amino-acid biosynthesis; L-lysine biosynthesis via DAP pathway; (S)-tetrahydrodipicolinate from L-aspartate: step 1/4. {ECO:0000250|UniProtKB:Q9SA18}.; PATHWAY: Amino-acid biosynthesis; L-methionine biosynthesis via de novo pathway; L-homoserine from L-aspartate: step 1/3. {ECO:0000250|UniProtKB:Q9SA18}.; PATHWAY: Amino-acid biosynthesis; L-methionine biosynthesis via de novo pathway; L-homoserine from L-aspartate: step 3/3. {ECO:0000250|UniProtKB:Q9SA18}.; PATHWAY: Amino-acid biosynthesis; L-threonine biosynthesis; L-threonine from L-aspartate: step 1/5. {ECO:0000250|UniProtKB:Q9SA18}.; PATHWAY: Amino-acid biosynthesis; L-threonine biosynthesis; L-threonine from L-aspartate: step 3/5. {ECO:0000250|UniProtKB:Q9SA18}.	
P00579	RPOD_ECOLI	rpoD alt b3067 JW3039	RNA polymerase sigma factor RpoD (Sigma-70)		P0A8V2; P0A8T7; P0AFX4; P32267
P00582	DPO1_ECOLI	polA resA b3863 JW3835	DNA polymerase I (POL I) (EC 2.7.7.7)		
P00634	PPB_ECOLI	phoA b0383 JW0374	Alkaline phosphatase (APase) (EC 3.1.3.1)		P0AEG4; P10408; Q5S007
P00722	BGAL_ECOLI	lacZ b0344 JW0335	Beta-galactosidase (Beta-gal) (EC 3.2.1.23) (Lactase)		P00722
P00803	LEP_ECOLI	lepB b2568 JW2552	Signal peptidase I (SPase I) (EC 3.4.21.89) (Leader peptidase I)		
P00804	LSPA_ECOLI	lspA lsp b0027 JW0025	Lipoprotein signal peptidase (EC 3.4.23.36) (Prolipoprotein signal peptidase) (Signal peptidase II) (SPase II)	PATHWAY: Protein modification; lipoprotein biosynthesis (signal peptide cleavage). {ECO:0000255|HAMAP-Rule:MF_00161}.	
P00805	ASPG2_ECOLI	ansB b2957 JW2924	L-asparaginase 2 (EC 3.5.1.1) (L-asparaginase II) (L-ASNase II) (L-asparagine amidohydrolase II) (Colaspase)		P00805
P00811	AMPC_ECOLI	ampC ampA b4150 JW4111	Beta-lactamase (EC 3.5.2.6) (Cephalosporinase) (CSase)		
P00861	DCDA_ECOLI	lysA b2838 JW2806	Diaminopimelate decarboxylase (DAP decarboxylase) (DAPDC) (EC 4.1.1.20)	PATHWAY: Amino-acid biosynthesis; L-lysine biosynthesis via DAP pathway; L-lysine from DL-2,6-diaminopimelate: step 1/1. {ECO:0000269|PubMed:14343156}.	P0AE88
P00864	CAPP_ECOLI	ppc glu b3956 JW3928	Phosphoenolpyruvate carboxylase (PEPC) (PEPCase) (EC 4.1.1.31)		
P00888	AROF_ECOLI	aroF b2601 JW2582	Phospho-2-dehydro-3-deoxyheptonate aldolase, Tyr-sensitive (EC 2.5.1.54) (3-deoxy-D-arabino-heptulosonate 7-phosphate synthase) (DAHP synthase) (Phospho-2-keto-3-deoxyheptonate aldolase)	PATHWAY: Metabolic intermediate biosynthesis; chorismate biosynthesis; chorismate from D-erythrose 4-phosphate and phosphoenolpyruvate: step 1/7.	
P00893	ILVI_ECOLI	ilvI b0077 JW0076	Acetolactate synthase isozyme 3 large subunit (EC 2.2.1.6) (AHAS-III) (ALS-III) (Acetohydroxy-acid synthase III large subunit)	PATHWAY: Amino-acid biosynthesis; L-isoleucine biosynthesis; L-isoleucine from 2-oxobutanoate: step 1/4.; PATHWAY: Amino-acid biosynthesis; L-valine biosynthesis; L-valine from pyruvate: step 1/4.	
P00894	ILVH_ECOLI	ilvH brnP b0078 JW0077	Acetolactate synthase isozyme 3 small subunit (EC 2.2.1.6) (ALS-III) (Acetohydroxy-acid synthase III small subunit) (AHAS-III)	PATHWAY: Amino-acid biosynthesis; L-isoleucine biosynthesis; L-isoleucine from 2-oxobutanoate: step 1/4.; PATHWAY: Amino-acid biosynthesis; L-valine biosynthesis; L-valine from pyruvate: step 1/4.	
P00903	PABA_ECOLI	pabA b3360 JW3323	Aminodeoxychorismate synthase component 2 (ADC synthase) (ADCS) (EC 2.6.1.85) (4-amino-4-deoxychorismate synthase component 2) (Aminodeoxychorismate synthase, glutamine amidotransferase component)	PATHWAY: Cofactor biosynthesis; tetrahydrofolate biosynthesis; 4-aminobenzoate from chorismate: step 1/2.	
P00904	TRPGD_ECOLI	trpGD trpD b1263 JW1255	Bifunctional protein TrpGD [Includes: Anthranilate synthase component 2 (AS) (ASII) (EC 4.1.3.27) (Anthranilate synthase, glutamine amidotransferase component); Anthranilate phosphoribosyltransferase (EC 2.4.2.18)]	PATHWAY: Amino-acid biosynthesis; L-tryptophan biosynthesis; L-tryptophan from chorismate: step 1/5. {ECO:0000305|PubMed:2428387, ECO:0000305|PubMed:4567790, ECO:0000305|PubMed:5333199}.; PATHWAY: Amino-acid biosynthesis; L-tryptophan biosynthesis; L-tryptophan from chorismate: step 2/5. {ECO:0000305|PubMed:2428387, ECO:0000305|PubMed:4567790, ECO:0000305|PubMed:5333199}.	
P00914	PHR_ECOLI	phrB phr b0708 JW0698	Deoxyribodipyrimidine photo-lyase (EC 4.1.99.3) (DNA photolyase) (Photoreactivating enzyme)		P68739
P00926	SDHD_ECOLI	dsdA b2366 JW2363	D-serine dehydratase (EC 4.3.1.18) (D-serine deaminase) (DSD)		
P00935	METB_ECOLI	metB b3939 JW3910	Cystathionine gamma-synthase (CGS) (EC 2.5.1.48) (O-succinylhomoserine (thiol)-lyase)	PATHWAY: Amino-acid biosynthesis; L-methionine biosynthesis via de novo pathway; L-cystathionine from O-succinyl-L-homoserine: step 1/1.	
P00936	CYAA_ECOLI	cyaA cya b3806 JW3778	Adenylate cyclase (EC 4.6.1.1) (ATP pyrophosphate-lyase) (Adenylyl cyclase)		P15038
P00946	MANA_ECOLI	manA pmi b1613 JW1605	Mannose-6-phosphate isomerase (EC 5.3.1.8) (Phosphohexomutase) (Phosphomannose isomerase) (PMI)		P18196
P00956	SYI_ECOLI	ileS ilvS b0026 JW0024	Isoleucine--tRNA ligase (EC 6.1.1.5) (Isoleucyl-tRNA synthetase) (IleRS)		P19930; P02925; P0CE47; P39336
P00957	SYA_ECOLI	alaS lovB b2697 JW2667	Alanine--tRNA ligase (EC 6.1.1.7) (Alanyl-tRNA synthetase) (AlaRS) (Protein lactyltransferase) (EC 6.-.-.-)		P00957
P00959	SYM_ECOLI	metG b2114 JW2101	Methionine--tRNA ligase (EC 6.1.1.10) (Methionyl transfer RNA synthetase) (Methionyl-tRNA synthetase) (MTS) (MetRS)		P60422
P00962	SYQ_ECOLI	glnS b0680 JW0666	Glutamine--tRNA ligase (EC 6.1.1.18) (Glutaminyl-tRNA synthetase) (GlnRS)		
P00963	ASNA_ECOLI	asnA b3744 JW3722	Aspartate--ammonia ligase (EC 6.3.1.1) (Asparagine synthetase A)	PATHWAY: Amino-acid biosynthesis; L-asparagine biosynthesis; L-asparagine from L-aspartate (ammonia route): step 1/1.	P00963
P00968	CARB_ECOLI	carB pyrA b0033 JW0031	Carbamoyl phosphate synthase large chain (EC 6.3.4.16) (EC 6.3.5.5) (Carbamoyl phosphate synthetase ammonia chain)	PATHWAY: Amino-acid biosynthesis; L-arginine biosynthesis; carbamoyl phosphate from bicarbonate: step 1/1. {ECO:0000255|HAMAP-Rule:MF_01210, ECO:0000305|Ref.8}.; PATHWAY: Pyrimidine metabolism; UMP biosynthesis via de novo pathway; (S)-dihydroorotate from bicarbonate: step 1/3. {ECO:0000255|HAMAP-Rule:MF_01210, ECO:0000305|Ref.8}.	P0A6F1
P02358	RS6_ECOLI	rpsF b4200 JW4158	Small ribosomal subunit protein bS6 (30S ribosomal protein S6) [Cleaved into: Small ribosomal subunit protein bS6, fully modified isoform; Small ribosomal subunit protein bS6, non-modified isoform]		P0A7T7
P02359	RS7_ECOLI	rpsG b3341 JW3303	Small ribosomal subunit protein uS7 (30S ribosomal protein S7)		P0A707; P37765; P0A850
P02916	MALF_ECOLI	malF b4033 JW3993	Maltose/maltodextrin transport system permease protein MalF		P0AEX9; P68183
P02918	PBPA_ECOLI	mrcA ponA b3396 JW3359	Penicillin-binding protein 1A (PBP-1a) (PBP1a) [Includes: Penicillin-insensitive transglycosylase (EC 2.4.99.28) (Peptidoglycan TGase); Penicillin-sensitive transpeptidase (EC 3.4.16.4) (DD-transpeptidase)]	PATHWAY: Cell wall biogenesis; peptidoglycan biosynthesis. {ECO:0000269|PubMed:7006606}.	P45464; P0AD65
P02919	PBPB_ECOLI	mrcB pbpF ponB b0149 JW0145	Penicillin-binding protein 1B (PBP-1b) (PBP1b) (Murein polymerase) [Includes: Penicillin-insensitive transglycosylase (EC 2.4.99.28) (Peptidoglycan TGase) (Peptidoglycan glycosyltransferase); Penicillin-sensitive transpeptidase (EC 3.4.16.4) (DD-transpeptidase)]	PATHWAY: Cell wall biogenesis; peptidoglycan biosynthesis.	P0AD68; P29131; P0AB38
P02920	LACY_ECOLI	lacY b0343 JW0334	Lactose permease (Lactose-proton symport)		
P02921	MELB_ECOLI	melB mel-4 b4120 JW4081	Melibiose permease (Melibiose carrier) (Melibiose transporter) (Melibiose/cation symporter) (Na+ (Li+)/melibiose symporter) (Thiomethylgalactoside permease II)		
P02925	RBSB_ECOLI	rbsB prlB rbsP b3751 JW3730	Ribose import binding protein RbsB		P00956; P0AGI1
P02929	TONB_ECOLI	tonB exbA b1252 JW5195	Protein TonB		P0ABU7; P0ABV2; P13036; P05825; P06971; P69776
P02930	TOLC_ECOLI	tolC colE1-i mtcB mukA refI toc weeA b3035 JW5503	Outer membrane protein TolC (Multidrug efflux pump subunit TolC) (Outer membrane factor TolC)		P0AE06; P75830; P02930
P02931	OMPF_ECOLI	ompF cmlB coa cry tolF b0929 JW0912	Outer membrane porin F (Outer membrane protein 1A) (Outer membrane protein B) (Outer membrane protein F) (Outer membrane protein IA) (Porin OmpF)		P76506; P02931; P08083; P09883
P02942	MCP1_ECOLI	tsr cheD b4355 JW4318	Methyl-accepting chemotaxis protein I (MCP-I) (Serine chemoreceptor protein)		
P02943	LAMB_ECOLI	lamB malB b4036 JW3996	Maltoporin (Maltose outer membrane channel) (Maltose-inducible porin) (Phage lambda receptor protein)		P10408
P03004	DNAA_ECOLI	dnaA b3702 JW3679	Chromosomal replication initiator protein DnaA (EC 3.6.4.-)		P66817; P03004; P0ACB0; P0ABT2; P69931; P0ACF0; P18843; P60422
P03007	DPO3E_ECOLI	dnaQ mutD b0215 JW0205	DNA polymerase III subunit epsilon (EC 2.7.7.7)		P10443; P0A988; P06710; P28630; P0ABS8
P03018	UVRD_ECOLI	uvrD mutU pdeB rad recL b3813 JW3786	DNA helicase II (EC 5.6.2.4) (DNA 3'-5' helicase II)		P0A9P0; P25665; P23367; P0A8V2; P0A8T7
P03023	LACI_ECOLI	lacI b0345 JW0336	Lactose operon repressor		P03023
P03819	KEFC_ECOLI	kefC trkC b0047 JW0046	Glutathione-regulated potassium-efflux system protein KefC (K(+)/H(+) antiporter)		P0A754
P03959	KDPA_ECOLI	kdpA b0698 JW0686	Potassium-transporting ATPase potassium-binding subunit (ATP phosphohydrolase [potassium-transporting] A chain) (Potassium-binding and translocating subunit A) (Potassium-translocating ATPase A chain)		
P03960	KDPB_ECOLI	kdpB b0697 JW0685	Potassium-transporting ATPase ATP-binding subunit (EC 7.2.2.6) (ATP phosphohydrolase [potassium-transporting] B chain) (Potassium-binding and translocating subunit B) (Potassium-translocating ATPase B chain)		P03961
P03961	KDPC_ECOLI	kdpC b0696 JW0684	Potassium-transporting ATPase KdpC subunit (ATP phosphohydrolase [potassium-transporting] C chain) (Potassium-binding and translocating subunit C) (Potassium-translocating ATPase C chain)		P03960
P04036	DAPB_ECOLI	dapB b0031 JW0029	4-hydroxy-tetrahydrodipicolinate reductase (HTPA reductase) (EC 1.17.1.8)	PATHWAY: Amino-acid biosynthesis; L-lysine biosynthesis via DAP pathway; (S)-tetrahydrodipicolinate from L-aspartate: step 4/4. {ECO:0000255|HAMAP-Rule:MF_00102}.	
P04079	GUAA_ECOLI	guaA b2507 JW2491	GMP synthase [glutamine-hydrolyzing] (EC 6.3.5.2) (GMP synthetase) (GMPS) (Glutamine amidotransferase)	PATHWAY: Purine metabolism; GMP biosynthesis; GMP from XMP (L-Gln route): step 1/1.	P04079
P04152	UMUC_ECOLI	umuC b1184 JW1173	Protein UmuC (DNA polymerase V) (Pol V)		PRO_0000027305 [P0AG11]
P04391	OTC1_ECOLI	argI b4254 JW4211	Ornithine carbamoyltransferase subunit I (OTCase-1) (EC 2.1.3.3)	PATHWAY: Amino-acid biosynthesis; L-arginine biosynthesis; L-arginine from L-ornithine and carbamoyl phosphate: step 1/3. {ECO:0000305}.	
P04395	3MG2_ECOLI	alkA aidA b2068 JW2053	DNA-3-methyladenine glycosylase 2 (EC 3.2.2.21) (3-methyladenine-DNA glycosylase II, inducible) (TAG II) (DNA-3-methyladenine glycosidase II) (DNA-3-methyladenine glycosylase II)		P06959
P04425	GSHB_ECOLI	gshB gsh-II b2947 JW2914	Glutathione synthetase (EC 6.3.2.3) (GSH synthetase) (GSH-S) (GSHase) (Glutathione synthase)	PATHWAY: Sulfur metabolism; glutathione biosynthesis; glutathione from L-cysteine and L-glutamate: step 2/2.	
P04693	TYRB_ECOLI	tyrB b4054 JW4014	Aromatic-amino-acid aminotransferase (ARAT) (AROAT) (EC 2.6.1.57) (Beta-methylphenylalanine transaminase) (EC 2.6.1.107)	PATHWAY: Amino-acid biosynthesis; L-phenylalanine biosynthesis; L-phenylalanine from phenylpyruvate (ArAT route): step 1/1.; PATHWAY: Amino-acid biosynthesis; L-tyrosine biosynthesis; L-tyrosine from (4-hydroxyphenyl)pyruvate: step 1/1.	
P04805	SYE_ECOLI	gltX b2400 JW2395	Glutamate--tRNA ligase (EC 6.1.1.17) (Glutamyl-tRNA synthetase) (GluRS)		P76160
P04825	AMPN_ECOLI	pepN b0932 JW0915	Aminopeptidase N (EC 3.4.11.2) (Alpha-aminoacylpeptide hydrolase)		P19318; P04825
P04968	ILVA_ECOLI	ilvA b3772 JW3745	L-threonine dehydratase biosynthetic IlvA (EC 4.3.1.19) (Threonine deaminase)	PATHWAY: Amino-acid biosynthesis; L-isoleucine biosynthesis; 2-oxobutanoate from L-threonine: step 1/1.	
P04982	RBSD_ECOLI	rbsD b3748 JW5857	D-ribose pyranase (EC 5.4.99.62)	PATHWAY: Carbohydrate metabolism; D-ribose degradation; D-ribose 5-phosphate from beta-D-ribopyranose: step 1/2.	
P04983	RBSA_ECOLI	rbsA b3749 JW3728	Ribose import ATP-binding protein RbsA (EC 7.5.2.7)		P16685; P0AGI1
P04993	RECD_ECOLI	recD hopE b2819 JW2787	RecBCD enzyme subunit RecD (EC 5.6.2.3) (DNA 5'-3' helicase subunit RecB) (Exodeoxyribonuclease V 67 kDa polypeptide) (Exodeoxyribonuclease V alpha chain) (Exonuclease V subunit RecD) (ExoV subunit RecD) (Helicase/nuclease RecBCD subunit RecD)		
P04994	EX7L_ECOLI	xseA b2509 JW2493	Exodeoxyribonuclease 7 large subunit (EC 3.1.11.6) (Exodeoxyribonuclease VII large subunit) (ExoVII large subunit) (Exonuclease VII large subunit)		P76168
P04995	EX1_ECOLI	sbcB cpeA xonA b2011 JW1993	Exodeoxyribonuclease I (ExoI) (Exonuclease I) (EC 3.1.11.1) (DNA deoxyribophosphodiesterase) (dRPase)		
P05020	PYRC_ECOLI	pyrC b1062 JW1049	Dihydroorotase (DHOase) (EC 3.5.2.3)	PATHWAY: Pyrimidine metabolism; UMP biosynthesis via de novo pathway; (S)-dihydroorotate from bicarbonate: step 3/3. {ECO:0000255|HAMAP-Rule:MF_00219, ECO:0000305}.	
P05041	PABB_ECOLI	pabB b1812 JW1801	Aminodeoxychorismate synthase component 1 (ADC synthase) (ADCS) (EC 2.6.1.85) (4-amino-4-deoxychorismate synthase component 1)	PATHWAY: Cofactor biosynthesis; tetrahydrofolate biosynthesis; 4-aminobenzoate from chorismate: step 1/2.	
P05042	FUMC_ECOLI	fumC b1611 JW1603	Fumarate hydratase class II (Fumarase C) (EC 4.2.1.2) (Aerobic fumarase) (Iron-independent fumarase)	PATHWAY: Carbohydrate metabolism; tricarboxylic acid cycle; (S)-malate from fumarate: step 1/1. {ECO:0000255|HAMAP-Rule:MF_00743, ECO:0000305}.	
P05050	ALKB_ECOLI	alkB aidD b2212 JW2200	Alpha-ketoglutarate-dependent dioxygenase AlkB (EC 1.14.11.33) (Alkylated DNA repair protein AlkB) (DNA oxidative demethylase AlkB)		
P05055	PNP_ECOLI	pnp b3164 JW5851	Polyribonucleotide nucleotidyltransferase (EC 2.7.7.8) (Polynucleotide phosphorylase) (PNPase)		P05055; P0A8J8; P21513; P21507
P05194	AROD_ECOLI	aroD b1693 JW1683	3-dehydroquinate dehydratase (3-dehydroquinase) (EC 4.2.1.10) (Type I DHQase) (Type I dehydroquinase) (DHQ1)	PATHWAY: Metabolic intermediate biosynthesis; chorismate biosynthesis; chorismate from D-erythrose 4-phosphate and phosphoenolpyruvate: step 3/7. {ECO:0000255|HAMAP-Rule:MF_00214}.	
P05458	PTRA_ECOLI	ptrA ptr b2821 JW2789	Protease 3 (EC 3.4.24.55) (Pitrilysin) (Protease III) (Protease pi)		
P05523	FPG_ECOLI	mutM fpg b3635 JW3610	Formamidopyrimidine-DNA glycosylase (Fapy-DNA glycosylase) (EC 3.2.2.23) (DNA-(apurinic or apyrimidinic site) lyase MutM) (AP lyase MutM) (EC 4.2.99.18)		
P05637	APAH_ECOLI	apaH b0049 JW0048	Bis(5'-nucleosyl)-tetraphosphatase [symmetrical] (EC 3.6.1.41) (Ap4A hydrolase) (Diadenosine 5',5'''-P1,P4-tetraphosphate pyrophosphohydrolase) (Diadenosine tetraphosphatase)		
P05704	MCP3_ECOLI	trg b1421 JW1417	Methyl-accepting chemotaxis protein III (MCP-III) (Ribose and galactose chemoreceptor protein)		P45543
P05791	ILVD_ECOLI	ilvD b3771 JW5605	Dihydroxy-acid dehydratase (DAD) (EC 4.2.1.9)	PATHWAY: Amino-acid biosynthesis; L-isoleucine biosynthesis; L-isoleucine from 2-oxobutanoate: step 3/4. {ECO:0000255|HAMAP-Rule:MF_00012, ECO:0000269|PubMed:3550695}.; PATHWAY: Amino-acid biosynthesis; L-valine biosynthesis; L-valine from pyruvate: step 3/4. {ECO:0000255|HAMAP-Rule:MF_00012, ECO:0000269|PubMed:3550695}.	
P05793	ILVC_ECOLI	ilvC b3774 JW3747	Ketol-acid reductoisomerase (NADP(+)) (KARI) (EC 1.1.1.86) (Acetohydroxy-acid isomeroreductase) (AHIR) (Alpha-keto-beta-hydroxylacyl reductoisomerase) (Ketol-acid reductoisomerase type 2) (Ketol-acid reductoisomerase type II)	PATHWAY: Amino-acid biosynthesis; L-isoleucine biosynthesis; L-isoleucine from 2-oxobutanoate: step 2/4. {ECO:0000255|HAMAP-Rule:MF_00435, ECO:0000305|PubMed:2653423}.; PATHWAY: Amino-acid biosynthesis; L-valine biosynthesis; L-valine from pyruvate: step 2/4. {ECO:0000255|HAMAP-Rule:MF_00435, ECO:0000305|PubMed:2653423}.	
P05804	BGLR_ECOLI	uidA gurA gusA b1617 JW1609	Beta-glucuronidase (GUS) (EC 3.2.1.31) (Beta-D-glucuronoside glucuronosohydrolase) (EcGUS) (UID)		
P05824	RECN_ECOLI	recN radB b2616 JW5416	DNA repair protein RecN (Recombination protein N)		P76104
P05825	FEPA_ECOLI	fepA fep feuB b0584 JW5086	Ferrienterobactin receptor (Enterobactin outer-membrane receptor)		P02929
P05852	TSAD_ECOLI	tsaD gcp ygjD b3064 JW3036	tRNA N6-adenosine threonylcarbamoyltransferase (EC 2.3.1.234) (N6-L-threonylcarbamoyladenine synthase) (t(6)A synthase) (t(6)A37 threonylcarbamoyladenosine biosynthesis protein TsaD) (tRNA threonylcarbamoyladenosine biosynthesis protein TsaD)		P76256
P06129	BTUB_ECOLI	btuB bfe cer dcrC b3966 JW3938	Vitamin B12 transporter BtuB (Cobalamin receptor) (Outer membrane cobalamin translocator)		
P06134	ADA_ECOLI	ada b2213 JW2201	Bifunctional transcriptional activator/DNA repair enzyme Ada (Regulatory protein of adaptive response) [Includes: Methylphosphotriester-DNA--protein-cysteine S-methyltransferase (EC 2.1.1.n11) (Methylphosphotriester-DNA methyltransferase); Methylated-DNA--protein-cysteine methyltransferase (EC 2.1.1.63) (O6-methylguanine-DNA alkyltransferase)]		P69931
P06136	FTSQ_ECOLI	ftsQ b0093 JW0091	Cell division protein FtsQ		P0A6S5; P0AD68; P46889; P0AEN4; P29131; P06136; P0ABG4; P58034
P06149	DLD_ECOLI	dld b2133 JW2121	Quinone-dependent D-lactate dehydrogenase (EC 1.1.5.12) ((R)-lactate:quinone 2-oxidoreductase) (D-lactate dehydrogenase) (D-LDH) (Respiratory D-lactate dehydrogenase)		
P06609	BTUC_ECOLI	btuC b1711 JW1701	Vitamin B12 import system permease protein BtuC		P06609; P06611; P37028
P06611	BTUD_ECOLI	btuD b1709 JW1699	Vitamin B12 import ATP-binding protein BtuD (EC 7.6.2.8) (Vitamin B12-transporting ATPase)		P06609
P06612	TOP1_ECOLI	topA supX b1274 JW1266	DNA topoisomerase 1 (EC 5.6.2.1) (DNA topoisomerase I) (Omega-protein) (Relaxing enzyme) (Swivelase) (Untwisting enzyme)		P27862
P06616	ERA_ECOLI	era rbaA sdgE b2566 JW2550	GTPase Era (ERA) (GTP-binding protein Era)		
P06709	BIRA_ECOLI	birA bioR dhbB b3973 JW3941	Bifunctional ligase/repressor BirA (Biotin operon repressor) (Biotin--[acetyl-CoA-carboxylase] ligase) (EC 6.3.4.15) (Biotin--protein ligase) (Biotin-[acetyl-CoA carboxylase] synthetase)		P0A761
P06710	DPO3X_ECOLI	dnaX dnaZ dnaZX b0470 JW0459	DNA polymerase III subunit tau (EC 2.7.7.7) (DNA polymerase III subunit gamma)		P11989; P0ACB0; P10443; P0A988; P03007; P06710; P20605; P28630; P28631; P28905; P28632; P0A7L0; P0AGE0; P28630; P28631; P06710-2; P28630; P28632; P23367
P06715	GSHR_ECOLI	gor b3500 JW3467	Glutathione reductase (GR) (GRase) (EC 1.8.1.7)		
P06721	METC_ECOLI	metC b3008 JW2975	Cystathionine beta-lyase MetC (CBL) (CL) (EC 4.4.1.13) (Beta-cystathionase MetC) (Cysteine desulfhydrase MetC) (CD) (EC 4.4.1.28) (Cysteine lyase MetC) (Cysteine-S-conjugate beta-lyase MetC)	PATHWAY: Amino-acid biosynthesis; L-methionine biosynthesis via de novo pathway; L-homocysteine from L-cystathionine: step 1/1. {ECO:0000305}.	
P06722	MUTH_ECOLI	mutH mutR prv b2831 JW2799	DNA mismatch repair protein MutH (Methyl-directed mismatch repair protein)		P76217; P23367
P06959	ODP2_ECOLI	aceF b0115 JW0111	Dihydrolipoyllysine-residue acetyltransferase component of pyruvate dehydrogenase complex (EC 2.3.1.12) (Dihydrolipoamide acetyltransferase component of pyruvate dehydrogenase complex) (E2)		P04395; P0AED9; P32053; P0A9P0; P0ADI0; P24230; P30014; P67087; P07604
P06960	OTC2_ECOLI	argF b0273 JW0266	Ornithine carbamoyltransferase subunit F (OTCase-2) (EC 2.1.3.3)	PATHWAY: Amino-acid biosynthesis; L-arginine biosynthesis; L-arginine from L-ornithine and carbamoyl phosphate: step 1/3. {ECO:0000305}.	
P06961	CCA_ECOLI	cca b3056 JW3028	Multifunctional CCA protein [Includes: CCA-adding enzyme (EC 2.7.7.72) (CCA tRNA nucleotidyltransferase) (tRNA CCA-pyrophosphorylase) (tRNA adenylyl-/cytidylyl-transferase) (tRNA nucleotidyltransferase) (tRNA-NT); 2'-nucleotidase (EC 3.1.3.-); 2',3'-cyclic phosphodiesterase (EC 3.1.4.-); Phosphatase (EC 3.1.3.-)]		P0A6M4
P06968	DUT_ECOLI	dut dnaS sof b3640 JW3615	Deoxyuridine 5'-triphosphate nucleotidohydrolase (dUTPase) (EC 3.6.1.23) (dUTP pyrophosphatase)	PATHWAY: Pyrimidine metabolism; dUMP biosynthesis; dUMP from dCTP (dUTP route): step 2/2.	
P06971	FHUA_ECOLI	fhuA tonA b0150 JW0146	Ferrichrome outer membrane transporter/phage receptor (Ferric hydroxamate receptor) (Ferric hydroxamate uptake) (Ferrichrome-iron receptor)		P02929; Q9X2V7
P06972	FHUB_ECOLI	fhuB b0153 JW0149	Iron(3+)-hydroxamate import system permease protein FhuB (Ferric hydroxamate uptake protein B) (Ferrichrome transport system permease protein FhuB) (Ferrichrome uptake protein FhuB) (Iron(III)-hydroxamate import system permease protein FhuB)		
P06974	FLIM_ECOLI	fliM cheC2 fla AII fla QII b1945 JW1929	Flagellar motor switch protein FliM		P0ABZ1; P15070; P76010
P06983	HEM3_ECOLI	hemC popE b3805 JW5932	Porphobilinogen deaminase (PBG) (EC 2.5.1.61) (Hydroxymethylbilane synthase) (HMBS) (Pre-uroporphyrinogen synthase)	PATHWAY: Porphyrin-containing compound metabolism; protoporphyrin-IX biosynthesis; coproporphyrinogen-III from 5-aminolevulinate: step 2/4. {ECO:0000305|PubMed:3052434}.	
P06988	HISX_ECOLI	hisD b2020 JW2002	Histidinol dehydrogenase (HDH) (EC 1.1.1.23)	PATHWAY: Amino-acid biosynthesis; L-histidine biosynthesis; L-histidine from 5-phospho-alpha-D-ribose 1-diphosphate: step 9/9. {ECO:0000255|HAMAP-Rule:MF_01024}.	
P06992	RSMA_ECOLI	rsmA ksgA b0051 JW0050	Ribosomal RNA small subunit methyltransferase A (EC 2.1.1.182) (16S rRNA (adenine(1518)-N(6)/adenine(1519)-N(6))-dimethyltransferase) (16S rRNA dimethyladenosine transferase) (16S rRNA dimethylase) (High level kasugamycin resistance protein KsgA) (Kasugamycin dimethyltransferase) (S-adenosylmethionine-6-N', N'-adenosyl(rRNA) dimethyltransferase)		
P06993	MALT_ECOLI	malT malA b3418 JW3381	HTH-type transcriptional regulator MalT (ATP-dependent transcriptional activator MalT)		P08622; P31574; P52613; P0ACG8; P06993; P23256; P36979
P06996	OMPC_ECOLI	ompC meoA par b2215 JW2203	Outer membrane porin C (Outer membrane protein 1B) (Outer membrane protein C) (Porin OmpC)		P0C0V0; P76506
P06999	PFKB_ECOLI	pfkB b1723 JW5280	ATP-dependent 6-phosphofructokinase isozyme 2 (ATP-PFK 2) (Phosphofructokinase 2) (EC 2.7.1.11) (6-phosphofructokinase isozyme II) (Phosphohexokinase 2)	PATHWAY: Carbohydrate degradation; glycolysis; D-glyceraldehyde 3-phosphate and glycerone phosphate from D-glucose: step 3/4.	P06999
